metroscuadradostotales,precio,titulo,latitud,longitud,preciomt2
300,310000,Magnifica Casa en Venta Ceibos,-2.1649999618530273,-79.94499969482422,1033.3333333333333
185,190000,Belo Horizonte Via a La Costa Vendo Casa,-2.1710000038146973,-79.89800262451172,1027.027027027027
110,25000,25.000 Casa con Loza en Construcción,-2.138768434524536,-79.59405517578125,227.27272727272728
42,78000,"Venta de Suite Amoblada en Punta Centinela DeCameron, Salinas",-2.1600000858306885,-79.88600158691406,1857.142857142857
140,67000,Casa de Venta en Mucho Lote 1 140 m²,-2.0820000171661377,-79.9209976196289,478.57142857142856
65,118000,Samborondon Plaza Vendo Suite Amoblada,-2.18935489654541,-79.88920593261719,1815.3846153846155
144,170000,Guayacanes Vendo Casa de 3 Pisos,-2.18935489654541,-79.88920593261719,1180.5555555555557
75,68000,Villa Del Rey Vendo Casa 3 Habitaciones,-2.18935489654541,-79.88920593261719,906.6666666666666
150,160000,VENDO DEPARTAMENTO EN TERRANOSTRA,-2.178999900817871,-79.88600158691406,1066.6666666666667
392,275000,Vendo Amplio Departamento en Lomas de Urdesa,-2.1659998893737793,-79.90399932861328,701.530612244898
100,65000,Vendo O/ Alquilo Departamento Grande,-2.11899995803833,-79.88700103759766,650.0
420,80000,VENDO CASA DE 3 PISOS,-2.2660000324249268,-79.8740005493164,190.47619047619048
200,140000,"Venta de Casa Al Sur, Barrio Centenario",-2.155313014984131,-79.91221618652344,700.0
200,88000,Vendo casa en la 29ava,-2.194999933242798,-79.91300201416016,440.0
120,35000,Vendo Casa,-2.2185044288635254,-79.93897247314453,291.6666666666667
136,145000,Se Vende Lindo Departamento en Kennedy Norte A-103,-2.1570000648498535,-79.9010009765625,1066.1764705882354
196,130000,CASA DE OPORTUNIDAD EN GUAYACANES / 130.000 NEGOCIABLES,-2.11899995803833,-79.89099884033203,663.265306122449
400,139000,Venta Departamento Penthouse Lomas de Urdesa Espectacular Vista,-2.1640000343322754,-79.90699768066406,347.5
200,45000,Casa en Venta Sector La Playita,-2.2920000553131104,-79.88500213623047,225.0
120,40000,Casa en Venta,-2.1010000705718994,-79.94200134277344,333.3333333333333
40,111,"Se Vende Casa, Sur de Guayaquil 7x20",-2.2090001106262207,-79.93699645996094,2.775
220,95000,Vendo Casa Cdla. Quisquis 2 Pisos,-2.2339999675750732,-79.89299774169922,431.8181818181818
80,52000,Villa en El Cento,-2.1429998874664307,-79.91300201416016,650.0
120,75000,EN VENTA CASA SECTOR ATARAZANA,-2.1730000972747803,-79.88200378417969,625.0
75,38000,Se Vende Lindo Departamento en El Centro 75 m²,-2.2079999446868896,-79.88899993896484,506.6666666666667
250,240000,Almendros Casa Remodelada Venta 329 m²,-2.2300000190734863,-79.89299774169922,960.0
180,125000,Venta Casa Urdenor1,-2.1715214252471924,-79.87751007080078,694.4444444444445
85,75000,Se Vende Casa en Sauces 8 Dos Plantas,-2.128999948501587,-79.90299987792969,882.3529411764706
400,147000,Centenario Vendo Casa Rentera Dos Departamentos,-2.188999891281128,-79.88899993896484,367.5
200,190000,Belo Horizonte Vendo Casa de 4 habitaciones,-2.188999891281128,-79.88899993896484,950.0
250,280000,Venta de Casa en Urb. Puerto Azul,-2.172133207321167,-79.91678619384766,1120.0
150,65000,SE VENDE CASA EN EL CERRO DEL CARMEN,-2.188999891281128,-79.88899993896484,433.3333333333333
140,110000,Casa en Venta Santa Adriana de Lujo,-2.1470000743865967,-79.91200256347656,785.7142857142857
160,69000,CASA EN VENTA EN GUAYAQUIL,-2.255000114440918,-79.90899658203125,431.25
46,75000,"Suite Amoblada en Venta, Edificio City Suites - G. Higuera",-2.1440000534057617,-79.91000366210938,1630.4347826086957
200,155000,Alborada 12va etapa casa rentera esquinera,-2.1480534076690674,-79.88420104980469,775.0
8,50000,Casa de Venta,-2.122,-79.968,6250.0
120,1,Vendo Casa Sólo Interesados,-2.0959999561309814,-79.9229965209961,0.008333333333333333
60,60000,Hermosa casa de campo Pallatanga,-2.189412832260132,-79.88906860351562,1000.0
36,50000,Vendo Villa en Los Esteros,-2.24399995803833,-79.90699768066406,1388.888888888889
378,180000,Se Vende Casa Bellavista Alta 378 m²,-2.180000066757202,-79.91100311279297,476.1904761904762
160,125000,Hermosa Casa en Villa Club Etapa,-2.2019999027252197,-79.88500213623047,781.25
72,45000,Villa en Venta,-2.188999891281128,-79.88899993896484,625.0
180,40000,Casa Esquinera Guasmo Sur,-2.183000087738037,-79.91100311279297,222.22222222222223
454,330000,Se Vende Hermosa Casa 454 m² La Ribera Samborondon,-2.0739998817443848,-79.89099884033203,726.8722466960353
290,320000,"Venta de Casa en Lorenzo de Garaicoa y Luis Urdaneta, Centro de Guayaquil",-2.190000057220459,-79.88099670410156,1103.448275862069
284,175000,"Venta de Departamento en la Urb. Puerto Azul, Via a la Costa - Amparo Marín",-2.191999912261963,-79.96700286865234,616.1971830985915
308,175000,VENTA CASA 4 PISOS,-2.188999891281128,-79.88899993896484,568.1818181818181
120,125000,Vendo Hermosa Casa,-2.1623611450195312,-79.94310450510919,1041.6666666666667
81,14000,Vendo Casa en Pedro Carbo,-2.0971240997314453,-79.92420196533203,172.8395061728395
215,235000,Oportunidad Casa en Kennedy Norte,-2.1559998989105225,-79.9020004272461,1093.0232558139535
72,45000,Casa de Venta en Villa España 1,-2.078,-79.922,625.0
150,45000,Vendo Casa,-2.193683624267578,-79.94073245252444,300.0
125,120000,"Departamento en Venta en el Portón de las Lomas de Urdesa, 2 Hab, 125 Mt2, Semiamoblado",-2.1640000343322754,-79.90699768066406,960.0
230,190000,Acuarela del Río Se Vende Casa de 230 m² Estreno,-2.134999990463257,-79.88400268554688,826.0869565217391
20,35000,#telovendo,-2.244999885559082,-79.89700317382812,1750.0
120,41000,Barrio Centenario,-2.168163887009991,-79.93319702148433,341.6666666666667
70,115000,"Departamento en Venta Conjunto Residencial Ciudad Colón , 1 Dorm, 2 Bañ, 70 Mt2",-2.1510000228881836,-79.90599822998047,1642.857142857143
286,45000,Vendo Casa en Salinas Ocasion 0994491508,-2.127,-79.905,157.34265734265733
72,45000,Casa en Remodelacion Las Orquídeas,-2.6742606163024902,-79.61031341552734,625.0
380,240000,Centenario,-1.5540000200271606,-79.76200103759766,631.578947368421
46,45,Vendo Hermosa Casa de Oportunidad..,-2.072999954223633,-79.92900085449219,0.9782608695652174
450,350000,"Venta de Casa en Alamos Norte, Guayaquil, norte, City mall, La Rotonda, Riocentro Norte. Comercial.",-2.132999897003174,-79.91300201416016,777.7777777777778
110,100000,DEPARTAMENTO EN VENTA 110M2 - ÁLAMOS NORTE,-2.1898771,-79.8877153,909.0909090909091
70,60000,Se Vende Casa en Pedro Pablo Gomez 2302,-2.0613925457000732,-79.91474914550781,857.1428571428571
120,58000,"Casa de venta en Metrópolis 2, una planta, dos dormitorios.",-2.065000057220459,-79.91699981689453,483.3333333333333
238,229000,Vendo Casa en Via a La Costa Terranostra,-2.197916269302368,-79.89493560791016,962.1848739495798
225,130000,Vendo Casa  Rentera de Dos Plantas,-2.1127028465270996,-79.90791320800781,577.7777777777778
90,700,Alquilo Moderno Depart. Kennedy Norte,-2.059079885482788,-79.89327239990234,7.777777777777778
115,80000,"Venta de Departamento en Lomas de Urdesa, cerca del C.C Policentro - Alban Borja, Norte de Guayaquil",-2.1640000343322754,-79.90699768066406,695.6521739130435
120,95000,Vendo Linda Casa  Urbanización Logare,-2.059079885482788,-79.89327239990234,791.6666666666666
450,149000,Vendo Casa,-2.121999979019165,-79.9020004272461,331.1111111111111
132,145000,Vendo Hermoso Departamento Puerto Azul,-2.059079885482788,-79.89327239990234,1098.4848484848485
114,68000,Venta Hermosa Casa Málaga 1,-2.059079885482788,-79.89327239990234,596.4912280701755
277,1,Vendo Casa Mixta en Sector Bahía,-2.2119998931884766,-79.93699645996094,0.0036101083032490976
120,55000,Casa Esquinera en Venta Pajaro Azul,-2.1294374465942383,-79.92732238769531,458.3333333333333
128,80000,Se Vende Villa,-2.1204257011413574,-79.88758087158203,625.0
74,35000,VENTA CASA UNA PLANTA SUBURBIO GUAYAQUIL OPORTUNIDAD!,-2.2079999446868896,-79.94200134277344,472.97297297297297
88,44000,"VENDO VILLA EN CDLA.. FLORESTA 1, MZ. 21 VILLA 11",-2.253000020980835,-79.88400268554688,500.0
134,215000,VENDO CASA EN ACUARELA DEL RíO,-2.11899995803833,-79.90399932861328,1604.4776119402984
400,70000,Casa en Venta,-2.0022356510162354,-77.53490447998047,175.0
120,58000,Apartamento Centro de Guayaquil,-2.187999963760376,-79.89199829101562,483.3333333333333
735,3100000,VENTA DE 2 PREDIOS JUNTOS CENTRO GUAYAQUIL (LA BAHÍA),-2.1989998817443848,-79.88500213623047,4217.687074829932
120,65000,VENTA DE CASA DE 2PLANTAS NORTE,-2.13100004196167,-79.91400146484375,541.6666666666666
12,35000,Vendo Una Casa,-2.125,-79.92400360107422,2916.6666666666665
105,33000,Vendo Casa en Mapasingue Este,-2.105,-79.991,314.2857142857143
409,300000,hermosa casa en portal al sol,-2.180000066757202,-79.98300170898438,733.4963325183375
120,90000,Casa con Negocio en Venta,-2.0989999771118164,-79.90399932861328,750.0
300,40000,Casa en Venta,-2.0510036945343018,-79.87647247314453,133.33333333333334
120,45000,VILLA en venta a 5 minutos del city mall y riocentro norte,-2.2660000324249268,-79.8740005493164,375.0
200,40000,Se Vende Casa en Playas Villamil,-2.065999984741211,-79.90899658203125,200.0
300,95000,Venta de propiedad en Duran,-2.184000015258789,-79.87999725341797,316.6666666666667
130,50000,¡vivienda de Oportunidad!,-2.0891013145446777,-79.91463470458984,384.61538461538464
16,20000,Se Vende por Motivo de Viaje Esta Casa,-2.1890544999999997,-79.88931290000001,1250.0
178,79000,Se vende hermosa casa en los sauces por estrenar.,-2.121999979019165,-79.89099884033203,443.82022471910113
94,73000,"Departamento en Venta en Nueva Kennedy, 2 Hab, 1 Bañ, 1 Parqueo, Norte de Guayaquil.",-2.177000045776367,-79.89600372314453,776.5957446808511
246,130000,"Casa de venta con suite independiente, en Urbanización San Felipe.",-2.1389999389648438,-79.9219970703125,528.4552845528456
126,42000,Vendo para Uso de Oficina O Departamento,-2.18999981880188,-79.88774108886719,333.3333333333333
120,38000,Vendo Casa Esquinera en El Fortin,-2.18935489654541,-79.88920593261719,316.6666666666667
81,32000,Vendo Casa en El Sur,-2.259000062942505,-79.87899780273438,395.0617283950617
160,105000,"Departamento en Venta Nueva Kennedy, 161 Mt2, 3 Hab, 3 Bañ, Balcón.",-2.177000045776367,-79.89600372314453,656.25
140,195000,Hermoso Departamento de Venta con Vista Al Mar. Ubicado en Salinas,-2.196000099182129,-79.91500091552734,1392.857142857143
96,55000,Casa en Los Vergeles,-2.1710000038146973,-79.9219970703125,572.9166666666666
135,145000,Hermosa Casa en Guayacanes en Venta,-2.118000030517578,-79.89299774169922,1074.0740740740741
120,22000,Vendo Casa Esquinera,-2.2119998931884766,-79.89600372314453,183.33333333333334
140,108000,Departamento en Lomas de Urdesa Perfecto,-2.164,-79.907,771.4285714285714
106,88000,Salinas Vendo Departamento,-2.1946566104888916,-79.92770385742188,830.188679245283
192,120000,Se Vende Casa Esquinera con 2 Locales,-2.1989998817443848,-79.9209976196289,625.0
160,185000,Vendo Casa en Cuidad Celeste,-2.0936617851257324,-79.91944122314453,1156.25
114,86000,"Departamento en Venta en Los Ceibos, 3 Hab, 3 Bañ, 1 Parqueo, Norte de Guayaquil.",-2.1670000553131104,-79.94499969482422,754.3859649122807
1730,30000,Venta de Casa con Finca Manabi,-2.18935489654541,-79.88920593261719,17.341040462427745
72,28000,Vendo Departamento,-2.128999948501587,-79.88600158691406,388.8888888888889
118,120000,Vendo Casa en Villa Club Etapa Iris,-2.1010000705718994,-79.90699768066406,1016.9491525423729
260,112000,Vendo Departamento . Ideal para Oficinas  o Vivienda Excelente Ubicación,-2.188999891281128,-79.88899993896484,430.7692307692308
145,65000,Vendo Departamento Centro Guayaquil,-2.13100004196167,-79.88600158691406,448.2758620689655
150,130000,Venta de Casa,-2.148,-79.893,866.6666666666666
189,85000,"Vendo Casa con Garaje 189,42mts2",-2.2006330490112305,-79.90830993652344,449.7354497354497
90,30000,de oportunidad venta de casa,-2.257999897003174,-79.90799713134766,333.3333333333333
174,95000,VENTA DE HERMOSA PROPIEDAD EN SAUCES 2 !!! 95000 NEGOCIABLE !!! CERCA DE TODO !!!,-2.138000011444092,-79.88800048828125,545.9770114942529
1496,250000,Casa en Venta en Lago de Capeira,-2.00600004196167,-79.96399688720703,167.11229946524065
85,60000,Vendo Una Casa de Dos Planta en Gyq,-2.2109999656677246,-79.91100311279297,705.8823529411765
194,130000,Se Vende Casa en Zona Residencial,-2.121929883956909,-79.95108032226562,670.1030927835052
220,180000,Venta de Casa Elegante en Garzota 3,-2.180000066757202,-79.90799713134766,818.1818181818181
84,50000,Vendo Casa de Alquiler,-2.0899999141693115,-79.93699645996094,595.2380952380952
200,40000,Vendo Una Casa Grande con Garaje Patio..,-2.128,-79.936,200.0
72,65000,Se Vende Casa Dos Plantas Villa España 1,-2.081786632537842,-79.92183685302734,902.7777777777778
290,150000,Vendo Casa en Samanes 6 Callr Ptincipal,-2.1216728687286377,-79.90001678466797,517.2413793103449
200,30000,Se Vende Casa en Mapasingue Este,-2.093212842941284,-79.89982604980469,150.0
500,260000,Casa en Venta-Garzota 1,-2.1500000953674316,-79.89399719238281,520.0
175,210000,En Venta Casa en Urb. Acuarelas del Río - J. MONCADA,-2.134999990463257,-79.88400268554688,1200.0
181,178800,Bosques de la Costa,-2.181999921798706,-79.97000122070312,987.8453038674033
110,87000,EN VENTA DEPARTAMENTO ALAMOS NORTE GUAYAQUIL,-2.1530001163482666,-79.94499969482422,790.9090909090909
72,38000,"Mucho Lote 1
4ta. Etapa",-2.091,-79.922,527.7777777777778
211,85000,VENTA DE CASA  CON LOCAL COMERCIAL TIPO BODEGAS,-2.196000099182129,-79.90599822998047,402.8436018957346
400,1,Casa en Salinas en Venta,-2.190999984741211,-79.89600372314453,0.0025
140,186000,Casa de Venta - Cdla Via al Sol,-2.188999891281128,-80.00800323486328,1328.5714285714287
300,260000,"Venta de Casa en Urb. Vicrieel, cerca del C.C Riocentro El Dorado, Via Samboronodon - Aurora",-2.152616262435913,-79.94510650634766,866.6666666666666
12,35000,Vendo Casa Tres Cuartos con Losa,-2.13700008392334,-79.91500091552734,2916.6666666666665
200,190000,Casas de Venta en Urb San Eduardo,-2.153491497039795,-79.83106231689453,950.0
72,45000,CASA EN MUCHO LOTE,-2.0869998931884766,-79.9209976196289,625.0
15,39000,Tu Casa Propia Donde Tu Elijas,-2.2733585834503174,-79.88924407958984,2600.0
420,300000,Casa Rentera Cerca Al Tia de Alborada,-2.138,-79.897,714.2857142857143
144,60000,Se Vende Negociable Y a 50mts.via Daule,-2.1193199157714844,-79.9323501586914,416.6666666666667
300,85000,Casa Rentera Florida Norte,-2.130000114440918,-79.93699645996094,283.3333333333333
198,140000,Hermosa casa de venta en Ciudadela Guayacanes.,-2.117000102996826,-79.89099884033203,707.070707070707
240,94000,Venta de Casa,-2.239992141723633,-79.88999484781785,391.6666666666667
480,25000,Se Vende,-2.209023952484131,-79.91877746582031,52.083333333333336
148,85000,Casa Ciudadela 9 de Octubre,-2.235,-79.894,574.3243243243244
100,120000,Casa Moderna Doble Planta,-2.136260986328125,-79.94439697265625,1200.0
105,85000,Venta de Casa Al Norte,-2.1710000038146973,-79.9219970703125,809.5238095238095
60,20000,casa o villa desde  20.000 casa a su gusto,-2.2660000324249268,-79.8740005493164,333.3333333333333
112,120000,"Departamento en Venta en Los Ceibos, 2 Hab, Piscina, Norte de Guayaquil.",-2.1670000553131104,-79.94499969482422,1071.4285714285713
345,185000,Venta de Casa,-2.179037570953369,-79.9681396484375,536.231884057971
115,170000,Vendo condominio 3 pisos,-2.188999891281128,-79.88899993896484,1478.2608695652175
225,202000,Isla Celeste 2 plantas 4 dormitorios 202.000 (Venta Directa),-2.0789999961853027,-79.83799743652344,897.7777777777778
225,245000,"Isla Celeste 2 Plantas, 4 dormitorios 245.000 (Venta Directa)",-2.0789999961853027,-79.83799743652344,1088.888888888889
67,49000,Ciudad Santiago casa esquinera 49.000 (Venta Directa),-2.0250000953674316,-79.94400024414062,731.3432835820895
45,28000,Departamento en Venta - Sauces 4,-2.124,-79.887,622.2222222222222
160,158000,Venta de Casa en Mayorca,-2.1540000438690186,-79.86599731445312,987.5
136,90000,Vendo Casa amoblada,-2.1297149658203125,-79.91156005859375,661.7647058823529
259,158000,Vía a la Costa 4 dormitorios 150 m2 construcción 158.000 (Venta Directa),-2.2009999752044678,-80.05999755859375,610.03861003861
3,43000,Vendo Departamento Centro Guayaquil,-2.19,-79.885,14333.333333333334
55,68000,"Departamento en Venta, Alborada, Norte de Guayaquil, 1 Hab, 2 Bañ, 2 Parqueos.",-2.1389999389648438,-79.89800262451172,1236.3636363636363
1,190000,Edificio Quo 2 Dormitorios,-2.1649999618530273,-79.89099884033203,190000.0
1,1,Casa de Venta,-2.091,-79.928,1.0
165,230000,"Departamento en Venta en Olivos 2 Los Ceibos, 165 Mt, 3 Hab, 4 Bañ, 2 Parqueos.",-2.1700000762939453,-79.94499969482422,1393.939393939394
10,45000,Vendo Casa,-2.240000009536743,-79.93000030517578,4500.0
84,85000,"Departamento en Venta en Kennedy Norte, 2 Hab, 2 Bañ, 1 Parqueo.",-2.134999990463257,-79.91300201416016,1011.9047619047619
204,90000,Se Vende Casa Rentera Cdla Nueva Granada,-2.2112464904785156,-79.91196247069767,441.1764705882353
200,31000,Terreno con Casa,-2.347881317138672,-80.27877044677734,155.0
72,44000,VENTA KSA MUCHO LOTE 1 3ra etapa de oportunidad,-2.0920000076293945,-79.9219970703125,611.1111111111111
100,75000,Centro Venta Departamento,-2.257253646850586,-79.88957977294922,750.0
120,35000,Se Vende Bonita Casa Bien Arreglada,-2.08672833442688,-79.95559692382812,291.6666666666667
140,70000,Vendo Casa Junto Al Mini de Micomisariat,-2.087890386581421,-79.92373657226562,500.0
239,140000,Venta de Casa en Vía a La Costa Urb. Casa Club - A. Salvador,-2.180000066757202,-79.98699951171875,585.7740585774059
411,175000,Venta de Casa en Urb Los Angeles en Via a la Costa,-2.187999963760376,-80.0270004272461,425.79075425790757
155,140000,En Venta Departamento en Edif. El Dorado - Centro - C. SUÁREZ - A. COBOS,-2.196000099182129,-79.88500213623047,903.2258064516129
270,215000,Casa con Piscina de 5 Dormitorios,-2.053,-79.902,796.2962962962963
110,34000,"VENTA CASA URB. BEATA MERCEDES MOLINA TIPO ""L""",-2.2799999713897705,-79.9540023803711,309.09090909090907
160,180000,Casa Esquinera Sauces 7,-2.1413166522979736,-79.90919494628906,1125.0
180,365000,en Venta Depart Samborondon Vista Al Río,-2.172133207321167,-79.91678619384766,2027.7777777777778
105,135000,Departamento Olivos2,-2.171506881713867,-79.8774642944336,1285.7142857142858
160,87000,Ciudad del Río- Norte de Guayaquil,-2.066999912261963,-79.91000366210938,543.75
1068,2800,ALQUILER  VILLA AMOBLADA EN PUERTO AZUL BAÑOS TOTALMENTE RE MODELADOS /AA,-2.36299991607666,-80.29499816894531,2.6217228464419478
249,338000,Isla Mocoli Departamento Vista Al Rio,-2.1715214252471924,-79.87751007080078,1357.429718875502
112,50000,SE VENDE CASA ESQUINERA DE OPORTUNIDAD,-2.2179999351501465,-79.90799713134766,446.42857142857144
100,60000,VENTA DE DEPARTAMENTO AMOBLADO EN LA SAIBA,-2.2269999980926514,-79.89399719238281,600.0
700,480000,VENTA CASA EN PUERTO AZUL NEGOCIABLE/ER,-2.191999912261963,-79.96700286865234,685.7142857142857
210,115000,Casa de Venta en Urb. San Felipe,-2.1389999389648438,-79.9219970703125,547.6190476190476
7,1,Se Vende Esta Casa en Loma de L Florida,-2.132999897003174,-79.95700073242188,0.14285714285714285
313,85000,Se Vende Casa,-2.188999891281128,-79.88899993896484,271.5654952076677
183,78000,Casa en Venta,-2.2060000896453857,-79.90499877929688,426.2295081967213
72,65000,Casa de Venta en Urb. Villa España,-2.0799999237060547,-79.9219970703125,902.7777777777778
105,85000,Orquídeas Venta de Casa,-2.1,-79.905,809.5238095238095
600,282000,VENDO CASA RENTERA CON 4 LOCALES Y 11 DPTOS,-2.196000099182129,-79.88899993896484,470.0
250,85000,La Fragata Villa Una Planta,-2.244,-79.907,340.0
139,700,Se Vende O Alquila Casa en San Felipe,-2.0532572269439697,-79.93010711669922,5.0359712230215825
158,78000,CASA MULTIFAMILIAR EN BUEN ESTADO  LISTA PARA VIVI,-2.2039999961853027,-79.9229965209961,493.67088607594934
160,150000,Venta Casa Via Samborondon Urbanización Matices - Mariuxi Rugel,-2.2179999351501465,-79.92400360107422,937.5
206,179500,Venta Casa Oportunidad Via Samborondon Urbanización Matices - Mariuxi Rugel,-2.2179999351501465,-79.92400360107422,871.3592233009708
126,128000,"Departamento en Venta en el norte de Guayaquil, en Urdesa",-2.1619999408721924,-79.91200256347656,1015.8730158730159
60,55000,Venta de Suite Zona Bancaria Y Comercial,-2.191999912261963,-79.88200378417969,916.6666666666666
135,105000,"Venta de casa, en Urbanización Villa Italia, vía La Aurora",-2.0829999446868896,-79.93000030517578,777.7777777777778
205,200000,Casa en Venta Via a La Costa Urb. Terranostra 4 Dorm. - Mariuxi Rugel,-2.36299991607666,-80.29499816894531,975.609756097561
380,350000,Venta de Casa en C. Celeste (negociable),-2.0753839015960693,-79.8452377319336,921.0526315789474
7,32000,Vendo Esta Casa,-2.0889999866485596,-79.9010009765625,4571.428571428572
32,1,Vendo por Motivo de Viaje,-2.0920000076293945,-80.052001953125,0.03125
108,68000,Hermosa casa de venta en Urbanización Metrópolis II,-2.062999963760376,-79.91600036621094,629.6296296296297
148,368000,Se Vende Departamento en Edifico Quo,-2.1619999408721924,-79.89800262451172,2486.4864864864867
126,45000,SE VENDE CASA RENTERA DE 2 PLANTA INDEPENDIENTES DE OPORTUNIDAD,-2.2820000648498535,-79.87899780273438,357.14285714285717
80,42000,VENTA DE CASA DE UNA PLANTA  UBICADA EN LA CDLA MARTHA DE ROLDOS,-2.171999931335449,-79.90599822998047,525.0
137,115000,Venta de Casa Cdla. Guayacanes sector norte de Guayaquil / remodelada,-2.118000030517578,-79.89299774169922,839.4160583941606
350,280000,Vendo Casa Rentera Esquinera,-2.21,-79.889,800.0
344,255000,"Venta de Casa en Urb. Bosques de la Costa, Vía a la Costa",-2.184999942779541,-79.97000122070312,741.2790697674419
433,385000,"Venta de Casa en Urb. Terranostra, Vía a la Costa, cerca del C.C Laguna Plaza",-2.187999963760376,-80.0,889.1454965357967
200,155000,"Casa en Venta, Samanes 6, Norte de Guayaquil, 5 Hab, 6 Baños, 200m2",-2.1089999675750732,-79.90299987792969,775.0
115,68000,"Venta de Casa en Mucho Lote 2, cerca de la Autopista Narcisa de Jesus, junto al Comisariato, Norte de Guayaquil",-2.065000057220459,-79.89299774169922,591.304347826087
120,135000,# se vende bonita casa en veranda / norte,-2.065000057220459,-79.90899658203125,1125.0
219,155000,#SE VENDE DEPARTAMENTO CENTRO/UNIVERSIDADES CERCA A 5 MINUTOS/ SALA DE CINE,-2.2760000228881836,-79.88600158691406,707.7625570776256
240,140000,"Casa Rentera en Venta, Guayacanes, 6 Hab, 4 Baños, 240m2",-2.115999937057495,-79.89099884033203,583.3333333333334
80,95000,"Departamento en Venta en Puerto Azul, 2 Hab, 2 Bañ, Via a la Costa.",-2.191999912261963,-79.96700286865234,1187.5
80,85000,Venta Casa 2 Plantas en Pradera 2 (comer,-2.0684282779693604,-79.92726135253906,1062.5
110,78000,Se vende casa en La Joya etapa Quarzo,-2.194999933242798,-79.9000015258789,709.0909090909091
128,18000,Casa en El Sector de La Isla Trinitaria,-2.1619935035705566,-79.80382537841797,140.625
140,110000,SE VENDE CASA REMODELADA 4 DORMITORIOS EN CDLA. LOS ESTEROS,-2.24399995803833,-79.90699768066406,785.7142857142857
185,145000,Casa en Santa Maria de Casa Grande Venta,-2.14973521232605,-79.6032485961914,783.7837837837837
250,45000,Casa en Venta - Salinas - Vinicio 1,-2.2658298015594482,-80.90192413330078,180.0
124,180000,Vendo,-2.0869998931884766,-79.93499755859375,1451.6129032258063
78,33000,Vendo Casa Barata Montebello,-2.0290000438690186,-79.86599731445312,423.0769230769231
130,73000,CASA EN VENTA CIUDADELA FERROVIARIA,-2.183000087738037,-79.90899658203125,561.5384615384615
120,120000,VENTA DE CASA DE 2 PLANTAS EN VILLA DEL REY,-2.183000087738037,-79.90399932861328,1000.0
78,59500,CASA EN VENTA SUR DE GUAYAQUIL,-2.244999885559082,-79.9000015258789,762.8205128205128
105,40000,Villa en Cdla Jardines de Girasoles,-2.2069251537323,-79.91094970703125,380.95238095238096
96,50000,Vendo Casa en Sector Norte de Guayaquil,-2.062999963760376,-79.9469985961914,520.8333333333334
134,145000,De Oportunidad Vendo Departamento en Kennedy Norte,-2.1570000648498535,-79.9010009765625,1082.089552238806
136,158000,Vendo Moderno Departamento en Kennedy Norte,-2.1570000648498535,-79.9010009765625,1161.764705882353
156,155000,Vendo Espacioso Departamento en Kennedy Norte,-2.1570000648498535,-79.9010009765625,993.5897435897435
88,93000,Se Vende por Estrenar Amplia Suite en Kennedy Norte,-2.1710000038146973,-79.89900207519531,1056.8181818181818
120,38000,Se Vende Casa con Garaje,-2.0899999141693115,-79.9280014038086,316.6666666666667
167,150000,En Venta Casa en Orquídeas XXI etapa - J. MONCADA,-2.0989999771118164,-79.90599822998047,898.2035928143713
101,74000,Villa Del Rey (1ra Etapa) Oportunidad,-2.175813674926758,-79.89541625976562,732.6732673267327
200,125000,"Venta de Casa en Urbanizacion Santorini, cerca del C.C City Mall, Norte de Guayaquil",-2.2839999198913574,-79.88400268554688,625.0
176,130000,Casa Y Local,-2.1480000019073486,-79.89399719238281,738.6363636363636
114,80000,Casa en Venta Al Sur de Guayaquil,-2.188999891281128,-79.88899993896484,701.7543859649123
87,60000,"Venta de Casa en Sauces Remodelada, cerca del nuevo Puente de Samborondon, Norte de Guayaquil",-2.127000093460083,-79.88999938964844,689.6551724137931
92,165000,Venta Departamento Bellini II Vista al Rio Puerto Santa Ana 77 M2,-2.178999900817871,-79.8759994506836,1793.4782608695652
158,105000,CASA HERMOSA EN SAN FELIPE,-2.1389999389648438,-79.9219970703125,664.5569620253165
500,197000,CIUDADELA LUIS MOREJON ALMEIDA JUNTO AL MALL DEL SUR,-2.2290000915527344,-79.89800262451172,394.0
100,90000,Venta departamento 2 dormt Kennedy Norte,-2.1570000648498535,-79.9010009765625,900.0
120,30000,Vendo Casa en Floresta 1,-2.234999895095825,-79.9010009765625,250.0
250,1,Vendo Casa en Quevedo de Oportunidad,-2.128999948501587,-79.9469985961914,0.004
128,18000,Se Vende Casa,-2.18935489654541,-79.88920593261719,140.625
91,83000,Casa en Venta - Av Francisco de Orellana - J. Moncada,-2.117000102996826,-79.90699768066406,912.0879120879121
