metroscuadradostotales,precio,titulo,latitud,longitud,preciomt2
650,250000,Casa de venta en Centro - Calle Andrés Marín – código:13781,-2.161486,-79.917257,384.61538461538464
571,380000,Casa de venta en CENTRO - Av. Del Ejercito  – código:9995,-2.161486,-79.917257,665.4991243432574
3840,780000,Casa de venta en Vía a la Costa  – código:11423,-2.161486,-79.917257,203.125
294,138000,Casa de venta en Barrio del Astillero – código:12159,-2.161486,-79.917257,469.38775510204084
2700,800000,Casa de venta en Samborondon - El Cortijo – código:10865,-2.161486,-79.917257,296.2962962962963
126,83000,Casa de venta en Guayacanes – código:12040,-2.161486,-79.917257,658.7301587301587
800,450000,Casa de venta en URDESA - Circunvalación Sur – código:12119,-2.161486,-79.917257,562.5
1253,560000,Casa de venta en Ceibos - Av. Principal – código:10398,-2.161486,-79.917257,446.92737430167597
72,42000,Vendo Casa 1 Planta Mucho Lote 1,-2.1710000038146973,-79.9219970703125,583.3333333333334
550,395000,Casa de venta en Puerto Azul - Vía a la Costa – código:12249,-2.161486,-79.917257,718.1818181818181
300,360000,CEIBOS NORTE VENTA DE CASA DE ESTRENO CON ESTILO MODERNO,-2.1519999504089355,-79.94300079345703,1200.0
120,260000,"Venta De Departamento En Edificio Rivert Front, En El Puerto Santa Ana",-2.180000066757202,-79.87699890136719,2166.6666666666665
125,65000,"Venta de Casa de dos Plantas En Villa España, al Norte de Guayaquil, entrando Por La Av.Francisco de Orellana",-2.0840001106262207,-79.9010009765625,520.0
320,160000,"Venta de Casa en Guayacanes cerca de la autopista Narcisa de Jesus, Norte de Guayaquil",-2.118000030517578,-79.89299774169922,500.0
120,95000,Venta Casa Estreno Urbanización La Rioja cerca del C.C. El Dorado,-2.052000045776367,-79.89700317382812,791.6666666666666
178,128000,"Venta departamento remodelado  espectacular  Lomas de Urdesa, cerca del Policentro",-2.1640000343322754,-79.90699768066406,719.1011235955057
72,33000,Gran Remate Casa en Mucho Lote 4 Etapa,-2.0889999866485596,-79.9010009765625,458.3333333333333
175,60000,Vendo Linda Casa en 26 Y La O,-2.0591421127319336,-79.89329528808594,342.85714285714283
154,119000,"Vía a la costa, Vendo departamento por estrenar totalmente climatizado",-2.2039999961853027,-80.06700134277344,772.7272727272727
76,88000,"Venta de Suite de Dos Ambientes, Cocina Tipo Americano, al Norte de Guayaquil",-2.134000062942505,-79.91100311279297,1157.8947368421052
364,250000,Venta de Casa Rentera en Alborada 6ta Etapa,-2.1730000972747803,-79.89700317382812,686.8131868131868
102,80000,"Guayaquil, Villadel Rey, Villa en Venta",-2.191999912261963,-79.94100189208984,784.3137254901961
1050000,150000,Venta de Casa en Guasmo Central,-2.251,-79.894,0.14285714285714285
150,100000,VENDO CASA CON UN DEPARTAMENTO INCLUIDO,-2.0959999561309814,-79.90899658203125,666.6666666666666
199,20000,por Motivo de Viaje Se vende casa con amplio terreno para ampliación en el sur de la ciudad,-2.259999990463257,-79.9020004272461,100.50251256281408
250,45000,Casa en Venta,-2.214289903640747,-79.92821502685547,180.0
120,98000,URBANZACION VILLA ITALIA CERCA AL AREA SOCIAL,-2.059000015258789,-79.927001953125,816.6666666666666
524,30000,Vendo casa,-2.189413070678711,-79.88906860351562,57.25190839694657
280,90000,"Casa de Venta , Propiedad Rentera para Inversión, Bastión Popular Cerca a la Via Principal de la Perimetral",-2.0840001106262207,-79.93099975585938,321.42857142857144
120,105000,REMATO CASA POR EMERGENCIA EN URDENOR,-2.1489999294281006,-79.90899658203125,875.0
98,50000,Vendo Casa Rentera en Principal,-2.0615835189819336,-79.98392486572266,510.2040816326531
72,34000,"COD# 042 VENTA DE HERMOSA PROPIEDAD EN BEATA MERCEDES MOLINA, CERCA DE MUCHO LOTE, CARACOL, VIA A DAULE.",-2.056999921798706,-79.95500183105469,472.22222222222223
197,119000,Venta Casa en Mirador Sector Bellavista,-2.181999921798706,-79.91600036621094,604.0609137055837
112,30000,Se Vende Casa,-2.255,-79.884,267.85714285714283
128,110000,"Casa en Venta, Urb. Millan, Via Salitre, 3 dorm, 4 baños",-2.115000009536743,-79.90599822998047,859.375
112,62000,Casa en Venta Sur de La Ciudad,-2.078000068664551,-79.91300201416016,553.5714285714286
90,110000,VENTA DE DEPARTAMENTO A ESTRENAR EN CEIBOS,-2.1630001068115234,-79.93499755859375,1222.2222222222222
91,70000,URBANIZACION PRIVADA colinas del sol de Oportunidad !!,-2.0959999561309814,-79.94300079345703,769.2307692307693
4,95000,Casa Rentera en Venta Sauces 5,-2.1218860149383545,-79.90299987792969,23750.0
121,84000,Casa en Venta en San Antonio,-2.1459999084472656,-79.90699768066406,694.2148760330579
149,175000,Guayacanes Vendo Linda Y Elegante Casa,-2.1710000038146973,-79.89800262451172,1174.496644295302
132,67000,La Joya Etapa Quarzo,-2.1710000038146973,-79.89800262451172,507.57575757575756
100,115000,Costalmar Via La Costa Vendo Departament,-2.1710000038146973,-79.89800262451172,1150.0
140,105527,SAMANES CASA EN VENTA,-2.1549999713897705,-79.89099884033203,753.7642857142857
190,128000,Villa Club Vendo Casa 4 Habitaciones,-2.1710000038146973,-79.89800262451172,673.6842105263158
500,590000,"Samborondon, Vendo Linda Y Elegante.casa",-2.18935489654541,-79.88920593261719,1180.0
175,160000,"Casa Rentera en Guayacanes, Esquinera, En venta",-2.234999895095825,-79.9020004272461,914.2857142857143
447,600000,Isla Mocoli Vendo Casa de 2 Plantas,-2.18935489654541,-79.88920593261719,1342.2818791946308
120,110000,Venta de Casa en Guayacanes cerca del C.C Riocentro Norte Norte de Guayaquil,-2.2019999027252197,-79.91500091552734,916.6666666666666
207,192000,VENDO  AMPLIA CASA EN ALAMOS NORTE,-2.178999900817871,-79.88899993896484,927.536231884058
305,120000,Venta de Casa Rentera en Capitán Najera Sur de Guayaquil,-2.2039999961853027,-79.91400146484375,393.44262295081967
100,75000,HERMOSA CASA A LA VENTA EN CIUDAD OLIMPO!!!,-2.2269999980926514,-80.0770034790039,750.0
95,99000,"Venta de departamento por estrenar al norte de la ciudad, ciudadela Guayaquil frente a Kennedy Norte",-2.1679999828338623,-79.89299774169922,1042.1052631578948
100,84500,"Hermoso Departamento en Venta, Álamos Norte.",-2.1579999923706055,-79.9010009765625,845.0
72,95000,Departamento de Lujo Vendo Amoblado,-2.17,-79.897,1319.4444444444443
170,165000,"Vender, Venta, Vendo Departamento de Estreno, Colinas de los Ceibos, Norte de Guayaquil",-2.1619999408721924,-79.94499969482422,970.5882352941177
420,150000,Vendo.en Ceibos.dpto.planta Baja. 420m2,-2.1989998817443848,-79.88800048828125,357.14285714285717
102,80000,"Alborada, Linda Villa Rentera",-2.1389999389648438,-79.89800262451172,784.3137254901961
72,50000,# HERMOSO  DEPARTAMENTO  CDLA LA SAIBA /SE ACEPTA BIESS,-2.2269999980926514,-79.89399719238281,694.4444444444445
180,75000,Venta de Casa,-2.181356430053711,-79.8959974382055,416.6666666666667
470,219000,Venta de Casa en Lomas de Urdesa,-2.1673688888549805,-79.90499877929688,465.9574468085106
83,220000,Se Vende o Se Alquila Departamento Bellini IV,-2.178999900817871,-79.8759994506836,2650.602409638554
80,55000,Venta de Casa Rentera en Duran,-2.0373668670654297,-79.92033386230469,687.5
90,34000,# VALDIVIA / RIO CENTRO SUR/  SUR DE GUAYAQUIL,-2.2269999980926514,-79.8949966430664,377.77777777777777
300,175000,Se Vende Casa de Dos Plantas en Portal Al Sol Via a La Costa,-2.178999900817871,-79.98300170898438,583.3333333333334
180,195000,Casa en Bosques de la Costa en Venta,-2.1619999408721924,-79.88600158691406,1083.3333333333333
220,120000,se vende casa de 2 plantas,-2.130000114440918,-79.9000015258789,545.4545454545455
170,168000,"Venta de Departamento en Colinas de Los Ceibos, cerca del Supermaxi, Norte de Guayaquil.",-2.1619999408721924,-79.94499969482422,988.2352941176471
700,450000,Ceibos Vendo Mansion,-2.18935489654541,-79.88920593261719,642.8571428571429
186,279000,"Vendo De Estreno, Departamento De Tres Dormitorios, En Samborondon Km.3,5",-2.052000045776367,-79.91200256347656,1500.0
120,75000,"# VENDO CASA EN FLORESTA 2 DE 2 PLANTAS, 2 DEPARTAMENTOS / SUR",-2.1710000038146973,-79.9219970703125,625.0
90,60000,"En venta propiedad en sector de alta plusvalía, al sur de Gye.",-2.188999891281128,-79.88899993896484,666.6666666666666
365,260000,Venta de Casa Rentera en Entre Rios,-2.1579999923706055,-79.90799713134766,712.3287671232877
105,105000,Venta de Casa a Estrenar en Villa Club Kripton,-2.1579999923706055,-79.90799713134766,1000.0
80,39500,"Departamento en la Cdla Valdivia, SUPER COMODO, por Riocentro Sur, Guayaquil",-2.24399995803833,-79.89399719238281,493.75
105,55000,"Venta casa en Las Orquídeas, Norte de Guayaquil.",-2.0829999446868896,-79.93199920654297,523.8095238095239
192,137000,Vendo Casa en Urbanización Matices,-2.188999891281128,-79.88899993896484,713.5416666666666
137,104000,Urbanizacion Cataluña Vendo Casa,-2.18935489654541,-79.88920593261719,759.1240875912408
134,85000,Urdesa Central Costanera Vendo Dpto.,-2.18935489654541,-79.88920593261719,634.3283582089553
82,85000,"Casa en venta, Norte de Guayaquil, Sauces 3",-2.127000093460083,-79.88999938964844,1036.5853658536585
256,145000,Venta de Casa en La Joya Diamante,-2.180000066757202,-79.90799713134766,566.40625
625,595000,Lago Sol Via Samborondón Vendo Casa,-2.18935489654541,-79.88920593261719,952.0
192,125000,"Venta de Casa en Fuentes del Rio, Samborondon",-2.180000066757202,-79.90799713134766,651.0416666666666
980,480000,"Centenario Casa en Venta, Sur",-2.1619999408721924,-79.88600158691406,489.7959183673469
122,105000,Venta de Casa Nueva en Urb Arboletta,-2.1726036071777344,-79.89726257324219,860.655737704918
160,175000,Urdenor 1 casa en Venta,-2.1730000972747803,-79.89700317382812,1093.75
119,65000,Centro Luque Y Carchi Vendo Departamento,-2.18935489654541,-79.88920593261719,546.218487394958
170,65000,Vendo Casa,-2.1569759845733643,-79.9057388305664,382.3529411764706
130,85000,Vendo Casa Urbanización Metropolis 2-C,-2.065000057220459,-79.91699981689453,653.8461538461538
118,179000,VENDO DEPARTAMENTO EXCLUSIVO CON VISTA AL MAR DE LUJO,-2.1670000553131104,-79.90899658203125,1516.949152542373
80,65000,"Departamento de Venta en Cdla. Alamos Norte, Norte de Guayaquil, cerca del CC City Mall",-2.134000062942505,-79.91100311279297,812.5
625,595000,VENDO CASA VÍA SAMBORONDON,-2.1659998893737793,-79.91500091552734,952.0
120,45000,Se Vende Esta Casa,-2.084,-79.931,375.0
370,160000,Venta de Departamento en Ceibos,-2.1730000972747803,-79.89700317382812,432.43243243243245
84,59000,"Cod# 138 Venta de Casa en Mucho Lote 1, Cerca  de Metrópolis, Orquídeas, Parque Samanes. alborada",-2.0820000171661377,-79.9209976196289,702.3809523809524
200,76000,Casa en Venta,-2.062,-79.928,380.0
111,25000,Casa en Venta Balerio Estacio,-2.12,-79.969,225.22522522522522
72,48000,"Vivienda en venta norte de Guayaquil, Villa España-Barcelona",-2.0799999237060547,-79.9219970703125,666.6666666666666
140,70000,Vendo Casa Mixta,-2.2079999446868896,-79.88600158691406,500.0
230,260000,VENDO casa de 4 Dormitorios en el ALAMO (Cerca CITY MALL),-2.1480000019073486,-79.88700103759766,1130.4347826086957
160,138000,Venta de Casa en CostalMAr,-2.180000066757202,-79.90799713134766,862.5
150,74000,Vendo Casa Guayacanes Uno,-2.121,-79.893,493.3333333333333
404,160000,Casa en Los Ceibos,-2.1137590408325195,-79.92228698730469,396.03960396039605
107,148000,Venta de Departamento Samborondon,-2.1760001182556152,-79.88200378417969,1383.177570093458
96,70000,Vendo Casa en Urbanización Villa Bonita etapa 12,-2.056999921798706,-79.99299621582031,729.1666666666666
70,69999,Vendo dpto 2 dormitorios con baos,-2.1460890769958496,-79.88758850097656,999.9857142857143
100,70000,Casa en Venta Ciudad Olimpo 3 Dormitorios en Primera Etapa,-2.2269999980926514,-80.0770034790039,700.0
91,78000,"Vendo Casa en Metropolis 1, Av. Narcisa de Jesus, Norte",-2.069000005722046,-79.90899658203125,857.1428571428571
165,90000,Venta villa en Alborada 7ma Etapa diagonal  Banco Internacional,-2.13700008392334,-79.91200256347656,545.4545454545455
58,52000,En venta amplia Suite en Nueva Kennedy - K. BAQUERO - G. SOSA,-2.177000045776367,-79.89600372314453,896.551724137931
1200,290000,URB. LAGO DE CAPEIRA KM 23.5 VIA DAULE CASA EN VENTA,-2.1549999713897705,-79.89099884033203,241.66666666666666
250,290000,SAMBORONDON CASA EN VENTA,-2.1549999713897705,-79.89099884033203,1160.0
160,125000,VENDO CASA EN VÍA A SALITRE - NAPOLI,-2.1549999713897705,-79.89099884033203,781.25
390,320000,CEIBOS-CUMBRES CASA ELEGANTE EN VENTA,-2.1600000858306885,-79.8949966430664,820.5128205128206
349,230000,"Gran y hermosa Casa en Ciudad Celeste, Etapa La Ria",-2.234999895095825,-79.9020004272461,659.025787965616
210,150000,"Venta de casa en Ciudadela ""Estrella del Mar """,-2.1010000705718994,-79.90899658203125,714.2857142857143
220,195000,ALBORADA 10MA CONDOMINIO CAMINO REAL CASA EN VENTA,-2.1649999618530273,-79.89099884033203,886.3636363636364
72,45000,VENTA DE CASA FLORESTA 1,-2.253000020980835,-79.88400268554688,625.0
165,65000,Vendo,-2.2160000801086426,-79.89600372314453,393.93939393939394
95,130000,"Venta de Departamento Remodelado en Kennedy, cerca del C.C San Marino, Norte de Guayaquil",-2.1710000038146973,-79.89900207519531,1368.421052631579
90,115000,"Venta de Departamento en Urb. La Romadera, Autopista Narcisa de Jesus, cerca del Tia, Norte de Guayaquil",-2.061000108718872,-79.90499877929688,1277.7777777777778
186,210000,"Casa de Venta en Urbanización  Arcadia Km 14.5 Via a la Costa, cerca de CC Costalmar Shopping",-2.184999942779541,-80.00299835205078,1129.032258064516
143,200000,Impecable en Pto. Azul conjunto cerrado con garita.,-2.191999912261963,-79.96700286865234,1398.6013986013986
215,127500,"VENDO CASA EN CIUDADELA GUAYACANES, CERCA DE LAS 4 AVENIDAS",-2.2009999752044678,-79.927001953125,593.0232558139535
240,50000,Vendo Casa Grande en El Sur Fertisa,-2.0889999866485596,-79.9010009765625,208.33333333333334
146,142000,"HERMOSO DEPARTAMENTO MODERNO, Rommy Gaspar",-2.1659998893737793,-79.90399932861328,972.6027397260274
8,90,Venta de Villa Primavera 2,-2.190000057220459,-79.88899993896484,11.25
80,43,Se Vende Casa Montebello,-2.189,-79.889,0.5375
236,98000,CASA LOS ESTEROS,-2.25,-79.89600372314453,415.2542372881356
170,165000,Departamento,-2.161266803741455,-79.94725036621094,970.5882352941177
105,25000,vendo casa,-2.1029999256134033,-79.95600128173828,238.0952380952381
170,165000,Lindo Departamento Venta de Estreno,-2.1700000762939453,-79.89800262451172,970.5882352941177
204,169000,"Venta Casa Urb. Portal al Sol cerca de Belo Horizonte y Portofino, Plaza Colonia, Vía a la Costa km 12, Norte Guayaquil",-2.178999900817871,-79.98300170898438,828.4313725490196
186,149000,Departamento tres dormitorios con vista panorámica en Lomas de Urdesa,-2.1640000343322754,-79.90699768066406,801.0752688172043
250,195000,"Venta Casa Parques de los Ceibos, Cerca 3 Colegios, McDonald, Megamaxi y otros locales, Norte Guayaquil, Via a la Costa",-2.1630001068115234,-79.9469985961914,780.0
191,148000,"Venta Departamento en Ceibos Norte, Cerca de Cumbres, Espol, Santa Cecilia, Norte de Guayaquil, Via a la Costa",-2.1519999504089355,-79.94300079345703,774.869109947644
212,199900,"Venta Casa Belohorizonte, 2 Plantas con Piscina, cerca Puerto Azul y Laguna Club, Vía a La Costa, Norte de Guayaquil",-2.187000036239624,-79.97899627685547,942.9245283018868
240,160000,Lomas de Urdesa espectacular vista,-2.1640000343322754,-79.90699768066406,666.6666666666666
150,110000,"Vendo Departamento, en EDIFICIO El BRILLANTE, 2DO PISO",-2.119999885559082,-79.88999938964844,733.3333333333334
145,68000,"Ciudadela Pradera 2: villa 2 plantas , 4 dormitorios",-2.240999937057495,-79.89099884033203,468.9655172413793
190,95000,"Parque Centenario, 9 de Octubre, vendo apartamento 190 m2, tres dormitorios.",-2.190999984741211,-79.88400268554688,500.0
160,199000,En Venta Hermosa Villa en Puta Esmeralda - Vía La Costa,-2.187000036239624,-79.99400329589844,1243.75
136,80000,"Venta de casa Samanes 1, de una planta, conjunto cerrado",-2.114000082015991,-79.89900207519531,588.2352941176471
101,63000,Casa en Venta en Villa Italia - el mejor precio,-2.059000015258789,-79.927001953125,623.7623762376238
80,90000,VENDO DEPARTAMENTO CDLA LA GARZOTA - P. VILLEGAS,-2.1480000019073486,-79.89299774169922,1125.0
170,30000,Vendo Casa,-2.1740000247955322,-79.92400360107422,176.47058823529412
147,195000,Bosques de La Costa Hermosa Villa,-2.1831414699554443,-79.97149658203125,1326.530612244898
320,160000,Hermosa y Amplia Casa en Bellavista,-2.180000066757202,-79.91100311279297,500.0
470,340000,Venta de Proyecto de Casas en Isla Mocoli Dubai Cerca de Plaza Lagos,-2.1070001125335693,-79.9020004272461,723.4042553191489
300,250000,Bella Quinta Excelente Zona Tachira Vzla,-2.188999891281128,-79.88899993896484,833.3333333333334
140,130000,Amplia casa de venta en Urbanización Metrópolis 2,-2.065999984741211,-79.91100311279297,928.5714285714286
140,110000,"Venta de Casa en Urb. Milan, Cerca C.C. El Dorado",-2.0880000591278076,-79.927001953125,785.7142857142857
200,950000,Venta de Propiedad Espectacular en Lomas de Urdesa,-2.1659998893737793,-79.90399932861328,4750.0
415,165000,Venta de solar bifamiliar con villa de una planta por modernizar en Urbanización Puerto AzuL,-2.191999912261963,-79.96700286865234,397.5903614457831
175,179000,"Vendo casa con piscina, 4 dormitorios Urb Vicrieel",-2.052999973297119,-79.89700317382812,1022.8571428571429
230,280000,"Casa en venta por estrenar en Puerto azul, via a la costa.",-2.191999912261963,-79.96700286865234,1217.391304347826
115,120000,"Departamento en venta en Santa Cecilia, los ceibos.",-2.1630001068115234,-79.94200134277344,1043.4782608695652
182,145000,VENDO CASA ALBORADA 9NA. ETAPA,-2.188999891281128,-79.88899993896484,796.7032967032967
96,63950,Vendo Casa de 4 dormitorios en Villa Bonita,-2.055999994277954,-79.99500274658203,666.1458333333334
96,62707,Vendo Casas amplias en el sector de Mi Lote 1,-2.056999921798706,-79.98799896240234,653.1979166666666
153,150000,SE VENDE CASA  CON PISCINA EN URB. NAPOLI VÍA A SALITRE,-2.194999933242798,-79.9000015258789,980.3921568627451
350,395000,Samborondon Km 1.5 Vendo Linda Casa,-2.18935489654541,-79.88920593261719,1128.5714285714287
288,220000,Venta Departamento Centro de Guayaquil,-2.155702590942383,-79.9440911060013,763.8888888888889
198,168000,Ciudad Celeste Vendo Casa 3 Habitaciones,-2.1710000038146973,-79.89800262451172,848.4848484848485
1200,1100000,Lomas de Urdesa Vendo Elegante Casa,-2.18935489654541,-79.88920593261719,916.6666666666666
230,210000,"Casa en Venta, Urbanización Acuarela del Rio, 4 habitaciones, 5 baños, 230 Mts2.",-2.134999990463257,-79.88400268554688,913.0434782608696
103,150000,Bosques de la Costa Departamento de Estreno en Venta,-2.181999921798706,-79.97000122070312,1456.3106796116506
175,235000,Samborondon Central Park Vendo Dpto Amob,-2.172656536102295,-79.89728546142578,1342.857142857143
98,80000,"Vendo Villa en la urbanización  ""La Perla"" (Guayaquil)",-2.056999921798706,-79.90699768066406,816.3265306122449
330,85000,Venta de Casa en Crucita,-2.1579999923706055,-79.90799713134766,257.57575757575756
210,78000,"Vendo Casa en Principal, Sur La Fragata",-2.053929328918457,-79.9317855834961,371.42857142857144
72,50000,Venta de casa de una Planta en Mucho Lote 1,-2.1410000324249268,-79.90799713134766,694.4444444444445
61,95000,"Venta de Suite en Pacific Plaza, Ciudad Colon, cerca la Av. Juan Tanga Marengo, Norte De Guayaquil",-2.2339999675750732,-79.89399719238281,1557.377049180328
1600,850000,"Samborondon Km 6.5 Se renta casa de una sola planta de 1.600 mts 2 con 4 hab, piscina y enorme patio",-2.2179999351501465,-79.92400360107422,531.25
180,200000,Excelente Propiedad en Venta en Polaris,-2.0656423568725586,-79.91268920898438,1111.111111111111
108,70000,Vendo Casa en Metropolis Ii 70.000,-2.0641560554504395,-79.9217300415039,648.1481481481482
181,176000,Vendo Casa,-2.184649705886841,-79.90068054199219,972.3756906077348
7,95000,Casa Rentera de Oportunidad,-2.1224334239959717,-79.8907699584961,13571.42857142857
82,55000,"Vendo Casa en Urbanizacion Privada Ecocity, Etapa Eco Jardin",-2.0840001106262207,-79.96800231933594,670.7317073170732
480,260000,"Venta de Casa en Ceibos, Cumbre De Los Ceibos Guayaquil",-2.141005039215088,-79.8949966430664,541.6666666666666
175,112000,"Venta Casa Alborada Xii , 1 Planta 3 Dor",-2.144817590713501,-79.89971160888672,640.0
137,145000,Venta Departamento Ceibos Cumbre,-2.1682276725769043,-79.88043975830078,1058.3941605839416
187,155000,EN VENTA - ALBORADA VI ETAPA: HERMOSA CASA CON ACABADOS DE PRIMERA,-2.1440000534057617,-79.90699768066406,828.8770053475936
120,165000,Casa en Venta,-2.15,-79.9,1375.0
120,140000,Venta de Casa Rentera en la alborada,-2.1410000324249268,-79.90799713134766,1166.6666666666667
200,150000,Venta Casa en Bellavista,-2.111999988555908,-79.93299865722656,750.0
90,67000,Venta de Casa 6ta Etapa Villas Alegria,-2.18935489654541,-79.88920593261719,744.4444444444445
250,12000,Terreno Casa Salinas,-2.0950961112976074,-79.90617370605469,48.0
130,175000,"Venta Departamento De Estreno en Condominio Ariana Urb Punta Esmeralda Via a La Costa, Guayaquil",-2.187000036239624,-79.99400329589844,1346.1538461538462
82,48000,"COD# 033 VENTA DE CASA DE OPORTUNIDAD EN HUANCAVILCA NORTE CERCA DE ORQUIDEAS, MUCHO LOTE, VILLA ESPAÑA Y SAMANES",-2.0959999561309814,-79.90899658203125,585.3658536585366
165,125000,Casa Venta San Felipe Buen Precio,-2.1700000762939453,-79.89800262451172,757.5757575757576
62,97000,Venta de Departamentos 2 dormitorios. Kennedy Norte,-2.134831190109253,-79.90896606445312,1564.516129032258
180,130000,"Cod# 012 Venta de  casa en Samanes 6 frente al colegio Teniente Hugo Ortiz, cerca de Huancavilca norte,Alborada, Sauces",-2.065000057220459,-79.89299774169922,722.2222222222222
190,135000,Venta de Casa Plaza Madeira. 0968710023,-2.053999900817871,-79.91699981689453,710.5263157894736
180,205000,"Vendo Casa de Dos Plantas Via La Costa, Norte de Guayaquil",-2.183000087738037,-79.98699951171875,1138.888888888889
112,99800,Cod# 006 Venta de casa en Urbanización la PERLA cerca de ROMAREDA METROPOLIS MUCHO LOTE GUAYACANES SAUCES,-2.11899995803833,-79.88899993896484,891.0714285714286
101,74000,Vendo Casa 2 Plantas Villa Del Rey (1ra),-2.1760001182556152,-79.8949966430664,732.6732673267327
290,145000,casa rentera: 2 departamentos 290mts,-2.2109999656677246,-79.89299774169922,500.0
120,130000,Vendo casa comercial Samanes 7,-2.189412832260132,-79.88906860351562,1083.3333333333333
187,300000,MANABI/PORTOVIEJO CDLA LOS MANGOS-CASA EN VENTA,-2.1549999713897705,-79.89099884033203,1604.2780748663101
164,58900,Casa 2 Pisos Más Terraza Y Garaje,-2.2571563720703125,-79.8843994140625,359.1463414634146
120,27000,Vendo Casa Calle La A. Suburbio,-2.119999885559082,-79.90399932861328,225.0
115,58000,Venta de Departamento en Bloques Saiba,-2.2339999675750732,-79.89399719238281,504.3478260869565
120,66000,Casa en Venta,-2.2190001010894775,-79.90799713134766,550.0
259,220000,Villa Esquinera de Una Planta,-2.1989998817443848,-79.91400146484375,849.4208494208494
130,115000,Vendo Lindo Departamento en El Centro de La Ciudad,-2.1989998817443848,-79.88099670410156,884.6153846153846
200,110000,Casa en Venta en Cdla. Las Acacias,-2.2239999771118164,-79.90299987792969,550.0
178,150000,En Venta Atractivo Departamento Recién Remodelado en Lomas de Urdesa,-2.1640000343322754,-79.90699768066406,842.6966292134831
183,183000,Vendo Hermosa Villa en Samborondon de 4d,-2.13100004196167,-79.89399719238281,1000.0
110,39000,"Cod # 003 Venta de hermosa casa en BEATA MERCEDES MOLINA cerca Mucho Lote, Mi lote, vía Daule Villa Bonita",-2.0820000171661377,-79.9209976196289,354.54545454545456
198,170000,VENDO DEPARTAMENTO EN URDESA CENTRAL,-2.1689999103546143,-79.90699768066406,858.5858585858585
100,700,Hacemos Tiendas Online a bajo costo,-2.132999897003174,-79.90499877929688,7.0
118,55000,CASA EN VENTA - FLOR DE BASTIÓN - NEGOCIABLE,-2.1080000400543213,-79.95800018310547,466.10169491525426
186,115000,Villa Club Aura Via Daule 4 Hab EXCELENTE UBICACION,-2.1526355743408203,-79.94508361816406,618.2795698924731
185,130000,de Venta Casa en Urdesa Central,-2.169,-79.908,702.7027027027027
10,1000,Ingeniería Y Diseño . Albañil. Pintor.,-2.1914544105529785,-79.93623352050781,100.0
100,158000,Venta de Casa en Via a la Costa,-2.191999912261963,-80.0790023803711,1580.0
160,115000,Villa Club Doral Patio Grande cerca del club Via Daule samborondon,-2.1526365280151367,-79.94522094726562,718.75
90,58000,Vendo Casa Pradera 1 atrás de Riocentro Sur,-2.236999988555908,-79.88999938964844,644.4444444444445
86,95000,Cdla. Guayaquil Vendo Departamento,-2.18935489654541,-79.88920593261719,1104.6511627906978
200,125000,Casa de 1 planta,-2.180999994277954,-79.91400146484375,625.0
90,67000,Casa 6 Etapa Villas Alegria Mucho Lote,-2.0470921993255615,-79.91451263427734,744.4444444444445
232,225000,"Casa en Venta en Ciudad Celeste 5 Dorm Amoblada, frente a La Piazza",-2.0739998817443848,-79.84300231933594,969.8275862068965
100,30000,Venta de Casa Guasmo Sur,-2.2510170936584473,-79.88983154296875,300.0
286,138000,"Venta de Casa en el Centenario, sur",-2.1730000972747803,-79.89700317382812,482.5174825174825
125,56000,"Venta Departamento en El Centro de Guayaquil, Buena Ubicación",-2.2090001106262207,-79.88600158691406,448.0
70,70000,COD #145 Vendo de propiedad en Abel Castillo y Sedalana sector Centro Sur Acacias,-2.194000005722046,-79.87999725341797,1000.0
147,99000,"Cod# 025 Venta de Casa en Urb. La Joya, Cerca de Villa del Rey, Villa Club, Vicrieel, Norte de Guayaquil",-2.194000005722046,-79.87999725341797,673.469387755102
120,122000,"Venta Departamento Planta Baja Ceibos por Cumbres Alto, Cerca Santa Cecilia, Espol, varios locales, Norte Guayaquil.",-2.1549999713897705,-79.94499969482422,1016.6666666666666
118,113000,"Departamento de Venta en la Alborada,Norte de Guayaquil cerca del City Mall",-2.125,-79.90299987792969,957.6271186440678
