metroscuadradostotales,precio,titulo,latitud,longitud,preciomt2,categoria
120,95000,Hermosa Casa de Venta en Urbanización La Joya.,-2.038261957298405,-79.91640891376954,791.6666666666666,B
514,580000,Venta Casa Samborondon (Primeros Km),-2.140321686807366,-79.86353694934081,1128.4046692607003,A
300,240000,Estrene Casa en Puerto Azul. 3 Dorm.,-2.19222685330131,-79.9711546217768,800.0,B
300,295000,Vendo Casa Samborondon Km. 4.5,-2.1144239,-79.87001240000001,983.3333333333334,B
360,270000,Estreno Casa Portal Al Sol 360 m² de 5 Dorm. 3 Garajes $270.000 Fijos,-2.182677,-79.9832432,750.0,B
400,350000,Venta - Casa - Lomas de Urdesa,-2.166204787249936,-79.9029262280365,875.0,B
127,120000,Vendo Hermosa Casa Remodelada Joya Ámbar,-2.04925313947218,-79.91455741586913,944.8818897637796,B
120,84000,Venta - Casa - Urbanización La Joya Etapa Oro,-2.0539063,-79.89672200000001,700.0,B
120,85000,Venta Casa Ubicada en El Sur de Guayaquil,-2.27636,-79.8953348,708.3333333333334,B
403,640000,Casa - Samborondón,-2.1709979,-79.9223592,1588.089330024814,A
160,90000,Casa en Venta - Alborada 11ava Etapa,-2.128780100002471,-79.90109822897489,562.5,B
300,367000,"Casa en Samborondón, Enstancia del Rio",-2.1261184,-79.8766916,1223.3333333333333,A
520,443000,"Laguna del Sol, Vendo Hermosa Casa Esquinera con Excelentes Acabados.",-2.080773805194784,-79.87264689580081,851.9230769230769,B
72,32000,"Casa en Venta, Vía a Daule, Urb. Portón de Beata",-2.0598444,-79.95487079999998,444.44444444444446,C
147,98000,Casa de Dos Planta Joya 3 Dorm.,-2.0424215,-79.91552209999998,666.6666666666666,B
171,105000,En Venta Casa en Villa Club Etapa Luna Cerca de Cc El Dorado,-2.033133529989004,-79.90052994299162,614.0350877192982,B
1098,950000,"Casa en Isla Mocoli, Mocoli Golf Club con Vista Al Lago",-2.1043031,-79.8604831,865.2094717668488,B
500,370000,Venta Casa Samborondon Km 2y Medio,-2.1894128,-79.8890662,740.0,B
106,54000,Casa de 2 Plantas Huancavilca Norte,-2.0957868,-79.90924039999999,509.4339622641509,B
134458,1090000,Casa de Lujo en Samborondòn Km 5!,-2.125182527775495,-79.86793040730015,8.106620654776956,C
440,430000,Vendo Casa en Urdesa Central Corredor Comercial,-2.163700806809924,-79.90652249998266,977.2727272727273,B
344,255000,Casa en Venta Via a La Costa Urb. Bosques de La Costa 4 Dorm. - Mariuxi Rugel,-2.189761269416047,-79.96733926832923,741.2790697674419,B
461,435000,"Amplia, moderna E Iluminada Casa en Laguna del Sol",-2.082085910194585,-79.87252865239259,943.6008676789588,B
105,95000,Vendo Casa en Villa Club a Estrenar Etapa Kripton,-2.076758,-79.9401216,904.7619047619048,B
360,520000,Urbanización El Rio Km.1.7 Via Sambo Casa de Venta,-2.0772032,-79.858556,1444.4444444444443,A
211,170000,Casa en Venta Urbanización Matices Vía Samborondon,-2.0603738,-79.8779366,805.6872037914692,B
250,320000,Villa a La Venta Ubicada en Plaza Real,-2.1419603,-79.86901449999999,1280.0,A
149,164000,"Venta de Casa Rentera en Cdla. La Alborada 4ta Etapa, Norte de Guayaquil",-2.1389841,-79.8947804,1100.6711409395973,A
75,68000,Casa - Norte de Guayaquil,-2.1258862,-79.8979523,906.6666666666666,B
180,169000,Colinas de Samanes de Guayaquil,-2.114431586657558,-79.90172307199708,938.8888888888889,B
250,175000,Kennedy Nueva Casa en Venta,-2.191526053604974,-79.88158962297365,700.0,B
287,260000,Villa Comercial Kennedy Norte 300 m² Av Principal Cerca de La Ganga,-2.160730886181925,-79.89992602893994,905.9233449477352,B
600,450000,Vendo Amplia Casa en Los Olivos 1,-2.168053753971139,-79.94217218728028,750.0,B
120,79500,"Venta de Casa en La Urb. Metrópolis 2 Etapa H, Vía Terminal Terrestre Pascuales",-2.0653775,-79.91703150000001,662.5,B
400,430000,Proyecto de Casa en Aires del Batan,-2.132157717728956,-79.8622032899745,1075.0,A
171,229237,Casas en Guayaquil Km 12 1/2 Via a La Costa Porto Alegre,-2.1883249,-80.02556779999998,1340.5672514619882,A
120,86000,"La Joya, Pague 20% de Entrada de 8 a 12 Meses",-2.053106354607908,-79.90975844985877,716.6666666666666,B
310,210000,Colinas de Los Ceibos - Villa 4 Dorm. -,-2.162768538987352,-79.93948525871451,677.4193548387096,B
584,460000,Villa Venta en Samborondón Urbanización Privada,-2.1063866,-79.87249600000001,787.6712328767123,B
101,109000,Sauces Uno Norte de Guayaquil,-2.1401749,-79.89198110000001,1079.2079207920792,A
350,450000,Casa - Norte de Guayaquil,-2.1747181,-79.9071157,1285.7142857142858,A
350,275000,Puerto Azul Casa con Dos Departamentos,-2.192507315947491,-79.97148711491138,785.7142857142857,B
593,682000,Casa en Construccion Aires de Batan Samborondon,-2.075973371570645,-79.86961709880626,1150.0843170320404,A
300,560000,Casa - Samborondón,-2.0772653,-79.8734366,1866.6666666666667,A
161,115000,Bonita Casa,-2.0581715,-79.87063369999998,714.2857142857143,B
300,210000,"Venta de Casa, 300 m² en Urb. Vía Al Sol Vía a La Costa",-2.1896713,-80.00842519999998,700.0,B
140,112000,"Venta de Casa en Urbanización Castilla, Cerca de C. C. El Dorado, Vía Salitre.",-2.04241750943956,-79.8633185306885,800.0,B
700,850000,"Casa de Lujo Via a La Costa, 7 Dorm, Piscina,5 Parqueos/700 M²/bbq",-2.1883249,-80.02556779999998,1214.2857142857142,A
375,4880000,Espectacular Casa con Piscina y Vista Al Rio,-2.0853184,-79.87263889999997,13013.333333333334,A
501,227000,"Casa en Venta, Urbanización Vicrieel, Vía Samborondón",-2.053239,-79.89721700000001,453.0938123752495,C
174,245000,Portofino Casa Duplex de Venta,-2.186405999999999,-79.9843973,1408.0459770114942,A
120,99000,"Venta Casa a Estrenar en Urb. Joya Etapa Oro, Cerca Mix Center",-2.047608808656506,-79.91596917910766,825.0,B
282,140000,Departamento en Venta con Cuatro Dorm. en El Centro de La Ciudad - F. Rodríguez,-2.1948182,-79.88189290000003,496.45390070921985,C
1230,600000,Vendo Linda Villa El Cortijo,-2.1956335,-79.91577940000002,487.8048780487805,C
457,420000,Vendo Hermosa Casa en Laguna del Sol,-2.0844192,-79.86818370000003,919.0371991247265,B
353,280000,De Venta Casa en Santa Maria de Casa Grande,-2.048720060964849,-79.89271186400146,793.2011331444759,B
1045,750000,Casa en Venta o Alquiler Disponible en Isla Sol,-2.1073055,-79.872252,717.7033492822967,B
429,385000,Samborondon Oportunidad Casa Minimalista 4 Dorm. con Piscina,-2.085503015388085,-79.87406778540037,897.4358974358975,B
120,110823,"Venta Casalaguna Modelo Fontana León Febres Cordero, Cerca del C. C El Dorado.",-2.0412082,-79.88794589999998,923.525,B
725,350000,"Urdesa Esquinera Uso de Suelo Comercial, Casa Amplia Mas Departamento y Oficina",-2.1718283,-79.9067876,482.7586206896552,C
1260,1150000,"La Mas Exquisita, Minimalista, Al Rio, Modernisima, Nitida.",-2.053454335297388,-79.8793029735233,912.6984126984127,B
115,68000,Casa en Venta Norte Mucho Lote 2 Plantas - Mariuxi Rugel,-2.096264579689291,-79.91913597193604,591.304347826087,B
564,370000,Urb. Tennis Club Vendo Casa,-2.116283293897647,-79.86906684072267,656.0283687943263,B
480,260000,Venta de Hermosa Casa en Cdla. La Saiba,-2.2273629,-79.8947804,541.6666666666666,B
72,48000,"Vivienda en Venta, Coop. Asaad Bucaram - Pascuales Paquisha",-2.0721302,-79.92906419999997,666.6666666666666,B
214,185000,Venta de Casa en Urbanización Bali 4 Dorm. - Precio Rebajado,-2.0508349,-79.90230079999998,864.4859813084112,B
450,330000,Casa de Oportunidad en Via a Samborondon,-2.125641391211939,-79.86871620685423,733.3333333333334,B
260,250000,Vendo Casa en Ciudad Celeste,-2.0715709,-79.84227920000001,961.5384615384615,B
480,300000,Casa en Venta en Santa Cecilia de Lujo,-2.161038,-79.941071,625.0,B
485,580000,Isla Mocoli Arrecife de Estreno,-2.104303099999986,-79.8588415880829,1195.8762886597938,A
297,139000,Venta de Casa de 3 Dorm. en Acuarelas del Rio,-2.1339347,-79.91133539999998,468.013468013468,C
250,140000,Saint Gallen a Lado del City Mall Casa Vendo $140.000,-2.1409812,-79.90962830000001,560.0,B
200,185000,Casa en Venta en Belohorizonte,-2.1847036,-79.97830149999999,925.0,B
593,569000,Villa Al Lago en Aires de Batan Av Samborondon,-2.0772653,-79.87343659999999,959.5278246205734,B
220,168000,"Vendo Villa Ciudad Celeste, La Brisa por Estrenar Precio de Oportunidad",-2.0700368,-79.8384279,763.6363636363636,B
344,255000,Bosques de La Costa Vendo Casa,-2.184009661218837,-79.97059950132751,741.2790697674419,B
170,83000,"Venta de Casa en Urb. Valle Alto, Etapa París.",-2.196655982737348,-80.06913502491454,488.2352941176471,C
800,800000,Villa Residencial en Venta en Samborondon Urbanización Rio Grande,-2.1496458,-79.8611832,1000.0,B
220,250000,Casa en Venta Via a La Costa Urb. Bosques de La Costa 4 Dorm - Mariuxi Rugel,-2.187166784822815,-79.99274515211829,1136.3636363636363,A
260,205000,*vendo Linda y Acogedora Casa Pto Azul,-2.186680450956173,-79.97113306325991,788.4615384615385,B
128,65000,Venta de Casa en Mucho Lote 1 Etapa1,-2.191526053604974,-79.88158962297365,507.8125,B
120,98000,"Venta de Casa, 250 m² en Cdla. Guayacanes Norte de Guayaquil",-2.117758759982687,-79.8963536602356,816.6666666666666,B
337,150000,Vendo Amplia Casa Alborada X Etapa (Herradura) - L. Arias - P. Silva,-2.136914488872506,-79.9128726852112,445.10385756676556,C
350,185000,Acuarela del Rio Vendo,-2.147297844474842,-79.89676560075532,528.5714285714286,B
300,240000,Vendo Casa de Estreno en Puerto Azul de 3 Dorm.,-2.187581016656953,-79.96821481985171,800.0,B
160,180000,Vendo Amplía Casa por Motivo de Viaje,-2.182181459984199,-79.91620561975219,1125.0,A
136,119500,"Se Vende Hermosa Casa 3 Dorm. con Aires, cortinas en Villa Club",-2.03103369121621,-79.89289056400145,878.6764705882352,B
634,550000,Vendo Hermosa Mansion Samborondon,-2.111083748018044,-79.87084865070835,867.5078864353312,B
40,28000,Departamento en Sauces IV - A. Marín - G. Sánchez,-2.1244174,-79.88638229999998,700.0,B
780,740000,Isla Mocoli Vendo Casa de Estreno Al Pie del Río,-2.103638360599412,-79.86032216745912,948.7179487179487,B
710,300000,Vendo Casa Rentera Alborada 10 Ma. (Costabienes),-2.136060378366787,-79.91083196773684,422.53521126760563,C
100,65000,"Venta Casa Villa España/sevilla, 3h, Acabados Diferentes (J. Luna)",-2.0796052,-79.9221723,650.0,B
120,80000,Hermosa y Remodelada Casa en Mucho Lote 1,-2.087365767601858,-79.92127360157468,666.6666666666666,B
320,290000,En Venta Hermosa y Cómoda Casa en Aquamarina Km1 Vía Samborondon,-2.1502649,-79.86545430000001,906.25,B
180,130000,"Casa en Los Ceibos, Santa Cecilia, de 3 Dorm., 180 m².",-2.164387438323206,-79.94552559341605,722.2222222222222,B
105,55000,"Cdla. Las Orquideas, Norte Guayaquil",-2.08415892875969,-79.91694159691156,523.8095238095239,B
366,305000,Venta Casa con Uso de Suelo Comercial en Ciudadela Albatros Norte de Guayaquil,-2.170915145674083,-79.89320096983641,833.3333333333334,B
195,135000,Casa - Norte de Guayaquil,-2.149867099999999,-79.8997163,692.3076923076923,B
74,110000,Amplia y Moderna Oficina en Norte de Guayaquil,-2.163554764875082,-79.90029910826865,1486.4864864864865,A
330,285000,Vendo Casa Vía Samborondon Km 3,-2.144358270208285,-79.86261426943969,863.6363636363636,B
125,55800,"Urbanización La Joya Etapa Opalo Vendo Preciosa y Moderna Villa 1 Planta, 2d.",-2.0271992,-79.91512879999999,446.4,C
911,880000,Casa Bellaaaaaa! Minimalista con Doble Altura Espectacular!,-2.086511590497017,-79.87099828381406,965.9714599341384,B
378,585000,"Isla Mocoli, Urbanización Arrecife Villa Unifamiliar Sismo Resistente",-2.1043031,-79.8604831,1547.6190476190477,A
550,275000,Vendo Casa Sector Ceibos,-2.162141408769173,-79.94279505263978,500.0,C
260,280000,Vendo Casa en *parques del Rio*,-2.150347486202786,-79.86685590756838,1076.923076923077,A
1315,570000,Casa Amplia con Piscina en Venta en Los Almendros - G. Sosa,-2.229026549932387,-79.8919644936401,433.4600760456274,C
378,460000,Casa de Venta en Terrasol en Vía Samborondón,-2.0853184,-79.87263889999997,1216.931216931217,A
461,320000,"Casa Rentera y Comercial en Urdesa, 1 Cuadra de Av Las Monjas",-2.1674147,-79.90888410000002,694.1431670281995,B
320,265000,Samborondon Km 7.5 Urbanizacion Terrasol Exclusiva Casa de Venta,-2.111083748018044,-79.87084865070835,828.125,B
618,490000,Vendo Casa - Urbanización. Guayaquil Tennis – Dos Plantas.,-2.1170338,-79.87147010000001,792.8802588996764,B
670,600000,"Urb Palmar del Rio - Casa 4 Dorm. - Us$600,000",-2.1231067,-79.87098370000001,895.5223880597015,B
457,480000,"Isla Mocoli, Casa 2 Plantas, 457 m². a Entregar Julio/19",-2.104158358380436,-79.86055015522538,1050.328227571116,A
210,240000,Vendo Casa Samborondon 1 Km,-2.1489703,-79.89583010000001,1142.857142857143,A
500,550000,"Urb Laguna del Sol - Casa Vista Al Lago - Us$550,000",-2.086040398815973,-79.86650168871614,1100.0,A
138,71000,"Venta Casa Esquinera en Villa Rey, Etapa Juan Carlos Cerca Plaza Tia",-2.0151908,-79.92810070000002,514.4927536231884,B
460,390000,Se Vende Linda Casa Puerto Azul,-2.194056939763134,-79.9712992778015,847.8260869565217,B
2400,700000,Oportunidad Hermosa Casa Lomas de Urdesa,-2.163865,-79.90667630000002,291.6666666666667,C
203,157000,Oportunidad Ciudad Celeste Casa 4 Dorm. en Venta,-2.07179360121206,-79.84207850322787,773.3990147783251,B
380,220000,Vendo Casa Puerto Azul 6 Habitaciones Elimos,-2.188974748223128,-79.96227104467471,578.9473684210526,B
800,1600000,Casa en Venta en Lagos del Batan,-2.0979672,-79.874552,2000.0,A
412,454000,Isla Mocoli - Proyecto en Venta - Urb. Pacifica,-2.099487733731183,-79.86406145489809,1101.9417475728155,A
121,120000,"Casa en Venta en La Joya, en Conjunto Esmeralda",-2.0389188,-79.91686179999999,991.7355371900826,B
800,950000,"Magnifica Casa Amplia, Iluminada, Modernisima, La Mejor del Mercado.",-2.088720252082443,-79.88856342565919,1187.5,A
400,320000,Vendo Casa Moderna Isla Mocoli,-2.094106824214779,-79.85657780367433,800.0,B
186,188500,Ciudad Celeste de Estreno Casa en Venta Acabados Modernos,-2.071613787296468,-79.84206462327882,1013.4408602150538,A
590,510000,Casa en Venta en Samborondón,-2.133914,-79.85978310000002,864.4067796610169,B
300,194500,"Urbanización Via Al Sol, Via a La Costa",-2.186047596917314,-80.00913330317991,648.3333333333334,B
500,230000,Casa de Una Planta en Centenario,-2.2131457,-79.91846699999996,460.0,C
174,115000,Se Vende Casa en Urb. La Rioja,-2.057191752422993,-79.92844572062376,660.919540229885,B
120,105,Departamento Puerto Azul,-2.186680450956173,-79.97113306325991,0.875,C
190,140000,Vendo Alquilo Casa Matices de Samborondon Frente Al Dorado,-2.0603313,-79.8779834,736.8421052631579,B
260,321000,Casa en Venta Mocolí - por Estrenar,-2.038519131034092,-79.91517483729552,1234.6153846153845,A
180,130000,Se Vende Casa en Urdesa,-2.166123793087345,-79.91167234129125,722.2222222222222,B
108,76000,Casa en Sauces 8 con Acabados de Primera,-2.127062899999999,-79.8930692,703.7037037037037,B
123,69500,Casa con Suite Independiente de Venta en Sauces II,-2.1389376,-79.88778200000002,565.040650406504,B
277,258000,"Urb. Puerto Azul, Casa en Venta, Vía a La Costa",-2.18930173896435,-79.96872980404407,931.4079422382672,B
357,645000,"Samborondon Casa en Venta en Laguna del Sol de Estreno, Casa Bioclimatica Exclusiva",-2.084923999999999,-79.8706035,1806.7226890756303,A
1200,1200000,Atencion! Grandes Empresas Que Deseen Ubicarse en El Corazon de Kennedy Norte,-2.157451716440733,-79.90175688886825,1000.0,B
257,295000,Vendo Casa en Primeros Kilometro de Samborondon,-2.1453197,-79.85837830000003,1147.8599221789884,A
458,650000,Mocoli Vendo Casa Urb. Barlovento Samborondon,-2.09789424997856,-79.86388682329141,1419.2139737991267,A
180,160000,Vendo Casa Cdla. Guayacanes,-2.11714911977476,-79.89230868752725,888.8888888888889,B
670,320000,"Venta de Casa Rentera, Forestal, Sur Guayaquil",-2.2103034,-79.89437269999996,477.6119402985075,C
159,150000,Vendo Casa en Santa Cecilia,-2.159922087054265,-79.94481780478515,943.3962264150944,B
280,400000,"Vendo Lujosa Casa en Urbanización Ciudad Colón, 4 Dorm., Piscina",-2.153284520839329,-79.9059544042251,1428.5714285714287,A
270,295000,Vía Samborondon Km. 5.5 Vendo Villa,-2.1538716,-79.86570970000002,1092.5925925925926,A
1204,620000,"Casa en Venta, Isla Sol, Vía Samborondón",-2.1472172,-79.85978310000002,514.9501661129568,B
160,95000,"Casa en Venta en Fuentes del Río, Cerca de El Dorado",-2.05864326417536,-79.87140617619627,593.75,B
383,260000,Amplia Casa en Estancias del Rio Samborondon,-2.0625285,-79.8773438,678.8511749347258,B
240,310000,"Vía La Puntilla, Samborondón - Sector Parque Histórico",-2.146618998457274,-79.86391709042971,1291.6666666666667,A
281,200000,"Linda Villa Venta, Belohorizonte, 4 Dorm.",-2.186718090974847,-79.98045433173826,711.7437722419929,B
320,160000,"Casa Rentera en Guayacanes, Esquinera, en Venta",-2.1579238,-79.89439779999998,500.0,C
150,85000,Venta Casa en Villa Club Una Planta,-2.050890890512851,-79.8909915600189,566.6666666666666,B
300,315000,Linda Casa en Venta - Km 5.5 de La Via a Samborondon,-2.106378884095808,-79.87259583486025,1050.0,A
112,95000,Se Vende Casa en Samanes 7,-2.1130847,-79.90947510000001,848.2142857142857,B
280,380000,Vendo Casa de Tres Dorm. en Urbanización Aqua Marina,-2.151820652196072,-79.86260499357911,1357.142857142857,A
152,71000,Villa Italia Casa en Venta,-2.0590257,-79.92686939999999,467.10526315789474,C
650,495000,Samborondon Km 4 Casa de 5 Dorm. y Piscina,-2.112800301216198,-79.8699479123535,761.5384615384615,B
220,150000,Vendo Via a La Costa. Linda Casa. 4 Habitaciones. $150.000,-2.181853860848055,-79.98271176132192,681.8181818181819,B
1048,780000,Espectacular Mansión Vendo Dentro de Olivos 1!,-2.1690401,-79.9450046,744.2748091603054,B
154,65000,Se Vende Casa Rentera en El Sur Oeste de Guayaquil,-2.1980669,-79.9070729,422.0779220779221,C
140,108000,Se Vende Casa Villa Club Floral,-2.043174033823704,-79.89250298623045,771.4285714285714,B
50,50000,Vendo Villa en Urb Villas del Rey - Via Samborondon,-2.0248305,-79.91677709999999,1000.0,B
444,310000,Vendo Casa Samborondón 3 Dorm.,-2.1136478,-79.8702872,698.1981981981982,B
137,69000,"Venta de Casa en Villa del Rey, Etapa Juan Carlos, Modelo Palacio 4b",-2.076758,-79.9401216,503.64963503649636,B
560,350000,Terreno con Uso Comercial Av Las Monjas,-2.171665635621931,-79.91216210629045,625.0,B
368,490000,Hermosa Casa 4d Laguna Club,-2.1856104,-79.9899024,1331.5217391304348,A
100,72000,La Rioja Villa de Dos Plantas por Estrenar,-2.057191752422993,-79.92844572062376,720.0,B
300,330000,Vendo Casa en Terranostra,-2.189967667128228,-80.00195052012941,1100.0,A
489,470000,Vendo Casa Samborondón,-2.092533418325432,-79.8565912147709,961.1451942740287,B
272,117000,Venta Casa Rentera de 3 Pisos Para Inversión,-2.185557558318887,-79.88563273967281,430.1470588235294,C
400,425000,Casa de 350 m² de Construcc. - 400 M².de Terreno,-2.0979646,-79.87451879999998,1062.5,A
191,54000,"De Venta Casa en La Coop. San Francisco 2, Km 18 Vía Daule",-2.0498355,-79.95966340000001,282.72251308900525,C
400,340000,Vendo Moderna Casa de Estreno en Isla Mocoli,-2.104303099999986,-79.8588415880829,850.0,B
871,460000,En Venta - Entre Ríos: Hermosa Propiedad con Vista Al Río,-2.146443455842542,-79.87049526903382,528.1285878300804,B
300,120000,Casa de 5 Dorm. Ciudadela Coviem Al Sur de Guayaquil,-2.235809800605249,-79.89780670472413,400.0,C
337,569000,Casa - Samborondón,-2.0773404,-79.8696922,1688.427299703264,A
300,399000,Villa de Venta o Alquiler en Samborondon Km 8,-2.1136478,-79.8702872,1330.0,A
201,170000,Venta de Hermosa Casa en Urb. Privada Precio de Oportunidad,-2.1195907,-79.90092620000001,845.7711442786069,B
200,120000,Vendo Casa de 4 Dorm. en Bellaista,-2.185328539769852,-79.90849724970701,600.0,B
700,850000,Vendo Casa en Lagos de Batan,-2.10374536343488,-79.86042558688354,1214.2857142857142,A
620,490000,"Vendo Casa Esquinera Urb Tennis Club con Piscina, Adicional Suite",-2.116218964786254,-79.86906684072267,790.3225806451613,B
185,186000,Elegante Casa Via a La Costa,-2.203783624422652,-80.06668099721685,1005.4054054054054,A
120,84000,Vendo a Estrenar en La Joya Etapa Oro,-2.076758,-79.9401216,700.0,B
1200,585000,Puerto Azúl - Vía a La Costa - Venta Casa de 4 Dorm. Usd 585.000,-2.187541119549965,-79.96832777263734,487.5,C
128,75000,Vendo Casa Urbanización Castilla Vía Samborondon,-2.0417313,-79.86323270000003,585.9375,B
160,99000,"Venta de Casa, Fuentes del Rio, Vía Samborondon",-2.05864326417536,-79.87140617619627,618.75,B
580,170000,Miraflores Villa Una Planta 500 Terreno,-2.1652008,-79.92146250000002,293.1034482758621,C
72,65000,Oportunidad Mucho Lote Vendo Hermosa Propriedad,-2.088315319226652,-79.92542519327623,902.7777777777778,B
225,195000,Urdesa Central de Oportunidad Casa de Dos Plantas,-2.168811234704845,-79.9051899071319,866.6666666666666,B
180,160000,Vendo Ciudad Celeste Linda Casa de Oportunidad,-2.07179360121206,-79.84207850322787,888.8888888888889,B
400,240000,Vendo Casa Ciudad Celeste,-2.1070207,-79.87232990000001,600.0,B
700,700000,"Divina Casa con Pisos de Marmol y Doble Altura, Excelentes Acabados.",-2.106021863883688,-79.87255465131227,1000.0,B
400,350000,Vendo Casa Esquinera en Kennedy Norte con Uso de Suelo Comercial,-2.164474106451892,-79.89995578551475,875.0,B
167,108000,Vendo Casa Esquinera en Cataluña Km 11 Via Puntilla Samborondon,-2.043800049378354,-79.87068854390259,646.7065868263473,B
736,205000,Vendo Casa en Urdesa Para Remodelar en Circunvalacion Norte.,-2.1620979,-79.91165189999998,278.5326086956522,C
300,240000,Venta Casa por Estrenar Urb Puerto Azul 3 Dorm.,-2.1763111,-79.9407036,800.0,B
1400,1400000,Amplisima Casa en Muy Buena Urbanizacion Privada. Excelente Vecindario.,-2.2807256333333,-79.880271266667,1000.0,B
108,72500,Casa en Sauces 8 con Acabados de Primera,-2.127062899999999,-79.8930692,671.2962962962963,B
93,99000,Casa - Vía a La Costa,-2.1879729,-80.0209785,1064.516129032258,A
210,200000,Amplia Casa Semiesquinera Excelente Posición,-2.189967667128228,-80.00195052012941,952.3809523809524,B
624,315000,Vendo Propiedad Rentera en Cdla Bolivariana,-2.1820765,-79.8961683,504.8076923076923,B
127,70000,Casa de Venta en Las Primeras Etapas de La Joya.,-2.040685138301203,-79.91475667301637,551.1811023622047,B
90,79000,Se Vende Sauces 9,-2.1323186,-79.89268090000002,877.7777777777778,B
190,125000,Villa Club Vendo Casa 5 Habitaciones Pergola Bbq Remodelada Lavanderia 5 Baños,-2.0383247,-79.89550839999998,657.8947368421053,B
1100,550000,Samborondon Km 1 Venta 2 Casas Unidas y Suite Al Pie del Rio,-2.145753091854706,-79.86453116357421,500.0,C
200,185000,Venta de Casa en Urb. Bali con 4 Dorm. - Buen Precio,-2.111083748018044,-79.87084865070835,925.0,B
313,370000,Casa de Estreno en Samborondon,-2.1085679,-79.87196840000001,1182.1086261980831,A
907,700000,Puntilla Villa de Venta con Vista Al Rio,-2.155044348019845,-79.8653830925964,771.7750826901874,B
465,491000,Proyecto Espectacular Minimalista Moderno Recién Salido de Horno! Isla Mocoli!,-2.1043031,-79.86048310000001,1055.9139784946237,A
110,58000,Hermosa Villa por Estrenar,-2.0573686,-79.95598790000003,527.2727272727273,B
153,140000,Venta de Casa en Villa Club - Magna a Estrenar,-2.191526053604974,-79.88158962297365,915.0326797385621,B
600,270000,Venta de Casa en Centenario,-2.191526053604974,-79.88158962297365,450.0,C
120,75000,Vendo Casa de Oportunidad en Urb. Marina Dor - K. Aguirre,-2.0470178,-79.8723837,625.0,B
240,240000,Vendo Villa con Dos Departamentos Independientes en Garzota,-2.14741479091171,-79.88663313365839,1000.0,B
250,280000,Hermosa Casa Amplia Km 1.5 Samborondon!,-1.2427708,-78.631486,1120.0,A
1000,550000,Alquilo Casa en Urdesa de 600 m² de Construccion y 1.000 m² de Terreno,-2.163865,-79.90667630000002,550.0,B
140,138000,Se Vende Amplia Casa en San Felipe Etapa Malaga,-2.13621251959997,-79.92563862019881,985.7142857142857,B
70,50000,Vendo Hermosa Casa en Sauces IX,-2.149867099999999,-79.8997163,714.2857142857143,B
394,550000,*lujosa Residencia en Ceibos Norte,-2.152299195201849,-79.94332025655774,1395.9390862944163,A
120,83000,Casa Venta en Urbanización Logare Cerca Al Mall del Dorado,-2.019480923416121,-79.86468138623047,691.6666666666666,B
150,115000,Oportunidad! por Estrenar - Casa Vía a La Costa,-2.1860134,-80.04999959999998,766.6666666666666,B
212,177000,"Ciudad Celeste Serena Casa de 2 Plantas 212,21 m² 4 Dorm. $177.000 Negociables",-2.1257004,-79.86326789999998,834.9056603773585,B
75,114107,Costalmar 2 - Genova,-2.191232976189999,-80.0479501737,1521.4266666666667,A
450,198000,Cdla. Nueva Kennedy Casa Rentera con 2 Departamentos $198.000,-2.176341,-79.89794560000001,440.0,C
480,295000,Casa - Vía a La Costa,-2.1884336,-80.0272384,614.5833333333334,B
611,235000,Villa Rentera Cdla Miraflores Oportunidad!,-2.1632443,-79.91815329999997,384.61538461538464,C
540,620000,Amplia Casa Moderna en Mocoli Arrecife Samborondon,-2.103776381451598,-79.85650835431215,1148.148148148148,A
200,260000,Vendo Casa Conjunto Residencial Las Pirámides – Samborondón Km. 3,-2.1209746,-79.8650035,1300.0,A
1000,350000,Casa en Cumbres de Los Ceibos,-2.1586292,-79.94210340000001,350.0,C
540,700000,Vendo Moderna Casa en Portofino 4 Dorm.,-2.185299588983019,-79.9853671863869,1296.2962962962963,A
160,96000,Se Vende Hermosa Casa Duplex 2 Plantas Brisas del Norte,-2.0382312,-79.8683739,600.0,B
127,140000,Vendo Hermosa Casa de Estreno en Villa Club 4 Dorm.,-2.038710693663342,-79.89400636295164,1102.3622047244094,A
550,550000,Puerto Azul Alquiler y / o Venta Hermosa Villa con Piscina,-2.1859149,-79.9663554,1000.0,B
190,113000,"Venta Casa, Precio de Oportunidad. Urb Cataluña, Cerca Al C. C El Dorado",-2.0446042,-79.8723837,594.7368421052631,B
298,150000,Venta Casa Bifamiliar Rentera Sector Norte Urdenor 1,-2.1462974,-79.90317759999999,503.3557046979866,B
920,4400000,Vend Hermosa Casa en Santa Maria de Casagramde,-2.082859537943885,-79.87008153933715,4782.608695652174,A
127,69500,"Urbanización Villa Club Etapa Luna, Vendo Preciosa Villa",-2.038903690460307,-79.89399563411558,547.2440944881889,B
457,499000,"Casa a La Venta en Via a Samborondon, Estancias del Rio",-2.064464534383507,-79.87280755581969,1091.9037199124728,A
