metroscuadradostotales,precio,titulo,latitud,longitud,preciomt2,categoria
250,260000,Casa en Venta en Puerto Azul,-2.189258854883414,-79.96493716043551,1040.0,A
519,430000,Casa de Venta en Vista Al Parque Samborondón,-2.0742032,-79.87588349999999,828.5163776493256,B
108,108000,Vendo Casa de Estreno Urb Perla Autopista Norte,-2.0568976,-79.907376,1000.0,B
180,180000,En Venta Casa en Bosques de La Costa - E. Salcedo,-2.1846154,-79.9699665,1000.0,B
254,154000,Casa con 3 Departamentos Junto a Mal del Sol Cdla Vernaza,-2.1515464,-79.8934893,606.2992125984252,B
484,570000,Hermosa Casa de Estreno en Venta,-2.095725795682101,-79.86072986322938,1177.685950413223,A
600,270000,Centenario - Casa en Venta 3d con Piscina con Dpto de 2d Para Alquiler - $,-2.216601371757948,-79.88908766613156,450.0,C
1640,945000,Casa de Lujo en Vía Samborondón,-2.1956327,-79.91578149999998,576.219512195122,B
98,85000,"Casa en Venta en Urbanización La Perla, 1ra. Etapa - G. Sosa",-2.0568976,-79.907376,867.3469387755102,B
384,265000,Villa,-2.064421770912575,-79.87276556112977,690.1041666666666,B
2000,1800000,Maravillosa Mansion con Vista Al Rio Daule,-2.1956335,-79.91577940000002,900.0,B
81,50000,"Sauces 6, Casa en Venta",-2.1251006,-79.89827930000001,617.283950617284,B
865,500000,Casa de Una Planta 865 m² · 5 Habitaciones · 2 Estacionamientos,-2.192116,-79.96683080000003,578.0346820809249,B
108,88500,Vendo Casa Metropolis II,-2.065851,-79.91408910000001,819.4444444444445,B
127,125000,"Venta de Casa a Estrenar en Napoli Cerca de Plaza Milan, Via Salitre",-2.191526053604974,-79.88158962297365,984.2519685039371,B
2095,1200000,Espectacular Casa en Urbanizacion Excusiva de Samborondon,-2.138579558195907,-79.86098472963869,572.7923627684964,B
219,259000,Isla Celeste Vendo Proyecto de Casa,-2.0694324,-79.8416923,1182.648401826484,A
595,560000,Casa en Venta con Acabados de Lujo,-2.1031223,-79.86468350000001,941.1764705882352,B
200,365000,Vendo Casa Ceibos Norte Estreno 3 Plantas Piscina Semi - Equipada Acabados 1 Era,-2.151157118069722,-79.94075598092041,1825.0,A
770,519500,"Mejor Precio Imposible, Aires del Batan, Samborondon, Guayaquil",-2.077683497087564,-79.87020718413089,674.6753246753246,B
609,470000,"Vendo Casa en Urb. Palmar del Rio, Km 4.5 La Puntilla",-2.1190084,-79.86893909999998,771.7569786535304,B
702,1800000,Venta de Exclusiva Casa Excelente Ubicacion,-2.1538753,-79.9107111,2564.102564102564,A
270,135000,"Casa en Venta, Ubicada Av Principal Vía Perimetral",-2.2402791,-79.92206859999999,500.0,C
950,495000,"Colinas de Los Ceibos Renta/venta Casa con Mega Patio, Jardin y Piscina",-2.164687631387573,-79.94498915161307,521.0526315789474,B
123,118000,Se Vende Hermoso Departamento Santa Cecilia,-2.161412367143186,-79.94016648780519,959.349593495935,B
412,420000,Casa Rentera - Kennedy Norte - Guayaquil,-2.156566999999999,-79.9010784,1019.4174757281553,A
160,98000,Hermosa Casa de Venta en Urbanización Villa Club,-2.037201919091249,-79.89794258524171,612.5,B
253,275000,"Bosques de La Costa, Estreno - Casa, 3 Dorm + Suite en Pb",-2.184009661218837,-79.97059950132751,1086.9565217391305,A
150,75000,"Venta de Casa, Calle D y La 27 Ava, Sur de Guayaquil",-2.2090895,-79.89261850000003,500.0,C
398,380000,Se Vende Acogedora Casa con Piscina Primeros Km,-2.038710497715971,-79.91304427802652,954.7738693467337,B
147,110000,"Venta Casa, Urb. La Joya, Aurora, Primeras Etapas, Cerca Piazza Joya",-2.046665273653481,-79.9114201526184,748.2993197278912,B
500,550000,Casa de Venta en Laguna del Sol Al Lago en Vía Samborondón,-2.082085910194585,-79.87252865239259,1100.0,A
249,329000,Portofino - Hermosa Casa a La Venta de 3d - Us$,-2.183747749044455,-79.98450716368404,1321.285140562249,A
680,380000,Vendo Villa Cimas del Bim Bam Bum,-2.1638839,-79.9278817,558.8235294117648,B
1090,650000,"Urb Los Lagos - con Vista Al Lago - 4 Dorm. - Ud$650,000",-2.128368261661808,-79.86259635600584,596.3302752293578,B
620,280000,Vendo Casa en Villas del Bosque Lista Para Estrenar,-2.2035682,-80.0667034,451.61290322580646,C
180,185000,Se Vende Linda Casa en Bosques de La Costa,-2.185665317740377,-80.00589442911371,1027.7777777777778,A
123,73000,Casa 2 Plantas Palacio 10 Villa del Rey,-2.0248305,-79.91677709999999,593.4959349593496,B
127,110000,"Casa Venta, Urb Castilla",-2.0417313,-79.86323270000003,866.1417322834645,B
229,290000,Samborondon Casa en Venta en Primeros Kms 4 Dorm. y Estudio,-2.14881046332151,-79.86345115316777,1266.3755458515284,A
600,550000,"Exclusiva Casa en Los Olivos I, Ceibos - Vía a La Costa",-2.169251467530567,-79.941950755542,916.6666666666666,B
165,98000,Alborada Séptima,-2.1402401,-79.9017781,593.939393939394,B
400,450000,Vendo Casa Moderna de Estreno Isla Mocoli,-2.099934878612458,-79.8578470987091,1125.0,A
108,93000,"Venta de Casa en Urb. Metropolis II C, Cerca del Supermercado Tia, N. de Jesus",-2.191526053604974,-79.88158962297365,861.1111111111111,B
180,175000,Ciudad Celeste Casa Dos Plantas 3 Dorm.,-2.071613787296468,-79.84206462327882,972.2222222222222,B
338,585000,Laguna del Sol Estrene Casa con Vista Al Lago - Enrique Rodríguez,-2.084923999999999,-79.8706035,1730.7692307692307,A
423,350000,Venta de Casa en Riviera Club,-2.137652068040713,-79.86503898638921,827.4231678486998,B
182,140000,# Urb Napoli VI a Salitre Casa Esquinera,-2.0696491,-79.93587660000003,769.2307692307693,B
200,205000,De Venta Casa en Samborondón,-2.1073055,-79.872252,1025.0,A
140,110000,Samborondon Cataluña Vendo Casa 3 Dorm.,-2.0446042,-79.8723837,785.7142857142857,B
644,580000,Venta de Casa con Vista Al Estero,-2.175563299999999,-79.90413,900.6211180124224,B
383,265000,Casa en Venta en Estancias del Río Samborondón,-2.064464534383507,-79.87280755581969,691.9060052219321,B
101,79000,"En Venta Casa, Cdla. Ciudad Olimpo Etapa 1 - A, Vía La Costa",-2.2274719,-80.07724250000001,782.1782178217821,B
115,85000,"Propiedad en Venta, Urb. Loma Vista.",-2.0966191,-79.94315790000002,739.1304347826087,B
158,110000,Se Vende Casa en Barrio Orellana,-2.1859333,-79.8926535,696.2025316455696,B
600,585000,Vendo Moderna Casa de Lujo. 4 Dorm. en Estancias del Rio,-2.065712199194186,-79.8742135269531,975.0,B
642,550000,Hermosa Casa en Entrelagos de Oportunidad - R. Hurtado - J. Moncada,-2.0904681,-79.86958370000002,856.6978193146417,B
480,550000,Mocoli Estrene Linda Villa 375 m² 4 Dorm Piscina Minimalista,-2.1043031,-79.86048310000001,1145.8333333333333,A
230,200000,Casa en Venta Via a La Costa Terranostra Sin Hipoteca - Mariuxi Rugel,-2.184851042718297,-79.99583505690345,869.5652173913044,B
800,750000,Preciosa Casa Venta Samborondon,-2.138267121657221,-79.86290618049316,937.5,B
160,155000,"Casa en Venta en Matices, Frente a El Dorado",-2.058186918530874,-79.87630970157471,968.75,B
510,595000,"Villa en Laguna del Sol Al Lago, Samborondon (En Construcción)",-2.07355037851966,-79.86635780478514,1166.6666666666667,A
96,37000,"Proyecto Inmobiliario, Mi Lote, Norte de Guayaquil",-2.080461,-79.91587700000002,385.4166666666667,C
183,215000,Vendo de Estreno Villa Via a La Costa Primeros Kms,-2.1842287,-79.97574639999999,1174.863387978142,A
2000,1200000,Casa en Samborondon Urb. Laguna Dorada con Vista Al Lago,-2.1411698,-79.8597831,600.0,B
383,123000,"Cdla Coviem, Frente Parque Acuático, Se Vende Casa a Estrenar",-2.2374179,-79.90282780000001,321.14882506527414,C
180,112000,Gran Casa en Villa Club Etapa Floral a La Venta,-2.1579238,-79.89439779999998,622.2222222222222,B
512,469000,Venta de Villa Moderna 4 Dorm Mas Estudio y Piscina - Estrene,-2.102587642904662,-79.85962479311524,916.015625,B
160,125000,Samborondon - Napoli Casa en Venta,-2.191526053604974,-79.88158962297365,781.25,B
250,218000,Venta de Casa Seminueva en Kennedy Nueva,-2.191526053604974,-79.88158962297365,872.0,B
400,325000,Vendo Casa Albatros Norte de Guayaquil Uso de Suelo Comercial,-2.1708751,-79.89246509999998,812.5,B
132,115000,Venta de Casa Esquinera en Urbanización La Joya - Etapa La Perla,-2.076758,-79.9401216,871.2121212121212,B
144,116000,"Vendo Casa en Urb. La Joya en Construcción, Modelo Exclusivo Etapa Topacio",-2.053850318861618,-79.91808379050445,805.5555555555555,B
300,385000,Villa a La Venta en Km 5.5 Av Samborondon,-2.1133853,-79.87082269999996,1283.3333333333333,A
105,17000,"Casa en Venta de Oportunidad, Entrada de La 8",-2.1183964,-79.9475124,161.9047619047619,C
213,138000,Vendo Casa Ciudad Celeste,-2.073852189841814,-79.84508257732455,647.887323943662,B
190,170000,"Ciudad Celeste, Vendo Linda y Confortable Casa",-2.073017993264092,-79.87362921655273,894.7368421052631,B
160,105000,Casa de Venta en Urbanización Valle Alto - Etapa Londres,-2.193749722104528,-80.05135992188718,656.25,B
240,320000,Casa en Venta en Plaza Real Samborondon!,-2.1419603,-79.86901449999999,1333.3333333333333,A
100,84000,"Venta de Casa por Estrenar en Urb Villa del Rey, La Aurora - Daule",-2.076758,-79.9401216,840.0,B
140,129000,Casa en Venta en Urb. Mallorca $136.000,-2.036956,-79.86867760000001,921.4285714285714,B
1217,850000,Quiere Vivir en Grande! 1eros Kilóm Sin Tráfico Km 1.5 Antes Nuevo Puente,-2.040030402207288,-79.83063697315708,698.4387838948234,B
2000,1200000,Vendo Hermosa Casa en Samborondon,-2.059297785363572,-79.87595557667271,600.0,B
202,125000,"Vendo Casa con Uso de Suelo Comercial, Centenario Sur, Cerca Al Banco Pichincha",-2.2244647,-79.89128740000001,618.8118811881188,B
250,225000,Casa 3 Dorm. 3 Dorm. en El Km 1 Via Samborondon,-2.14881046332151,-79.86345115316777,900.0,B
375,280000,En Venta Casa de 5Dorm. en Cdla. Albatros - I. Alarcón,-2.170915145674083,-79.89320096983641,746.6666666666666,B
203,290000,Casa en Venta Villa 3 en Mocolí Gardens en Vía a Samborondón,-2.104088667966229,-79.86041872698365,1428.5714285714287,A
120,50000,Santa Elena - Villa Marina Casa en Venta,-2.191526053604974,-79.88158962297365,416.6666666666667,C
397,350000,De Oportunidad Casa en Venta en Urb. Villa Nueva,-2.150588200000001,-79.8664336,881.6120906801008,B
180,158000,Casa de Estreno Villas del Bosque 4 Habitaciones,-2.1337148,-79.9335537,877.7777777777778,B
450,559400,Proyecto en Aires de Batán Tercera Etapa,-2.0772653,-79.87343659999999,1243.111111111111,A
666,620000,Vendo Casa Mocoli Moderna Dormitorio Planta Baja Piscina,-2.103638360599412,-79.86032216745912,930.9309309309309,B
165,170000,Casa de Oportunidad de Venta en Samborondon,-2.271652498184291,-78.9993077470703,1030.3030303030303,A
212,268000,"Casa de Venta en Urb. Estancias del Rio, Samborondon, Cerca de Cc El Dorado",-2.063653599999999,-79.8783334,1264.1509433962265,A
400,460000,Casa en Venta en Mocoli,-2.098672889333189,-79.86270962155459,1150.0,A
300,299000,Casa de Estreno Ceibos,-2.151361256104656,-79.94149639367066,996.6666666666666,B
400,460000,"Proyecto de Casa en Venta en Puerto Mocolí, en Isla Mocolí en Vía Samborondón",-2.116967726368195,-79.86898183323399,1150.0,A
367,188000,"Casa en Venta, Urbanización Belo Horizonte, Vía a La Costa",-2.187779471895832,-79.9782656491821,512.2615803814714,B
412,454000,"Urb Pacifica - Isla Mocoli - Casa en Proyecto - Us$454,000",-2.107390918014789,-79.85893814760743,1101.9417475728155,A
384,260000,"Samborondon, Estancias del Rio, 3 Dorm. 3.5 Baños, Amplio Patio",-2.064285067031483,-79.87646700957032,677.0833333333334,B
250,180000,Venta Casa Via a La Costa Km 21 Urb Villa del Bosque,-2.186265569748732,-80.01987108548894,720.0,B
245,210000,Cumbres Venta Casa Sin Amob 3 Hab Piscina Bbq Conj Res,-2.156828033536438,-79.9446783206543,857.1428571428571,B
243,95000,"En Venta Casa, Las Orquídeas Al Norte de Guayaquil",-2.087468948017258,-79.9167950629087,390.94650205761315,C
710,750000,"Vendo Lujosa Casa de 4 Dorms con Vista Al Lago Km 7 Vía a Samborondón. Cdla ""Triple A""",-2.085318399999999,-79.87263889999997,1056.338028169014,A
160,95000,Vendo Casa en Urb. La Joya,-2.047608808656506,-79.91596917910766,593.75,B
650,555000,Vendo Linda Casa con Hermosa Vista Al Lago en La Ciudadela El Rio,-2.1350949,-79.86274359999999,853.8461538461538,B
243,99000,"Venta de Casa, Urb. Santorini, Norte de Guayaquil",-2.1352505,-79.9245171,407.4074074074074,C
334,482000,Casa Isla Mocoli Etapa Pacifica,-2.1709979,-79.9223592,1443.11377245509,A
120,66500,Urbanización Compostela Vendo Preciosa Casa de Dos Plantas,-2.0234794,-79.8659892,554.1666666666666,B
280,192000,"Casa en Venta Via a La Costa Km 11,5",-2.183062957823979,-79.98330757301636,685.7142857142857,B
165,195000,Hermosa Casa de Venta en Bellavista Dos Plantas,-2.185783730340475,-79.91440317529418,1181.8181818181818,A
72,37000,Casa en Mucho Lote Frente a La Iglesia San Lucas,-2.0820049,-79.92294729999998,513.8888888888889,B
457,620000,Batan Estrene Casa Moderna de 4 Dorm. Samborondon,-2.111083748018044,-79.87084865070835,1356.6739606126914,A
185,145000,Vendo Via Samborondon Preciosa Casa. 4 Habitaciones $145.000,-2.037189596756984,-79.84024464625548,783.7837837837837,B
185,130000,Venta de Casa en Urdesa Central 3 Dorm.,-2.165798588383933,-79.91138044553827,702.7027027027027,B
81,90000,"Venta de Casa en Sauces 3, Norte de Guayaquil.",-2.126702077513178,-79.89166258678586,1111.111111111111,A
500,598000,"Venta Casa Puerto Azul Via a La Costa - Guayaquil: Lindisima, 4 Dorm., Piscina",-2.189655532017107,-79.96490497392733,1196.0,A
100,64338,Venta de Casa Esquinera 4 Dorm. en Villa Bonita Mi Lote,-2.0539554,-79.98665830000004,643.38,B
244,190000,"Terranostra Urb Via a La Costa Vendo Villa, 3 Dorm., Acabados Especiales",-2.1924871,-79.99881770000002,778.688524590164,B
130,73000,Vendo Hermosa Casa Vía Samborondon Salitre,-2.0391097,-79.86709969999998,561.5384615384615,B
78,73000,"Casa en Venta, Mucho Lote 2 - Alameda del Río, Norte de Guayaquil",-2.0597409,-79.8917644,935.8974358974359,B
195,195000,Casa por Estrenar Santa María de Casa Grande,-2.053153149341061,-79.93202611036986,1000.0,B
186,194800,Estrena Casa en Ciudad Celeste de Venta,-2.271652498184291,-78.9993077470703,1047.3118279569892,A
96,62714,Venta de Casas – Villa Bonita - Daule,-2.062149511606544,-79.97582676499025,653.2708333333334,B
120,99000,Venta - Casa Urbanización La Joya Etapa Oro,-2.0539063,-79.89672200000001,825.0,B
180,185000,"Casa en Venta Via Al Sol, 3 Dorm, 4 Bañ, Piscina, Via a La Costa.",-2.184593737819526,-79.99532007277259,1027.7777777777778,A
180,160000,"Venta de Casa por Construir en Urb Ciudad Celeste - La Serena, Vía Samborondón",-2.075939203530357,-79.8746686002197,888.8888888888889,B
208,175000,Vendo Linda Casa en Ciudad Celeste - Acabados de Primera,-2.072323347119769,-79.84285909153482,841.3461538461538,B
750,900000,"Minimalista, Espectacular, Acabados Triple Aaa, Mudese Hoy.",-2.098773195927682,-79.87380167514647,1200.0,A
72,76000,"De Venta Casa en La Urb. Colinas del Sol, Vía Daule",-2.095010327519334,-79.9423670544922,1055.5555555555557,A
150,150000,"Via a La Costa Km 19.5 Venta Casa de 2 Pisos con 3 Hab, Patio y Garaje",-2.1945991,-80.05364279999998,1000.0,B
300,350000,Se Vende Casa en Ceibos Norte Dos Plantas,-2.150243650191443,-79.94297323372956,1166.6666666666667,A
247,260000,Hermosa Casa en Venta Blanca Iluminada! Km 2.5 Via Samborondon Todo a La Mano!,-2.132206171361813,-79.87254429067991,1052.6315789473683,A
800,280000,Casa Excelente Ubicación Urdesa Central Circunvalación Sur,-2.166123793087345,-79.91167234129125,350.0,C
154,135000,Villa Nueva por Estreno Urbanización Nàpoli con Jacuzzi Via La Aurora Km 13,-2.2208714,-79.9060609,876.6233766233767,B
160,135000,"Casa en Venta en La Garzota, Más Suite",-2.145324634425512,-79.8878710111145,843.75,B
72,62000,"Vendo Casa en Mucho Lote, 3 Dorm. c/u con Bano, Parqueo Techado",-2.096549775638565,-79.91401874841006,861.1111111111111,B
400,350000,Casa de Dos Planta 4 Dorm. Samborondon,-2.1165977,-79.86755210000001,875.0,B
723,420000,Vendo Casa Comercial a La Entrada de Urdesa - Excelente Ubicacion,-2.17489011487964,-79.90702453809814,580.9128630705394,B
292,305000,Town House 215 m² Al Pie del Rio Babahoyo - Isla Mocoli,-2.09193032351369,-79.85563366610108,1044.5205479452054,A
168,115000,Vendo Linda Casa Esquinera en Urbanización Cataluña - Samborondón,-2.1436973,-79.89513449999998,684.5238095238095,B
143,75000,Casa - Sur de Guayaquil,-2.2036107,-79.9146894,524.4755244755245,B
248,115000,"Casa en Miraflores, Buena Ubicación",-2.1652516,-79.92081730000001,463.7096774193548,C
383,220000,Casa en El Barrio del Centenario,-2.2146809,-79.92136169999998,574.4125326370757,B
250,345000,Vendo Villa Mocoli - Blue Bay,-2.1043031,-79.86048310000001,1380.0,A
72,38000,Vendo Casa de 1 Planta en Urb Ecocity Vía Daule,-2.076452,-79.9437532,527.7777777777778,B
120,100000,En Venta Hermosa Casa en Milan Cerca del Cc. El Dorado.,-2.038423304877551,-79.86963042766297,833.3333333333334,B
230,210000,"Punta Esmeralda, por Estrenar, Casa 3 Dorm. c/u con Bano",-2.1868497,-79.99409660000003,913.0434782608696,B
2460,80000,"Casa en Los Vergeles, Ubicada en La Autopista.",-2.2514992,-79.87938329999997,32.520325203252035,C
72,40000,En Venta Casa de Una Planta Mucho Lote 1 - A. Espinoza,-2.0646512,-79.89268090000002,555.5555555555555,B
90,75000,Vendo en Aura de Villa Club un Piso - Samborondón,-2.050472733880216,-79.88969337085564,833.3333333333334,B
128,150000,Se Vende Casa Vía Salitre en La Urb Milán Etapa Turin,-2.052285935071259,-79.88118795673961,1171.875,A
225,259000,Venta Vendo en Samborondon Casa en Ciudad Celeste,-2.07941565850068,-79.83799314794919,1151.111111111111,A
450,470000,"Proyecto l'Isola, Isla Mocolí",-2.1062551,-79.85909889999999,1044.4444444444443,A
256,240000,Casa en Venta - 4d - Km 7 - $240.000,-2.192116,-79.96683080000003,937.5,B
330,250000,Se Vende Casa de Dos Plantas en Puerto Azul 330 m²,-2.189258854883414,-79.96493716043551,757.5757575757576,B
300,270000,Vendo Via Samborondon Hermosa Propiedad 3 Habitaciones $270.000 Primeros Km,-2.023218161944472,-79.86988305546299,900.0,B
570,285000,Vendo Villa Tradicional de 4 Dorms en El Corazón de El Centenario,-2.221875999999999,-79.88988159999997,500.0,C
600,820000,Laguna Club Us$820.000 Piscina 4 Dorm.,-2.226174,-79.94200460000002,1366.6666666666667,A
153,119000,Venta Casa en Mirador Sector Bellavista,-2.180677933524016,-79.91489747937624,777.7777777777778,B
168,75000,Excelente Inversión - Casa Rentera!,-2.130663440049926,-79.89760671971862,446.42857142857144,C
305,320000,Urb. Terrasol Casa de 3 Dorm. con Excelentes Acabados,-2.088043,-79.86818370000003,1049.1803278688524,A
495,420000,Casa de Estrno Urb. Tenis Club - K. Aguirre,-2.1170338,-79.87147010000001,848.4848484848485,B
175,150000,Urbanizaciòn Bali Vendo Villa,-2.0508349,-79.90230079999998,857.1428571428571,B
390,220000,"Casa en Venta, Vía Samborondón, Entre Ríos",-2.14761003565278,-79.86957395595323,564.1025641025641,B
120,130000,Casas en Acuarela del Rio Conjunto Privado - Autopista Terminal Terrestre,-2.1346815,-79.8842826,1083.3333333333333,A
202,175000,Via a La Costa Urbanizacion Portal Al Sol (Dueño Directo),-2.1826095,-79.99289049999999,866.3366336633663,B
520,180000,"Vendo. ""Miraflores"" Bonita Casa. 1 Planta. 3 Habitaciones. $180.000",-2.1883249,-80.02556779999998,346.15384615384613,C
484,499000,Encasa Tu Solucion en Construccion Residencial en Samborondon,-2.1043031,-79.8604831,1030.9917355371902,A
220,229000,Linda Casa. Acabados de Primera 3 Dorm. 240 m Terreno,-2.187891926118592,-79.96622998518069,1040.909090909091,A
300,240000,Venta de Casa en Puerto Azul,-2.191526053604974,-79.88158962297365,800.0,B
225,228000,Vendo Hermosa Casa de Estreno en Ciudad Celeste,-2.071613787296468,-79.84206462327882,1013.3333333333334,A
317,170000,Venta de Casa en Via a La Costa Km 21 en Villas del Bosque,-2.2043106,-80.06735960000003,536.2776025236593,B
162,140000,"Venta de Casa en Urb. La Joya - Etapa Gema, Av Leon Febres Cordero",-2.029117145154608,-79.92294736566771,864.1975308641976,B
183,165000,Vendo Casa Ciudad Celeste,-2.071613787296468,-79.84206462327882,901.639344262295,B
500,585000,Venta de Casa 4 Dorm Via Samborondon Km 7.5 con Piscina,-2.044306329684585,-79.87240692645872,1170.0,A
130,120000,Urbanización San Antonio Casa con 3 Dorm. Us $120.000,-2.0450159,-79.8686237,923.0769230769231,B
567,480000,"Casa en Venta, Urb. Puerto Azul, Vía a La Costa",-2.186680450956173,-79.97113306325991,846.5608465608466,B
217,240000,Vendo Villa en Puerto Azul 4Dorm.,-2.189258854883414,-79.96493716043551,1105.9907834101382,A
105,62000,"Casa Venta, Urb. Las Orquídeas Sector 3, Norte Guayaquil",-2.083697893924101,-79.91695232574762,590.4761904761905,B
220,149000,Vendo Casa en Samborondon Urb. Fuentes del Rio,-2.063035426778712,-79.87149261077877,677.2727272727273,B
110,68000,"Vendo Casa de Dos Plantas en Villas de Rey, por Estrenar, Cerca a Plaza Tía",-2.2593268,-79.8716837,618.1818181818181,B
120,77500,"Urbanización Marina D´or Park Vendo Preciosa Villa Dos Plantas, Tres Dorm.",-2.139855307960203,-79.86360132235717,645.8333333333334,B
180,192000,"Punta Esmeralda, Via a La Costa Vendo Linda y Confortable Casa.",-2.183342031905175,-79.99406450052493,1066.6666666666667,A
189,187000,Bellohorizonte - Casa - Conjunto Privado - Km 11.5,-2.1873894,-79.9809942,989.4179894179895,B
250,380000,Casa de Venta en Vista Sol en Vía Samborondón,-2.087339767999961,-79.87293762683106,1520.0,A
127,92000,Se Vende Casa de Oport. Excelente Precio de 3 Dorm. en Urb. Villa Club,-2.03103369121621,-79.89289056400145,724.4094488188977,B
180,170000,Excelente Casa en Venta 140 m² Vía a La Costa - 3 Dorm. (Cód. 620),-2.185665317740377,-80.00589442911371,944.4444444444445,B
427,170000,En Venta Casa Rentera Excelente Ubicación,-2.206711680219937,-79.9034741183853,398.1264637002342,C
252,250000,Villa 2 Plantas Casi Nueva,-2.3839594,-80.35587520000001,992.063492063492,B
373,395000,Casa de Estreno Al Lago en Isla Mocoli,-2.105081252988366,-79.8578470987091,1058.9812332439678,A
145,100000,"Vendo Hermosa Casa en Cataluna, Km 12 Via Samborondon, 3 Dorm., 140 m²",-2.045018046862046,-79.88505201352541,689.6551724137931,B
198,195000,Hermosa Casa Via a La Costa,-2.1816441,-79.98535849999996,984.8484848484849,B
135,110000,Venta de Casa Urbanización Castilla Via Samborodón Km 13,-2.04241750943956,-79.8633185306885,814.8148148148148,B
227,180000,Alquilo o Vendo Casa en Ciudad Celeste 4 Dorm. - Samborondón,-2.071613787296468,-79.84206462327882,792.9515418502202,B
809,600000,Samborondon Casa de Una Planta 3 Dorm. con Baños,-2.111835362099802,-79.87121391500852,741.6563658838072,B
400,740000,Venta de Villa Impecable Via Samborondon,-2.119008399999999,-79.8689391,1850.0,A
195,149000,Se Vende de Oportunidad Casa en Ciudad Celeste Etapa La Estela,-2.0739766,-79.85118109999996,764.1025641025641,B
141,140000,Samborondon Oportunidad Casa en Venta Km 10.5,-2.059297785363572,-79.87595557667271,992.9078014184397,B
160,189000,Venta Villa por Estrenar Urbanización Las Cumbres,-34.850956,-55.0314238,1181.25,A
480,456000,Se Vende Casa en Construcción 243 m² - Aires del Batán. (Cód. 534),-2.271652498184291,-78.9993077470703,950.0,B
260,240000,Vendo Via Samborondon. Linda Casa. 4 Habitaciones. 2 Plantas. $240.000.,-2.092127924857719,-79.87316607929722,923.0769230769231,B
596,550000,Villa Disponible de Venta en Palmar del Río,-2.1231067,-79.87098370000001,922.8187919463087,B
500,490000,Casa en Venta Guayaquil Tennis Club.,-2.1956335,-79.91577940000002,980.0,B
405,430000,Proyecto de Casa en Mocoli,-2.098441053672283,-79.8641121287971,1061.7283950617284,A
252,220000,Puerto Azul Vendo Casa Los Ceibos,-2.192507315947491,-79.97148711491138,873.015873015873,B
350,340000,Casa de Venta en Samborondon,-2.1085513,-79.87191339999998,971.4285714285714,B
155,95000,Casa Rentera - Norte de Guayaquil!,-2.130931,-79.9380797,612.9032258064516,B
264,210000,Casa de Venta en Samborondón Urbanización Ciudad Celeste.,-2.072482153948914,-79.8424739847946,795.4545454545455,B
484,399000,Isla Mocoli/proyecto Casa de Una Planta,-2.098441053672283,-79.8641121287971,824.3801652892562,B
226,190000,Venta Casa 3 Dorm. Via a La Costa Urb Portal Al Sol,-2.181923547768206,-79.96916660703965,840.70796460177,B
1600,720000,"Casa en Venta, El Río, Vía Samborondón",-2.133914,-79.85978310000002,450.0,C
1100,980000,Casa Minimalista Moderna! Vista Al Lago Se Vende o Alquila! Km 6 Via Sambo!,-2.125602570021589,-79.8618348122925,890.9090909090909,B
127,112000,Casa Alborada Décima Etapa,-2.136060378366787,-79.91083196773684,881.8897637795276,B
533,700000,"Urb. San Isidro, Exclusiva Casa en Venta de 4 Dorm..",-2.0770664,-79.92848670000001,1313.3208255159475,A
1031,525000,Venta de Dos Villas Esquineras con Patio Compartido,-2.221875999999999,-79.8898816,509.21435499515036,B
550,490000,Vendo Via Samborondon. Linda Casa Estreno 3 Habitaciones Vista Al Lago $490.000,-2.108846371779121,-79.85970525938569,890.9090909090909,B
120,52000,Vendo Casa de 120 m de Construcción de Dos Plantas.,-2.0844835,-79.93097190000003,433.3333333333333,C
120,68000,Venta de Casa en Valle Alto Etapa New York,-2.203047178123889,-80.06144705952454,566.6666666666666,B
400,480000,Proyecto de Casa en Aires del Batan,-2.077222553677135,-79.87330814868773,1200.0,A
400,250000,Vendo Casa de en Urdesa. $250.000,-2.1746654,-79.90622380000002,625.0,B
460,530000,"Laguna del Sol, Acogedora y Elegante Casa de 5 Habitaciones",-2.082085910194585,-79.87252865239259,1152.1739130434783,A
250,385000,Vendo Moderna Casa de Estreno en Isla Mocoli,-2.097704777783352,-79.85870540559387,1540.0,A
290,190000,Puerto Azul Amplia Casa en Venta,-2.18930173896435,-79.96872980404407,655.1724137931035,B
600,490000,San Isidro/casa en Venta/samborondon,-2.119190665480558,-79.86818808147581,816.6666666666666,B
105,50000,Vendo Casa de 1 Planta en Orquideas,-2.09213052134563,-79.91548515741653,476.1904761904762,C
300,240000,Casa en Venta en Puerto Azul Vía a La Costa - Guayaquil,-2.186798382209649,-79.96605832380374,800.0,B
150,160000,Casa en Venta en Urbanización Napoli Sector Vía a Samborondón,-2.036794464697265,-79.86929655872189,1066.6666666666667,A
