metroscuadradostotales,precio,titulo,latitud,longitud,preciomt2
124,75000,Vendo Casa Sauces 1,-2.1410000324249268,-79.8949966430664,604.8387096774194
350,355000,Ceibos Norte Vendo Linda Casa Estreno,-2.18935489654541,-79.88920593261719,1014.2857142857143
101,57000,Venta de casa Villa Italia - Km. 17 Av. Leon Febres Cordero,-2.059000015258789,-79.927001953125,564.3564356435644
200,76000,Se vende Casa FLORIDA NORTE inf 0989778562,-2.1710000038146973,-79.9219970703125,380.0
84,80000,en Venta Hermosa Casa en Durán,-2.053363084793091,-79.89540100097656,952.3809523809524
50,260000,Excelente ubicacin a lado del Colegio Sagrados Corazones,-2.213566541671753,-79.89520263671875,5200.0
68,77000,"Venta Casa, Samanes 7, Norte Guayaquil - wasi_1524847",-2.1130847,-79.9094751,1132.3529411764705
640,350000,Ciudadela Simon Bolivar por Mall Del Sol,-2.152,-79.887,546.875
45,63000,"Venta de Casa, Ecojardin Etapa 2, Vía Pascuales - wasi_1528004",-2.0592587,-79.9074547,1400.0
28,9500,Casa en La Balerio Estacio Bloque 3,-2.116,-79.958,339.2857142857143
250,130000,"Casa de Venta en Miraflores, norte de guayaquil, cerca de la Victor Emilio Estrada",-2.1649999618530273,-79.9209976196289,520.0
81,85000,"Venta de casa rentera en sauces 3, Norte de Guayaquil.",-2.127000093460083,-79.88999938964844,1049.3827160493827
105,50000,CASA EN VENTA,-2.13100004196167,-79.93800354003906,476.1904761904762
255,180000,Casa en Venta en Salinas,-2.9441092014312744,-80.1714859008789,705.8823529411765
129,85000,VENTA CASA LINDA Y ACOGEDORA EN BARRIO DEL SEGURO/BM,-2.2179999351501465,-79.89600372314453,658.9147286821706
600,150000,Se vende propiedad Salinas de oportunidad,-2.129612922668457,-79.91914367675781,250.0
200,115000,"Se Vende Casa Rentera en Coop. 9 de Octubre, Sur de Guayaquil",-2.1549999713897705,-79.88999938964844,575.0
15,16000,Se Vende Casa,-2.115999937057495,-79.99800109863281,1066.6666666666667
360,190000,Venta Casa Lago de Capeira - 700 m2 - 3 habitaciones,-2.00600004196167,-79.96399688720703,527.7777777777778
100,95000,Victoria Club Mucho Lote 2,-2.1995575428009033,-79.90460968017578,950.0
480,295000,Vendo Casa Santa Cecilia con Estilo Español 1 Planta 4 Habit. Piscina,-2.1619999408721924,-79.94400024414062,614.5833333333334
105,53000,VILLA EN CDLA. ORQUÍDEAS,-2.0899999141693115,-79.91200256347656,504.76190476190476
148,170000,DEPARTAMENTO TERRANOSTRA LAS RAMBLAS,-2.187999963760376,-80.0,1148.6486486486488
220,103000,"Venta de Departamento de Oportunidad, en Lomas de Urdesa, Norte de Guayaquil",-2.1640000343322754,-79.90699768066406,468.1818181818182
179,85000,CASA EN VENTA- RENTERA,-2.196000099182129,-79.90499877929688,474.86033519553075
356,330000,"Casa en Venta, Urb. Isla del Río, Isla Mocoli, Guayaquil, Samborondón",-2.0989999771118164,-79.86399841308594,926.9662921348314
120000,98500,Vendo O Alquilo Casa en Sauces 6,-2.128,-79.898,0.8208333333333333
25,40000,Vendo Ksa,-2.1689999103546143,-79.9229965209961,1600.0
114,49000,Vendo casa esquinera de 3 dormitorios - E. Jivaja,-2.1600000858306885,-79.90799713134766,429.82456140350877
300,260000,"Venta de Casa  de Estreno, Urb. El Condado, Km 15 Vía La Aurora Samborondón",-2.0480000972747803,-79.90499877929688,866.6666666666666
270,90000,La Alborada 10maE mz502 V9,-2.1710000038146973,-79.9219970703125,333.3333333333333
190,68000,Vendo Casa en Mucho Lote,-2.13723087310791,-79.88680267333984,357.89473684210526
182,265000,Zona Comercial Norte de Guayaquil,-2.188999891281128,-79.88899993896484,1456.043956043956
97,35000,Vendo Casa de Dos Piso,-2.2347559928894043,-79.92420959472656,360.82474226804123
120,70000,"Venta de Casa en Guayacanes, cerca de la Laguna Artificial, Norte de Guayaquil.",-2.1670000553131104,-79.90699768066406,583.3333333333334
100,198700,VENTA DE DEPARTAMENTOS  EN BALEARIA  KM. 2.5 VÍA A SAMBORONDÓN,-2.134000062942505,-79.87200164794922,1987.0
108,95000,METROPOLIS 2 CASA EN VENTA,-2.1530001163482666,-79.90599822998047,879.6296296296297
35,17000,OPORTUNIDAD VENDO OFICINA EN GUAYAQUIL,-2.184999942779541,-79.88800048828125,485.7142857142857
90,90000,Venta de Casa,-2.178999900817871,-79.90499877929688,1000.0
520,265000,VENDO CONDOMINIO RENTERO AL SUR - J. MONCADA,-2.1600000858306885,-79.90799713134766,509.61538461538464
200,120000,Casas en venta San felipe con facilidad de pago,-2.134999990463257,-79.9260025024414,600.0
77,90000,Se Vende Casa en Cdla. Los Esteros,-2.247960329055786,-79.9001235961914,1168.8311688311687
128,115000,Se Vende Casa en La Joya,-2.140094518661499,-79.9028091430664,898.4375
70,33000,DEPARTAMENTO 2 HAB. EN LOS ESTEROS - OPORTUNIDAD - S. OROZCO,-2.1600000858306885,-79.90799713134766,471.42857142857144
11,85000,"de Oportunidad, Bonita Casa en Vent",-2.188999891281128,-79.88899993896484,7727.272727272727
300,210000,"Venta de Casa de Estreno, Urb. El Condado, Km. 14 Av León Febres Cordero, La Aurora - Puntilla",-2.075000047683716,-79.84400177001953,700.0
150,100000,"Venta de Departamento, Cdla. San Felipe, Conjunto San Antonio 1, Cerca Al Colegio Americano, Norte de Guayaquil",-2.13100004196167,-79.92900085449219,666.6666666666666
127,133000,"Venta de Departamento de Estreno, Cdla. La Garzota, 1ra. Etapa. Norte de Guayaquil",-2.1480000019073486,-79.8949966430664,1047.244094488189
102,50000,Venta Casa Flor de Bastión,-2.103,-79.956,490.19607843137254
220,80000,Vendo Villa Amoblada en Salinas,-2.1333067417144775,-79.90392303466797,363.6363636363636
120,117500,"Venta de Casa Precio de Oportunidad, Modelo Sophia, con Piscina, Urb. Napoli, Vía a Salitre, Samborondón, Guayaquil",-2.069999933242798,-79.93599700927734,979.1666666666666
152,160000,"Venta de Departamento de Estreno, en Tercer Piso, Urb. Bosques de Los Ceibos, Sector Politécnica; Norte de Guayaquil",-2.1530001163482666,-79.9530029296875,1052.6315789473683
105,136000,"Venta Departamento de Estreno, Urb. Bosques de Los Ceibos, Sector Politécnica, Norte de Guayaquil",-2.1530001163482666,-79.9530029296875,1295.2380952380952
320,220000,"Venta de Casa, Cdla. Alamos Norte, Guayaquil",-2.134000062942505,-79.91100311279297,687.5
600,450000,En Venta Casa en Urbanización Puerto Azúl - M. MARISCAL - A. JURADO,-2.191999912261963,-79.96700286865234,750.0
128,20000,CASA 2 PISOS PARA NEGOCIO EN MONTE LINDO (OFERTA),-2.11299991607666,-79.99600219726562,156.25
137,135000,Departamento Malecón Y Junín,-2.1855058670043945,-79.9995346069336,985.4014598540145
1200,650000,"Venta Casa Rentera Centro de Guayaquil, Cerca de Distribuidoras Farmacéuticas",-2.187000036239624,-79.88999938964844,541.6666666666666
127,78000,"Venta Casa, Urb La Joya, Etapa Turquesa, Cerca Plaza Tia, Samborondón, Guayaquil",-2.063999891281128,-79.90699768066406,614.1732283464567
484,700000,"Casa en Venta, Linda Casa de Estreno, Isla Mocoli, Urb. Isla del Río, Samborondón, Guayaquil",-2.0989999771118164,-79.86399841308594,1446.280991735537
165,100000,"Venta Casa de 1 Planta en Alborada 11ava Etapa, Cerca Albocentro, Norte de Guayaquil",-2.13100004196167,-79.89900207519531,606.060606060606
36,1111111,Alquilo Un Cuarto en Socio Vivienda 1,-2.1316750049591064,-79.9554672241211,30864.194444444445
130,123000,"Casa de Venta Precio de Oportunidad Urb. Napoli, Modelo Danielle, con Jacuzzi, Vía a Salitre, Samborondón, Guayaquil",-2.069000005722046,-79.93599700927734,946.1538461538462
120,49990,Venta de Casa 3 Pisos,-2.216,-79.937,416.5833333333333
485,580000,"Venta Casa de Estreno, Urb. Isla Mocoli, Urb. Arrecife, Samborondón, Guayaquil",-2.11299991607666,-79.85700225830078,1195.8762886597938
190,135000,"Venta Casa Esquinera, Samanes 7, con Tres Frentes, Av Francisco de Orellana, Norte de Guayaquil",-2.11299991607666,-79.90899658203125,710.5263157894736
100,8,Suite de 24 Torre San Martín Tercer Piso,-2.1559998989105225,-79.9219970703125,0.08
240,50000,REMATO CASA EN LOS VERGELES!!,-2.0869998931884766,-79.90599822998047,208.33333333333334
5315,35500,Vendo casa en Villamil Playas,-2.1710000038146973,-79.9219970703125,6.679209783631232
103,97000,DEPARTAMENTO PLANTA BAJA EN VENTA KENNEDY NORTE,-2.1570000648498535,-79.9010009765625,941.747572815534
422,330000,"Venta de Casa Rentera, Sector Comercial, Guayaquil Calle Los Ríos entre Ayacucho y Huancavilca",-2.196000099182129,-79.89700317382812,781.9905213270142
129,140000,en Venta Casa Vía a La Costa Oportunidad,-2.180999994277954,-79.98699951171875,1085.2713178294573
321,190000,Casa en Venta Urdesa Norte Rentera,-2.1579999923706055,-79.90499877929688,591.9003115264798
900,350000,"Venta de Casa Duplex en Santa Cecilia, Cerca del McDonald's, Ceibos, Norte de Guayaquil",-2.1619999408721924,-79.94400024414062,388.8888888888889
150,125000,Casa en Venta Bellavista,-2.158857822418213,-79.90440368652344,833.3333333333334
280,225000,Casa Rentera en Venta Urbanización Fae,-2.1579999923706055,-79.90499877929688,803.5714285714286
105,40000,CASA DE OPORTUNIDAD,-2.2179999351501465,-79.90799713134766,380.95238095238096
195,173000,DE ESTRENO!!! HERMOSO Y AMPIO DEPAR/CEIBOS POINT/AV. EL BOMBERO,-2.184000015258789,-79.94499969482422,887.1794871794872
70,210000,Venta Departamento piso 10 River Towers,-2.115000009536743,-79.87300109863281,3000.0
284,175000,Hermoso Departamento en Venta Puerto Azu,-2.1720187664031982,-79.90805053710938,616.1971830985915
120,72000,Casa en Venta Villa Club Etapa Luna,-2.0492348670959473,-79.89029693603516,600.0
320,190000,Casa Rentera en Venta Alborada,-2.1050000190734863,-79.93499755859375,593.75
180,175000,Vendo Linda Casa en Ciudad Celeste,-2.1695709228515625,-79.89859771728516,972.2222222222222
850,450000,"Casa Esquinera de Venta en Urb. Puerto Azul, Vía a la Costa, Guayaquil",-2.187000036239624,-79.98100280761719,529.4117647058823
60,90000,HERMOSA CASA EN VENTA,-2.191999912261963,-79.90499877929688,1500.0
450,250000,"VENTA CASA RENTERA, SECTOR HOSP. ROBERTO GILBERT - M. VACA",-2.174999952316284,-79.88400268554688,555.5555555555555
213,165000,En Venta Casa en Urb. Belohorizonte - A. AGURTO,-2.187999963760376,-79.98100280761719,774.6478873239437
815,40000,Se Vende Una Casa,-2.1219033,-79.9596991,49.079754601226995
150,150000,"Venta,Vendo Departamento 2do Piso, sin Ascensor,3dor, 150m2,Los Senderos-Ceibos, Norte de Guayaquil",-2.1679999828338623,-79.93399810791016,1000.0
367,550000,"Venta de Casa en Entre Lagos, Samborondon",-2.180000066757202,-79.90799713134766,1498.6376021798364
92,99000,Vendo Moderna casa en la perla,-2.187000036239624,-79.98100280761719,1076.0869565217392
650,650000,Venta de Hermosa Casa en Isla Mocolí,-2.1579999923706055,-79.90499877929688,1000.0
105,70000,"CASA RENTERA EN VENTA, CDLA. LAS ORQUIDEAS",-2.1549999713897705,-79.88999938964844,666.6666666666666
125,27000,Se Vende Una Casa en Horizonte Del Forti,-2.121000051498413,-79.95800018310547,216.0
80,40000,# DEPARTAMENTO EN  ACACIAS/ departamento/ CONTADO/ SUR,-2.1710000038146973,-79.9219970703125,500.0
82,55000,Venta de Casa en Sauces 5,-2.122999906539917,-79.89199829101562,670.7317073170732
140,75000,# SE VENDE casa cdla EL ASTILLERO /NAVAL SUR/ CENTENARIO,-2.1710000038146973,-79.9219970703125,535.7142857142857
250,135000,Estudio Juridico O Departamento de 250m,-2.193,-79.881,540.0
181,180000,Casa de Venta Urbanización San Eduardo,-2.1535072326660156,-79.8310546875,994.4751381215469
360,180000,Vendo Casa Rentera Brasil sur oeste Guayaquil,-2.209327220916748,-79.89936065673828,500.0
108,62500,DE OPORTUNIDAD VENTA DE HERMOSA CASA DE 1 PLANTA EN METROPOLIS 2,-2.0969998836517334,-79.89199829101562,578.7037037037037
150,185000,Se Vende Casa  Terreno en Guayaquil,-2.189,-79.889,1233.3333333333333
138,70000,Venta de Casa de Dos Plata en Vergeles,-2.250999927520752,-79.87899780273438,507.2463768115942
15,12000,Vendo Casa de 8 X 8,-2.128000020980835,-79.99800109863281,800.0
72,45000,Vendo Casa en Mucho Lote Negociable,-2.082,-79.921,625.0
200,85000,Se Vende Casa Rentera INTERESADOS LLAMAR 0992171327,-2.2244455814361572,-79.90287017822266,425.0
45,3500,Almuerzos para personas con Diabetes,-2.191999912261963,-79.89700317382812,77.77777777777777
320,130000,Casa Rentera 4 Pisos 5 Depart. Terraza,-2.127000093460083,-79.89199829101562,406.25
84,85000,Venta de Casa en Mucho Lote 1 Etapa 4,-2.2606616020202637,-79.88831329345703,1011.9047619047619
60,90000,HERMOSA CASA EN VENTA,-2.0889999866485596,-80.00800323486328,1500.0
350,198000,CASA EN VENTA CIUDADELA MIRADOR DEL NORTE,-2.1600000858306885,-79.88600158691406,565.7142857142857
96,45000,"SUR DE LA CIUDAD DE GUAYAQUIL, ELOY ALFARO Y SAN MARTÍN, VENDO DEPARTAMENTO 2 HABITACIONES",-2.194000005722046,-79.91300201416016,468.75
110,115000,"CEIBOS, SANTA CECILIA, CONDOMINIO TERRA 3, VENDO DEPARTAMENTO PLANTA BAJA",-2.1670000553131104,-79.94499969482422,1045.4545454545455
120,62000,Vendo Villa Bonita Vía a Daule,-2.188999891281128,-79.96499633789062,516.6666666666666
226,197000,"VIA A LA COSTA, PORTAL AL SOL, VENDO CASA ESQUINERA, 3 HABITACIONES",-2.181999921798706,-79.99500274658203,871.6814159292036
370,165000,casa en venta,-2.1549999713897705,-79.88899993896484,445.94594594594594
73,82000,VENTA SUITE AMPLIA CERCA DEL HILTON COLON CON EXCELENTE VISTA /  CV,-2.1570000648498535,-79.9010009765625,1123.2876712328766
95,50000,Casa en Venta Al Sur,-2.2109999656677246,-79.91000366210938,526.3157894736842
525,180000,Se Vende Casa,-2.188999891281128,-79.88899993896484,342.85714285714283
160,100000,"Casa de Venta en Urb. Valle Alto, Vía a la Costa, Guayaquil",-2.2039999961853027,-80.05999755859375,625.0
510,160000,"En Venta Casa Rentera en Cdla. Santa Monica, Norte de Guayaquil",-2.25,-79.89600372314453,313.72549019607845
2000,950000,"Casa de Venta en La Puntilla, Samborondon",-2.1549999713897705,-79.86599731445312,475.0
82,43000,Vendo Ksa en Sauces 3,-2.250999927520752,-79.88500213623047,524.390243902439
170,290000,"Venta de Casa en Entre Rios frente al Riocentro, Samborondon km 1,5",-2.180000066757202,-79.90799713134766,1705.8823529411766
1080,390000,"Venta de Casa en Urdesa Central, ideal para múltiples negocios con Uso de Suelo Comercial.",-2.1689999103546143,-79.90699768066406,361.1111111111111
160,55000,Vendo Casa,-2.123,-79.922,343.75
127,112000,"Casa de Venta en Alborada decima etapa, Cerca de City mall, La rotonda, Antonio Lescano",-2.134000062942505,-79.90899658203125,881.8897637795276
230,218000,DE VENTA CASA DE ESTRENO EN CIUDAD CELESTE - A. MARIN,-2.1659998893737793,-79.9010009765625,947.8260869565217
140,50000,Se Vende Casa Sur Acepta Biess,-2.2748351097106934,-79.88623809814453,357.14285714285717
99,123000,DEPARTAMENTO PLANTA BAJA EN PUERTO AZUL,-2.1710000038146973,-79.9219970703125,1242.4242424242425
822,1111,CASA DE 4 PISOS,-2.257999897003174,-79.87999725341797,1.3515815085158152
110,68000,Se vende casa de dos dormitorios en Villa Italia modelo Marianella,-2.059000015258789,-79.927001953125,618.1818181818181
822,111,Casa de 4 Pisos,-2.1389999389648438,-79.96900177001953,0.13503649635036497
99,77500,Casa de 2 Plantas Urb. Paraiso Del Rio 1,-2.136821746826172,-79.89028835676599,782.8282828282828
250,225000,Venta de Casa Santa Maria Casa Grande,-2.180000066757202,-79.90799713134766,900.0
217,95000,Vendo Casa Rentera en La Florida Norte,-2.125,-79.94,437.78801843317973
579,358000,Venta de Casa Elegante en Santa Maria Casa Grande,-2.180000066757202,-79.90799713134766,618.3074265975821
120,60000,Casa en venta en sauces 5 numero cel 0993746997 con Cira Proao,-2.125,-79.89399719238281,500.0
121,120000,Casa Nueva por Estrenar Urb Girasol,-2.1534957885742188,-79.83106994628906,991.7355371900826
85,72000,Casa Mucho Lote 1 Casa Y Locales,-2.062000036239624,-79.89900207519531,847.0588235294117
120,48000,Venta de Casa Al Norte de Guayaquil,-2.6378185749053955,-80.37570190429688,400.0
213,170000,Vende Casa en Urdesa,-2.128999948501587,-79.94400024414062,798.1220657276996
210,90000,Centenario sur,-2.160262107849121,-79.89863586425781,428.57142857142856
193,90000,Vendo Casa en Cdla El Paraiso Norte de Guayaquil,-2.1689999103546143,-79.9229965209961,466.32124352331607
500,320000,Vendo / Casa Rentera / Kennedy Norte / Guayaquil /ZONAS POLICENTRO / PLAZA QUIL / SAN MARINO,-2.177000045776367,-79.89600372314453,640.0
414,420000,"ESPECTACULAR CASA EN SANTA CECILIA CEIBOS 4 PISOS, 5 DORMIROTIOS, 9 BAÑOS",-2.1610000133514404,-79.94200134277344,1014.4927536231884
59,135000,Venta Suite Edif. Samborondón Plaza,-2.0869998931884766,-79.93000030517578,2288.135593220339
82,100000,Vendo Casa en Villa Club,-2.188999891281128,-79.88899993896484,1219.5121951219512
140,80000,Venta de Casa Guasmo Sur,-2.0402612686157227,-79.91578674316406,571.4285714285714
279,220000,Casa Nautilyus Salinas,-2.2079999446868896,-79.88600158691406,788.5304659498208
72,32000,Se Vende Casa en El Recreo 1 Etapa,-2.188999891281128,-79.88899993896484,444.44444444444446
278,80000,Vendo Esta Casa,-2.207,-79.927,287.76978417266184
72,58000,CASA EN VENTA EN MUCHO LOTE 1 AL NORTE DE GYE - F. RODRIGUEZ,-2.0820000171661377,-79.9209976196289,805.5555555555555
170,65000,DEPARTAMENTO EN VENTA EN  SAUCES 9 - PLANTA BAJA  - F. RODRIGUEZ,-2.131999969482422,-79.89299774169922,382.3529411764706
120,16000,Venta Casa,-2.128999948501587,-79.9489974975586,133.33333333333334
190,108000,FABULOSA CASA EN VALLE ALTO - etapa New York,-2.2039999961853027,-80.05999755859375,568.421052631579
84,55000,Venta Casa Prosperina,-2.1459999084472656,-79.95999908447266,654.7619047619048
1315,570000,"Casa de Venta en Cdla. Los Almendros, Guayaquil",-2.2300000190734863,-79.89299774169922,433.4600760456274
90,40000,VENDO VILLA,-2.2339999675750732,-79.86399841308594,444.44444444444446
98,85000,"Casa de Venta en Urb. la Perla, Norte de Guayaquil",-2.058000087738037,-79.90899658203125,867.3469387755102
78,35000,VILLA VENDO 35.000,-2.1117942333221436,-79.90845489501953,448.71794871794873
72,56000,Departamento de Venta en el centro de Guayaquil,-2.186000108718872,-79.87899780273438,777.7777777777778
204,125000,"Venta de Casa Rentera, Coop. Estrella de Belén, Norte de Guayaquil",-2.122999906539917,-79.91500091552734,612.7450980392157
221,138000,Venta de Casa Esquinera en Cdla. Paraiso,-2.18935489654541,-79.88920593261719,624.4343891402715
162,153000,Se vende departamento en Kennedy Guayquil,-2.1710000038146973,-79.89900207519531,944.4444444444445
250,195000,Ceibos Norte Oportunidad Vendo Casa,-2.1710000038146973,-79.89800262451172,780.0
320,240000,"# CENTENARIO SUR CON PISCINA, 140 mil de contado 100.000 a crédito 0982712236",-2.1710000038146973,-79.9219970703125,750.0
202,200000,Casa de Venta Urbanizacion San Eduardo 2,-2.1534993648529053,-79.83104705810547,990.0990099009902
140,255000,"Departamento en Venta en Urb. Balearia, Via a Samborondon, Ma. Leonor Villegas",-2.134999990463257,-79.87200164794922,1821.4285714285713
25,70000,Vendo 3 Casas Juntas,-2.061563491821289,-79.91578674316406,2800.0
60,90000,"Suite en Venta con excelente ubicación, buen precio,Norte de Guayaquil. Cerca a City Mall Ma. Leonor Villegas",-2.1440000534057617,-79.91000366210938,1500.0
74,39000,Venta de Casa Cdla.beata Mercedes Molina,-2.056255340576172,-79.9575424194336,527.027027027027
160,112000,"Casa en Venta en Alborada, Norte de Guayaquil ,Digna Salcedo",-2.131999969482422,-79.89900207519531,700.0
132,55000,Casa de venta en ciudadela Los Esteros,-2.1710000038146973,-79.9219970703125,416.6666666666667
112,115000,"SE VENDE CASA EN LA GARZOTA II, Norte de Guayaquil - Digna Salcedo",-2.1449999809265137,-79.88999938964844,1026.7857142857142
105,55000,Venta de Casa con dos departamentos independientes,-2.0850000381469727,-79.91699981689453,523.8095238095239
197,135000,Departamento de Lujo - Lomas de Urdesa,-2.1654531955718994,-79.90409851074219,685.2791878172588
46847,25000,Se Vende Esta Casa,-2.0889999866485596,-79.94999694824219,0.5336521015219758
120,158000,Departamento de estreno piso tres con ascensor Pto. Azul,-2.191999912261963,-79.96700286865234,1316.6666666666667
260,160000,"Venta de Departamento en Lomas de Urdesa, cerca del Colegio Delfus, Norte de Guayaquil",-2.1659998893737793,-79.90399932861328,615.3846153846154
418,340000,"Venta de Penthouse en Torre Olivos, cerca del Supermaxi, Ceibos.",-2.1670000553131104,-79.94400024414062,813.3971291866029
353,355000,Casa con piscina en Los Ceibos,-2.1670000553131104,-79.94499969482422,1005.6657223796034
314,250000,Se Vende Casa en El Centro de La Ciudad,-2.1887269020080566,-79.89276885986328,796.1783439490446
240,60000,SE VENDE CASA EN BASTIÓN  DE OPORTUNIDAD,-2.124000072479248,-79.93599700927734,250.0
72,110000,Casa Rentera en Venta,-2.131999969482422,-79.89299774169922,1527.7777777777778
365,260000,"Venta de Casa en Via a Samborondón,, Guadalupe Bejarano",-2.1489999294281006,-79.89600372314453,712.3287671232877
72,55000,Vendo Casa Mucho Lote 1 Avenida Principal por la sanja cerca al tía,-2.1582419872283936,-79.88990783691406,763.8888888888889
240,154000,Vendo Casa en Villa Club Etapa Magna,-2.1480000019073486,-79.90299987792969,641.6666666666666
144,60000,CASA EN MUCHO LOTE. ETAPA 2.,-2.0820000171661377,-79.9209976196289,416.6666666666667
9,80000,Venta Casa Rentera,-2.259999990463257,-79.88899993896484,8888.888888888889
200,82000,Vendo Casa,-2.1710000038146973,-79.9219970703125,410.0
200,190000,Casa Rentera en Cdla Acuarelas Del Rio,-2.2078659534454346,-79.91204833984375,950.0
200,40000,Vendo Casa,-2.157710075378418,-79.83895874023438,200.0
150,125000,"Departamento en Venta en la Cumbres de Los Ceibos, 3 Hab, 3 Bañ, 2 Parqueos.",-2.1559998989105225,-79.94499969482422,833.3333333333334
50,30000,Hermoso Depto en Manta Condiminio,-2.1519999504089355,-79.88700103759766,600.0
46,12000,Se Vende Una Villa de Oportunidad,-2.186000108718872,-79.9000015258789,260.8695652173913
98,60000,SE VENDE CASA DE 2 PISOS,-2.0889999866485596,-80.00800323486328,612.2448979591836
98,65000,Kennedy Nueva Vendo Departamento,-2.188999891281128,-79.88899993896484,663.265306122449
105,48000,SE VENDE CASA ROSALES 2,-2.118000030517578,-79.90799713134766,457.14285714285717
119,58000,San Pablo Salinas Vendo Casa 3 Habitacio,-2.1710000038146973,-79.89800262451172,487.39495798319325
200,90000,Venta casa una planta Esteros,-2.24399995803833,-79.90699768066406,450.0
114,87000,Venta de Casa,-2.1709980964660645,-79.92235565185547,763.1578947368421
387,270000,Casa de venta en Vía a la Costa - Urb. Belo Horizonte – código:13136,-2.161486,-79.917257,697.6744186046511
150,108500,Departamento de venta en Salinas (D-302) – código:12065,-2.161486,-79.917257,723.3333333333334
134,98000,Casa de venta en Cataluña – código:12620,-2.161486,-79.917257,731.3432835820895
1178,1200000,Casa de venta en Kennedy Norte – código:14447,-2.161486,-79.917257,1018.6757215619695
120,80000,Casa en Venta,-2.066999912261963,-79.91300201416016,666.6666666666666
150,300000,Departamento de venta en Ciudad del Río  - Riverfront – código:11600,-2.161486,-79.917257,2000.0
160,185000,Proyecto Villa Casa de venta en Ceibos - Cumbres – código:11857,-2.161486,-79.917257,1156.25
126,29000,Vendo Casa con Terreno en Vergeles,-2.0993967056274414,-79.90345001220703,230.15873015873015
4,35000000,de Venta Una Casa de Do Plantas,-2.188,-79.893,8750000.0
130,36000,Casa Floresta 2,-2.1710000038146973,-79.9219970703125,276.9230769230769
427,170000,En Venta Casa Rentera excelente ubicación,-2.2079999446868896,-79.90299987792969,398.1264637002342
120,93000,Venta Villa 3 Dorm Plaza Madeira,-2.1349759101867676,-79.90890502929688,775.0
300,185000,de Oportunidad Casa Rentera Sauces 7,-2.1563069820404053,-79.90845489501953,616.6666666666666
360,160000,Venta de Casa en Urbanización La Saiba,-2.188999891281128,-79.88899993896484,444.44444444444446
166,14500,¡De oferta! terreno grande con pequeña casita en Bastión Popular Bloque 11,-2.0820000171661377,-79.93299865722656,87.34939759036145
150,69500,Vivienda familiar de una planta en urbanización Valle Alto,-2.2039999961853027,-80.05999755859375,463.3333333333333
182,80000,"Venta de Casa, Las Peñas (zona Turístic)",-2.188999891281128,-79.88899993896484,439.56043956043953
196,80000,Se Vende Casa Rentera de 3 Pisos,-2.244999885559082,-79.88700103759766,408.16326530612247
314,80000,Se Vende Casa 3 Pisos Garage Y Terraza,-2.244999885559082,-79.88500213623047,254.77707006369425
135,75000,Se Vende Casa de 2 Plantas en La Prosper,-2.086925506591797,-79.96734619140625,555.5555555555555
60,28000,Se Construye Casa Dentro Y Fuere de La C,-2.180000066757202,-79.88099670410156,466.6666666666667
1,56000,Casa en Mucho Lote 1,-2.134000062942505,-79.89600372314453,56000.0
114,64000,Se Vende Casa Guayaquil Urb. Privada,-2.068,-79.895,561.4035087719299
640,75000,Casa en Venta,-2.1449999809265137,-79.90799713134766,117.1875
36,9000,Casa en Venta,-2.2250618934631348,-79.94490814208984,250.0
118,110000,OPORTUNIDAD. DEPARTAMENTO EN VENTA – SANTA CECILIA – CEIBOS. 2 HABITACIONES,-2.1619999408721924,-79.94400024414062,932.2033898305085
112,77000,"Venta de Casa en Urb. La Joya, cantón Daule, Acabados modernos, cerca de Villaclub y Plaza Madeira",-2.21217942237854,-79.92418670654297,687.5
240,150000,Venta en Urbanización Villa Club,-2.1570000648498535,-79.9020004272461,625.0
128,115000,"VENTA DEPARTAMENTO. CEIBOS, SANTA CECILIA, 3 HABITACIONES",-2.1619999408721924,-79.94400024414062,898.4375
930,168000,Vendo Terreno Comercial en Vergeles,-2.0889999866485596,-79.9010009765625,180.6451612903226
126,29000,Vendo Casa con Terreno en Los Vergeles,-2.094578504562378,-79.921142578125,230.15873015873015
165,215000,Vendo Departamento,-2.0999584197998047,-79.87923321255444,1303.030303030303
120,90000,Venta de Casa Rentera para 3 Familias,-2.1306939125061035,-79.89573669433594,750.0
150,60000,Vender Casa Local Comercial,-2.209,-79.893,400.0
105,26000,Vendo Casa,-2.194999933242798,-79.89099884033203,247.61904761904762
140,95000,Vendo Casa Rentera Sauces 9,-2.18935489654541,-79.88920593261719,678.5714285714286
91,64000,"Venta Casa Urb. Villa Bonita, Mi Lote - wasi_1524917",-2.0576892,-79.9876714,703.2967032967033
75,60000,OPORTUNIDAD venta de departamento Kennedy,-2.177000045776367,-79.89900207519531,800.0
