metroscuadradostotales,precio,titulo,latitud,longitud,preciomt2,categoria
480,565000,Arrecife - Punta Mocoli Design By Jannina Cabal,-2.115345389952465,-79.85616255437014,1177.0833333333333,A
400,370000,Vendo Casa Moderna de Estreno en Isla Mocoli,-2.102442901125957,-79.8670732875496,925.0,B
244,140000,Venta de Casa Cdla. del Biess Remodelada - Sector Sur de Guayaquil,-2.230328339537673,-79.90216345507815,573.7704918032787,B
1,259000,Se Vende Proyecto en Isla Celeste Reserva Solo con 10.000!,-2.071613787296468,-79.84206462327882,259000.0,A
245,245000,Isla Celeste 243 m² Const y 225 m² Terreno Hermoso Diseño Venta Directa,-2.07941565850068,-79.83799314794919,1000.0,B
1090,650000,"Casa 1 Planta Al Lago - 4 D - $650,000",-2.142225517676877,-79.86459564013671,596.3302752293578,B
580,425000,"Samborondon Km 4 - Urb San Isidro - Casa 3 Dorm. - Us$425,000",-2.1190084,-79.86893909999998,732.7586206896551,B
505,450000,Vendo Casa Moderna de Estreno Isla Mocoli Al Lago,-2.100170754475629,-79.86166656434631,891.0891089108911,B
240,280000,Vendo Casa Portón de Lomas Urdesa (Costabienes),-2.1590432,-79.90947510000001,1166.6666666666667,A
170,175000,"Venta de Casa, Vía a Samborondon Km 1 Planta Baja",-2.1447394,-79.8644152,1029.4117647058824,A
319,367000,Casa en Venta en Estancias del Rio,-2.0625285,-79.8773438,1150.4702194357367,A
593,682000,"Casa en Proyecto - con Vista Al Lago - Us$682,000",-2.075796462183973,-79.87261044340823,1150.0843170320404,A
186,215000,Hermosa Casa en Venta Urb. Arcadia - 3 Dorm. 215.000$,-2.1858452,-80.00230959999999,1155.9139784946237,A
570,495000,Isla Mocoli - 4 Dorm. - Jardines Interiores - Piscina,-2.102442901125957,-79.8670732875496,868.421052631579,B
189,225000,"Casa en Venta - Km 14 - 3d - $225,000",-2.189967667128228,-80.00195052012941,1190.4761904761904,A
480,395000,Isla Mocoli - 4 Dorm.,-2.103258580671302,-79.85977828919982,822.9166666666666,B
461,490000,"Proyecto Nuevo - Casa de 4 Dorm. - Us$490,000",-2.111447708039338,-79.85661246826169,1062.9067245119306,A
83,79990,"Vendo Casa de Estreno Urbanizacion Villa Italia, Excelente Ubicacion!",-2.059290948246912,-79.92583201531374,963.7349397590361,B
405,454000,"Urb Pacifica - Isla Mocoli - Casa en Proyecto - Us$454,000",-2.1043031,-79.86048310000001,1120.9876543209878,A
410,440000,Isla Mocoli Urb. Pacifica - 4 Dorm.,-2.104158358380436,-79.86055015522538,1073.1707317073171,A
600,320000,Casa en Venta. Una Sola Planta 275.72 m² de Construcción. Ceibos Calle 2da,-2.168558934023446,-79.9392657095093,533.3333333333334,B
767,500000,Casa - Samborondón,-2.0868532,-79.8709837,651.8904823989569,B
250,238000,Vendo Casa Ciudad Celeste Moderna por Estrenar,-2.07179360121206,-79.84207850322787,952.0,B
400,350000,Isla Mocoli Vendo Hermosa Casa Moderna de Estreno,-2.104158358380436,-79.86055015522538,875.0,B
180,155000,Casa en Venta Via a La Costa Km 22 Urb Costa Real 4 Dorm.,-2.201378,-80.06030279999999,861.1111111111111,B
550,380000,Casa en Venta - 4d - Santa Cecilia - $380.000,-2.162087802779203,-79.94190992366487,690.9090909090909,B
160,150000,Vendo Casa Colinas de Los Ceibos,-2.164387438323206,-79.94552559341605,937.5,B
2000,950000,Urb Camino Real Casa Tipo Mansión Km 2 Vía a Samborondon,-2.136867613756863,-79.86364074035646,475.0,C
400,480000,Linda Casa en Venta o Alquiler - 3 Dorm.,-2.03748177272571,-79.83215510345951,1200.0,A
105,46000,"Vendo Casa 2 Plantas en Huancavilca Norte, Cerca Al Parque Samanes, Av Orellana",-2.098124120001116,-79.90698734442748,438.0952380952381,C
103,88000,Casa en Venta Sauces 4 Dos Plantas,-2.124824363404159,-79.88814589913613,854.3689320388349,B
593,682000,Casa en Venta en Aires de Batan Al Lago Venta Directa Sin Intermediarios,-2.0772653,-79.87343659999999,1150.0843170320404,A
120,85000,Vendo Casa de 2 Plantas en Milan Esquinera,-2.0380771,-79.8701254,708.3333333333334,B
96,62707,Hermosas Casa en Villa Bonita a Estrenar,-2.062492611981854,-79.97456076233522,653.1979166666666,B
230,200000,Se Vende Una Casa y un Departamento Via a La Costa,-2.184807509446279,-80.00872382559129,869.5652173913044,B
175,182000,Casa en Venta en Exclusiva Urbanización Bali/ Samborondón/ Daule,-2.0516322,-79.90243290000001,1040.0,A
104,135000,Casa Rentera con Cinco Departamentos en Huancavilca Sur - Guayaquil - F. Rodríguez,-2.2349311,-79.90027129999999,1298.076923076923,A
400,370000,Vendo Casa de Estreno Moderna en Isla Mocoli,-2.103258580671302,-79.85977828919982,925.0,B
546,565000,"Proyecto Nuevo - Casa de 4 Dorm. - Vista Al Lago - Us$565,000",-2.1133347,-79.85558249999997,1034.7985347985348,A
203,275000,"Casa 3 Dorm. + Sala de Estar - Us$275,000",-2.135514132373163,-79.86448066357423,1354.679802955665,A
200,185000,Punta Esmeralda - Casa en Venta 3d - $,-2.183342031905175,-79.99406450052493,925.0,B
400,350000,Vendo Casa de Estreno Moderna en Isla Mocoli,-2.1043031,-79.86048310000001,875.0,B
1460,575000,Espectacular Mansión en Urbanización Aquamarina de Samborondón ¡Al Pie del Lago!,-2.1520745,-79.8625834,393.83561643835617,C
144,99000,"Casa en Venta en Villa Club, Esquinera $99.000",-2.0342721,-79.89789830000001,687.5,B
540,615000,Isla Mocoli Vendo Moderna Casa de Estreno Al Lago,-2.102442901125957,-79.8670732875496,1138.888888888889,A
400,385000,"Urb Laguna del Sol - Casa 3 Dorm. - Us$385,000",-2.082085910194585,-79.87252865239259,962.5,B
470,280000,"Hermosa Casa en Venta 4 Dorm, Piscina. Urb. Colinas de Los Ceibos - 280.000$",-2.159284019538617,-79.94815607409669,595.7446808510638,B
251,290000,"Casa en Venta - Km 7 - 3d - Us$290,000",-2.187145471490973,-79.97014873815459,1155.3784860557769,A
740,650000,Samborondon La Puntilla Vendo Casa con Dos Departamentos Independientes,-2.15640153911104,-79.86508279311522,878.3783783783783,B
540,850000,"Casa X Estrenar - Al Lago - de Lujo - Us$850,000",-2.0773404,-79.86969220000003,1574.0740740740741,A
530,540000,Vendo Hermosa Casa de Estreno en Aires de Batan,-2.112365509828726,-79.87111150759887,1018.8679245283018,A
400,325000,Isla Mocoli Vendo Casa Moderna de Estreno,-2.096197548642436,-79.8606440325409,812.5,B
290,295000,"Casa en Venta en Ciudad Celeste, Vía Samborondón",-2.0694324,-79.8416923,1017.2413793103449,A
122,69000,Villa del Rey Palacio 5 Nueva Venta Directa $69.000,-2.0248305,-79.91677709999999,565.5737704918033,B
72,59900,Casa en Villa España de Dos Plantas a Estrenar Norte de Gye - F. Rodríguez,-2.084494319434373,-79.92135690845947,831.9444444444445,B
268,188500,Vendo Casa Via a La Costa,-2.1896713,-80.00842519999998,703.3582089552239,B
90,58000,Casa en Venta en Mucho Lote 1 Al Norte de Gye - F. Rodríguez,-2.094771439533467,-79.91429647138062,644.4444444444445,B
406,454000,Pacifica (Mocoli) a Estrenar Moderna Casa,-2.1043031,-79.86048310000001,1118.2266009852217,A
127,80000,Vendo Hermosa Casa en Bonaterra de Oportunidad,-2.0393128,-79.8654999,629.9212598425197,B
337,329000,"Linda Casa, Km 5 Sobre La Vía a Samborondon",-2.1170338,-79.87147010000001,976.2611275964392,B
453,425000,"Hermosa Casa en Laguna del Sol, Via a Samborondon",-2.080773805194784,-79.87264689580081,938.1898454746137,B
423,689000,Casa - Samborondón,-2.1709979,-79.9223592,1628.8416075650118,A
120,52000,Pradera 1 - Villa 4 Dorm. 4 Baños,-2.238747412959437,-79.89123975033186,433.3333333333333,C
502,349000,"Casa 3 Dormit + Estudio + Sala Musica - Us$349,000",-2.114834,-79.8681618,695.2191235059761,B
420,380000,"Casa Proyecto en Venta, Isla Mocoli, Samborondón Ciudadela Isla del Rio",-2.0994643,-79.86449670000002,904.7619047619048,B
250,135000,Casa de Venta en Bellavista,-2.185783730340475,-79.91440317529418,540.0,B
101,55000,De Oportunidad Casa en Venta en Sauces,-2.125083855262901,-79.89743211586915,544.5544554455446,B
243,245000,Casa Isla Celeste Etapa Estribor,-2.189412799999999,-79.8890662,1008.2304526748972,A
56,41900,Vendo Casa de Dos Plantas con Estacionamiento en Ciudad Santiago - Guayaquil - F. Rodríguez,-2.024561619524212,-79.94286473596799,748.2142857142857,B
456,268900,Venta de Casa en La Urb. Los Senderos - Mae. Recalde,-2.1675008,-79.93569439999999,589.6929824561404,B
138,130000,Amplia Casa en Sauces 9,-2.130761314839407,-79.8938744830117,942.0289855072464,B
523,370000,Los Parques Casa en Venta,-2.1731919,-79.9437532,707.4569789674953,B
225,190000,"Vendo Excelente Villa en Ciudad Celeste, Via Samborondón.",-2.1070207,-79.87232990000001,844.4444444444445,B
316,340000,Casa - Samborondón,-2.107305499999999,-79.872252,1075.9493670886077,A
120,59990,En Venta Casa en Ciudadela Las Orquídeas - K. Salamea,-2.0860551,-79.91385889999998,499.9166666666667,C
1088,860000,"Hermosa Casa en Urb Exclusiva, Via Samborondon",-2.102442901125957,-79.8670732875496,790.4411764705883,B
120,87718,Casa de Venta por Estrenar en La Urbanización l'Ogare,-2.0169076,-79.866398,730.9833333333333,B
263,239500,"Casa Bifamiliar de 263 m² en Puerto Azul, Via a La Costa. Parque, Acabados Lujo",-2.187841308004728,-79.96819902660462,910.6463878326996,B
132,137000,Casa Hermosa en Villa Club.,-2.0342721,-79.89789830000001,1037.878787878788,A
120,102459,"Venta de Casa Laguna en León Febres Cordero, Cerca del C. C Riocentro El Dorado.",-2.0412082,-79.88794589999998,853.825,B
112,112000,"Casa en Venta en Urb. La Joya Etapa Oro, Nueva Etapa",-2.028697862200196,-79.92173041645509,1000.0,B
324,388000,"Casa Enstancia del Rio, Samborondón",-2.1261184,-79.8766916,1197.530864197531,A
854,300000,Casa Esquinera en Lomas de Urdesa - C. Suárez - A. Cobos,-2.165891302729015,-79.90266371531374,351.288056206089,C
113,112000,Venta de Casa en La Joya Esquinera a Estrenar (única Etapa con Club Panorámico),-2.046665273653481,-79.9114201526184,991.1504424778761,B
156,130000,Venta Samborondon Casa en Villa de Estreno Moderna,-2.0295738,-79.90413949999999,833.3333333333334,B
258,260000,Venta Hermosa Casa en Kennedy Norte - F. Rodríguez,-2.153638790700234,-79.90195914337323,1007.7519379844962,A
147,96000,"Casa en Venta en La Urbanización La Joya, Vía Samborondón",-2.0495844,-79.9146923,653.0612244897959,B
255,270000,Puerto Azul Hermosa Casa 2 Plantas,-2.193315405883491,-79.97136377883834,1058.8235294117646,A
297,230000,Espectacular Vivienda Remodelada en Ciudad Celeste,-2.074589295375011,-79.85734945725494,774.4107744107744,B
1700,1300000,Venta de Casa en Urb. Biblos,-2.135306816597971,-79.86609238567507,764.7058823529412,B
470,210000,Vendo Casa Lomas de Urdesa - F. Brito,-2.163800672884859,-79.90432400269395,446.8085106382979,C
364,285000,Casa de Venta Esquinera en La Urbanización Terranostra con 4 Dorm..,-2.187669659405457,-80.00269257409667,782.967032967033,B
450,485000,Mocoli Casa de Estreno en Venta,-2.101386821815872,-79.85859482485353,1077.7777777777778,A
276,165000,En Venta Amplio Departamento en Lomas de Urdesa - K. Salamea,-2.163800672884859,-79.90432400269395,597.8260869565217,B
142,96990,Casa en Venta en Fuentes del Rio - 3 Dorm.,-2.0581715,-79.87063369999998,683.0281690140845,B
396,160000,"Casa Rentera de 3 Pisos, 2 Departamentos y Terraza",-2.12654888551479,-79.90302739629516,404.04040404040404,C
210,105000,Formidable Casa en Samanes,-2.113597360295507,-79.90868269037571,500.0,C
500,420000,Laguna del Sol Se Vende Hermosa Casa,-2.083200972101952,-79.87290416165467,840.0,B
472,210000,En Venta Casa con Uso de Suelo Comercial - I. Alarcón,-2.1647707,-79.920504,444.91525423728814,C
180,149000,En Venta Casa en Urb. Terranostra Via a La Costa - E. Salcedo,-2.1880985,-79.99968849999999,827.7777777777778,B
495,399000,"Moderna Casa en El Km 9, 4 Dorm. Acabados de Primera",-2.075939203530357,-79.8746686002197,806.060606060606,B
238,140000,En Venta Casa en Vía a La Costa Urb. Casa Club - A. Salvador,-2.1804425,-79.9867567,588.2352941176471,B
103,105000,Vendo Casa Rentera Dos Oficinas Departamento Suite Para Inversionistas Urdesa,-2.167342436357781,-79.90897718626093,1019.4174757281553,A
267,280000,Amplia y Luminosa Casa Urb. Los Lagos - Samborondon,-2.0907999,-79.87306769999998,1048.689138576779,A
214,140000,Venta de Casa Rentera en Alborada Quinta Etapa,-2.142087,-79.90667630000002,654.2056074766355,B
400,325000,Isla Mocoli Vendo Moderna Casa de Estreno,-2.103258580671302,-79.85977828919982,812.5,B
194,140000,"Casa en Venta Esquinera, Casa Rentera, en Alborada 5ta Etapa",-2.13492450359843,-79.89389603862304,721.6494845360825,B
150,225000,Casa en Venta en Bellavista de Tres Pisos - Rentera - Cerca Al Estadio Barcelona,-2.180032036060382,-79.91106704883492,1500.0,A
82,58000,"Sauces 3; 2 Plantas, Rentera 2 Locales y 1 Departamento por Concluir.",-2.1270629,-79.89306920000001,707.3170731707318,B
227,158000,Oportunidad! Venta Casa Ciudad Celeste: Via Samborondon - Guayaquil: 4 Habitaciones,-2.073659197271514,-79.84677773342196,696.0352422907489,B
320,299000,Amplia y Acogedora Casa en Km 5.5 Via Samborondon,-2.056239895053519,-79.87696408726231,934.375,B
550,250000,Casa en Venta Lomas de Urdesa - Guayaquil - F. Rodríguez,-2.161141816406824,-79.9067272619713,454.54545454545456,C
315,340000,Linda Casa con Piscina en Urbanizaciòn Terrasol Samborondòn,-2.1136478,-79.8702872,1079.3650793650793,A
120,88000,"Venta Casa, 4 Dorm. en Urb. Milann, Vía a Salitre",-2.0389111,-79.87115399999999,733.3333333333334,B
460,550000,Hermosa Casa de Venta en Rio Grande - Via Samborondon,-2.148867166418101,-79.86449706923793,1195.6521739130435,A
142,125000,Casa de 2 Plantas en Veranda a Precio de Oportunidad - Norte de Guayaquil,-2.0657732,-79.9092051,880.2816901408451,B
238,190000,Vendo Linda Casa Esquinera Ciudad Celeste,-2.070203721233457,-79.83651778028718,798.3193277310925,B
238,220000,En Venta Casa en Urb. Terranostra - A. Jurado,-2.187669659405457,-80.00269257409667,924.3697478991596,B
135,106000,Vendo Casa en Villa Club Floral Esquinera 2 Plantas Estrene Cerca C. C El Dorado,-2.043174033823704,-79.89250298623045,785.1851851851852,B
260,105000,Vendo Casa Rentera en El Centro Sur,-2.2097199,-79.9032393,403.84615384615387,C
220,338000,Venta Casa en Ciudad Colon 4 Dorm. Oportunidad,-2.153284520839329,-79.9059544042251,1536.3636363636363,A
93,107000,Casa - Vía a La Costa,-2.1884336,-80.0272384,1150.5376344086021,A
316,375000,Casa - Samborondón,-2.107305499999999,-79.872252,1186.7088607594937,A
351,225000,Vendo Linda Casa en Ciudad Celeste de Oportunidad - Samborondón,-2.071838067195415,-79.84194695822754,641.025641025641,B
170,90000,Vendo Villa Amplia en Alborada 7 Ma Etapa,-2.139725475029723,-79.90023314760742,529.4117647058823,B
447,600000,Venta de Edificio,-2.201967023562943,-79.89564727168886,1342.2818791946308,A
121,85900,Urbanizacion l'Ogare: Hermosas Casas Desde $85.900,-2.0206313,-79.86745050000002,709.9173553719008,B
493,179000,"Casa en Venta, Miraflores. 200.59 m² Terreno y 292.47 m² Construccón",-2.165758301058737,-79.92092605819704,363.08316430020284,C
250,230000,En Venta Casa Cdla. Bellavista de 250 m² - P. Silva - G. Sosa,-2.1315044,-79.92881290000003,920.0,B
153,78000,"Venta Casa, Urb. La Joya, Etapa Esmeralda, Cerca a C. C. Mix Center",-2.046665273653481,-79.9114201526184,509.80392156862746,B
445,260000,Ciudad Celeste Etapa La Marina,-2.071630074756056,-79.84434610795074,584.2696629213483,B
278,215000,Vendo Casa Urb. Portal Al Sol Vía a La Costa,-2.183062957823979,-79.98330757301636,773.3812949640288,B
300,175000,Urdesa Vendo Linda Casa en Conjunto Cerrado!,-2.166123793087345,-79.91167234129125,583.3333333333334,B
1000,360000,Cumbres Venta Colosal Residencia de 4 Hab con Mega Patio y Galeria,-2.156828033536438,-79.9446783206543,360.0,C
200,160000,Propiedad en Venta en Urdesa Central - A. Cobos,-2.168220977270885,-79.91281856983642,800.0,B
600,500000,Vendo Via Samborondon Preciosa Casa Piscina. 4. Habitaciones. Estudio $500.000,-2.100293795114177,-79.87739514155578,833.3333333333334,B
185,125000,Venta de Casa de un Solo Piso en Ciudad Celeste,-2.0709717,-79.84297939999999,675.6756756756756,B
435,250000,De Oportunidad Casa en Urbanización Ciudad Punta Carnero (Negociable),-2.250281,-80.9205073,574.7126436781609,B
420,550000,"Proyecto Casa en Venta Al Lago Isla Mocoli ""Ensenada""",-2.095725795682101,-79.86072986322938,1309.5238095238096,A
630,185000,"Casa en Venta en El Norte de Guayaquil, en Urdesa Central Oportunidad",-2.1584054,-79.90457709999998,293.6507936507937,C
330,380000,Venta Casa por Estrenar en Estancias del Río con 4 Dorm. 300 m² de Construcción,-2.064393409392338,-79.87350542377317,1151.5151515151515,A
350,620000,"Proyecto de Venta en Isla Mocoli, Pacifica, Cerca de Plaza Lagos",-2.1043031,-79.8604831,1771.4285714285713,A
210,246000,Central Park Club Samborondón Km 2.5 Casa en Venta,-2.1294273,-79.8667337,1171.4285714285713,A
161,125000,Linda Casa Km 10.5 de La Vía a Samborondon,-2.05864326417536,-79.87140617619627,776.3975155279503,B
750,350000,Casa de Venta en Puerto Azul con Acabados de Lujo - Vía a La Costa,-2.187145471490973,-79.97014873815459,466.6666666666667,C
72,43000,Casa en Venta en Mucho Lote 1 con 3 Habitaciones - Norte de Guayaquil - $43.000 - F. Rodríguez,-2.081512379229134,-79.92232992407304,597.2222222222222,B
255,399750,Propiedad de Lujo Isla Mocolí,-2.104158358380436,-79.86055015522538,1567.6470588235295,A
410,370000,Por Estrenar en 10 Meses Casa en Isla del Rio - Mocoli,-2.1043031,-79.86048310000001,902.439024390244,B
600,350000,"Casa Vista Al Rio, Venta en Planos, en Isla Mocoli, Personalizada",-2.102442901125957,-79.8670732875496,583.3333333333334,B
130,69000,Casa Rentera - Excelente Inversión!,-2.14179300774517,-79.8887719538418,530.7692307692307,B
650,360000,Casa en Venta en Los Ceibos - Santa Cecilia de Tres Pisos,-2.166472766498118,-79.94462968360597,553.8461538461538,B
473,198000,Casa de Venta en Urbanización Belo Horizonte (Vía a La Costa),-2.1875144,-79.98125970000001,418.6046511627907,C
112,70000,Venta Casa Urbanización Gran Victoria Samborondon Salitre,-2.017307882961421,-79.8687605037689,625.0,B
365,248000,Vendo Amplia Casa El Urbanización Privada,-2.163446693310037,-79.9461579465576,679.4520547945206,B
152,137000,Casa en Venta en Urbanización Villa Club de Estreno,-2.040180204493203,-79.89310974368897,901.3157894736842,B
120,107259,Casalaguna Tu Mejor Opción,-2.0589651,-79.9231934,893.825,B
565,460000,"Preciosa Casa Oportunidad - 4 D - $460,000",-2.0929523692344,-79.87354252740022,814.1592920353983,B
105,90000,Venta Casa con Lindos Acabados en Las Orquídeas / Bm,-2.087468948017258,-79.9167950629087,857.1428571428571,B
257,200000,"Vendo Casa Ciudad Celeste, Vía Samborondón",-2.073098658368951,-79.84152448280332,778.2101167315175,B
96,62707,Estrene Su Casa Ya! en Villa Bonita - Tu Casa Espera por Ti - Excelente Precio.,-2.062149511606544,-79.97582676499025,653.1979166666666,B
160,120000,"Vendo Villa Club Casa de 4 Habitaciones, Sala Tv, 5 Baños",-2.050890890512851,-79.8909915600189,750.0,B
208,185000,"En Venta Casa en Urb. Acuarelas del Río, Cerca del Parque Central - A. Jurado",-2.1346815,-79.8842826,889.4230769230769,B
105,37990,Villa Paula – Desde $37.990,-2.1044184,-79.93503229999999,361.8095238095238,C
192,95000,Casa en Barrio Cristo del Consuelo Av Coronel Jesus Reyes Quitanilla y Calle 42b,-2.2177791,-79.9010844,494.7916666666667,C
550,498000,Vendo Casa y Suite en Samborondon,-2.076598592743889,-79.87585688891602,905.4545454545455,B
180,138000,Vendo Ciudad Celeste 1 Planta Acabados de Primera,-2.073659197271514,-79.84677773342196,766.6666666666666,B
325,300000,Venta de Hermosa y Comoda Casa en El Km 1 Via Samborondon,-2.1447394,-79.8644152,923.0769230769231,B
127,68000,Venta de Casa en Urb. La Joya - Vía La Aurora,-2.028871996625323,-79.92029926347658,535.4330708661417,B
160,165000,Garzota Casa Grande de 4 Dorm. Cerca del Aeropuerto y del Terminal,-2.147604367372116,-79.87654857193604,1031.25,A
120,128000,Napoli Vendo Casa con Piscina,-2.036473790287801,-79.87132086459349,1066.6666666666667,A
367,390000,"Urbanización Laguna Club, Vía a La Costa Km 11.5",-2.1856104,-79.9899024,1062.6702997275204,A
112,65000,Venta de Casa 1 Planta en La Joya Etapa Diamante,-2.0409553,-79.91542219999997,580.3571428571429,B
138,115000,Casa por Estrenar con Modernos Acabados de Venta en La Joya.,-2.033715802571457,-79.91484250370485,833.3333333333334,B
139,116000,"Casa en Venta en Urb. La Joya Etapa Gema, Nueva Etapa",-2.028690464744316,-79.92175527993163,834.5323741007194,B
390,650000,Vendo Casa en Proyecto con Vista Al Lago en Isla Mocoli - Peninsula,-2.1122977,-79.8583572,1666.6666666666667,A
180,100000,Vendo Casa en Villa Club. Etapa Galaxia.,-2.0363056,-79.8933184,555.5555555555555,B
202,280000,"Casa en Km 2.2 Vía Samborondon, Urb Central Park",-2.1294273,-79.8667337,1386.1386138613861,A
412,454000,Villa de Estrene en Pacifica a La Venta,-2.1009315,-79.8583984,1101.9417475728155,A
560,600000,"Samborondon Km 7 Venta/renta Casa Full Amoblada 4 Hab, Piscina, Jacuzzi y Bar",-2.092127924857719,-79.87316607929722,1071.4285714285713,A
76,65000,Vendo Casa de Dos Pisos en Sauces 6 - Mae. Recalde,-2.130663440049926,-79.89760671971862,855.2631578947369,B
72,55000,"Casa en Venta, Ciudad Santiago",-1.862179999999999,-79.97766899999999,763.8888888888889,B
170,83000,"Propiedad en Venta, Urb. Valle Alto, Etapa París.",-2.2054936,-80.0584758,488.2352941176471,C
938,980000,Venta de Casa en Urbanización Laguna Club Via a La Costa Km 12.5,-2.1831226,-79.9913879,1044.7761194029852,A
486,350000,Los Parques Venta Casa 4 Hab y Estudio con Piscina y Garajes,-2.1731919,-79.9437532,720.164609053498,B
183,198000,"Casa en Venta, Urb. Ciudad Celeste - La Marina, Samborondón",-2.071613787296468,-79.84206462327882,1081.967213114754,A
125,130000,"Sector Alamos Venta o Renta Casa Estreno, Patio, Bbq, Conj. Resid.",-2.133756012366327,-79.91155264232788,1040.0,A
225,250000,"Ciudad Celeste, Vendo Linda Casa con Excelentes Acabados.",-2.07179360121206,-79.84207850322787,1111.111111111111,A
728,280000,Vendo Hermosa Casa Esquinera en Urb. Puerto Azúl - A. Marín,-2.186680450956173,-79.97113306325991,384.61538461538464,C
123,62000,Palacio 2b Villa del Rey 2 Pisos,-2.0248305,-79.91677709999999,504.0650406504065,B
300,280000,"Venta Casa Olivos1 Vía a La Costa: Linda y Amplia, Cuatro Dorm.",-2.168353946308851,-79.94294466347657,933.3333333333334,B
80,35000,Casa en Venta Al Sur de La Ciudad - F. Rodríguez,-2.2043128,-79.9295654,437.5,C
120,86000,"Casas de Venta en Urb. l'Ogare, con Financiamiento a 18 Meses.",-2.0169076,-79.866398,716.6666666666666,B
183,155000,Vendo Hermosa Casa Ciudad Celeste 5 Dorm.,-2.068341170525824,-79.83821612224642,846.9945355191256,B
374,320000,Venta de Moderna Casa en Vía Samborondon Km 1,-2.1447394,-79.8644152,855.6149732620321,B
180,168500,Vendo Linda Casa con Jacuzzi en Ciudad Celeste - La Brisa,-2.0734632,-79.84164249999998,936.1111111111111,B
580,140000,Casa de Venta en Lago de Capeira,-2.0059491,-79.9642126,241.3793103448276,C
500,500000,Isla Mocoli Vendo Casa de Lujo,-2.096197548642436,-79.8606440325409,1000.0,B
180,157000,Vía a La Costa - Villas del Bosque Estreno 3 Dorm.,-2.201768988291272,-80.06073692460319,872.2222222222222,B
160,155000,Vendo Casa en La Garzota,-2.1478685,-79.8929407,968.75,B
100,60000,"Venta de Casa de 1 Planta en Urb Villa del Rey, Modelo Castillo 6b",-2.076758,-79.9401216,600.0,B
950,560000,Casa en Puerto Azul en Venta,-2.158796441323949,-79.94668378590546,589.4736842105264,B
82,55000,Venta de Casa en Sauces 5,-2.123073856468501,-79.89241025344239,670.7317073170732,B
175,55000,Casa de Venta en Salinas Ciudadela Carolina Frente Al Shopping,-2.191526053604974,-79.88158962297365,314.2857142857143,C
332,415000,Villa Nueva Km 8 con Lindos Acabados,-2.0853184,-79.87263889999997,1250.0,A
217,120000,Casa en Venta en Bim Bam Bum Más un Anexo con 2 Parqueos,-2.163744524582205,-79.92809627672119,552.9953917050691,B
160,110000,En Venta Casa de 2 Plantas en Villa Club Etapa Doral,-2.050890890512851,-79.8909915600189,687.5,B
140,105000,Samanes Casa en Venta,-2.191526053604974,-79.88158962297365,750.0,B
700,1500000,Laguna Club Lujosa Casa en Venta,-2.185610399999999,-79.9899024,2142.8571428571427,A
432,110000,Casa Para Remodelar en Argentina y La 11 Calle Comercial,-2.209229,-79.88950729999999,254.62962962962962,C
220,290000,Lujosa Casa en Urb. Privada Frente a La Via León Febres Cordero,-1.9606263,-79.72715099999999,1318.1818181818182,A
650,690000,Mocoli Espectacular de Estreno,-2.098672889333189,-79.86270962155459,1061.5384615384614,A
1010,899000,Km. 6 Vía Samborondon Castelago Hermosa Casa en Venta,-2.0957451,-79.8712972,890.0990099009902,B
287,250000,Venta de Villa de Oportunidad Excelente Ubicación,-2.1231067,-79.8709837,871.0801393728223,B
240,228000,"Urbanización Ciudad Celeste, Vivienda en Venta",-2.073659197271514,-79.84677773342196,950.0,B
208,125000,"Vendo Villa Amplia, Bonito Sector - Sauces IX,200 m² Terreno $125.000, Acepto Bies.",-2.132219426981645,-79.89267285337303,600.9615384615385,B
1900,1800000,Maravillosa Casa Al Rio Babahoyo Construida por Grunauer,-2.1070207,-79.87232990000001,947.3684210526316,B
710,475000,Venta: Casa Rentera + Locales Comerciales –frente Iglesia Inmaculada Concepción,-2.2123524,-79.89413400000001,669.0140845070423,B
254,160000,Venta - Casa Rentera - en Mapasingue,-2.155192326146559,-79.92315099999996,629.9212598425197,B
275,250000,Proyecto de Venta en La Arboleda en Ciudad Celeste en Vía Samborondón,-2.07179360121206,-79.84207850322787,909.0909090909091,B
400,350000,Vendo Casa Moderna de Estreno en Isla Mocoli,-2.094106824214779,-79.85657780367433,875.0,B
250,245000,Vendo Moderna Casa de Estreno Ciudad Celeste,-2.0715709,-79.84227920000001,980.0,B
1400,720000,Venta de Casa Corredor Comercial Kennedy Vieja,-2.176789490589865,-79.89842595183717,514.2857142857143,B
231,290000,Casa - Samborondón,-2.132763683449999,-79.8675970263,1255.4112554112555,A
420,400000,"Vendo Linda y Amplia Casa en Fontana, Vía a Samborondon, Sector Uess.",-2.1263918,-79.86639409999998,952.3809523809524,B
1101,990000,Casa - Guayaquil,-2.164276999999999,-79.8779834,899.1825613079019,B
545,457900,Proyecto en Samborondon en Isla Mocoli Casa de Una Planta 3 Dorm.,-2.107189888382369,-79.86102222401195,840.183486238532,B
