metroscuadradostotales,precio,titulo,latitud,longitud,preciomt2
400,375500,"Venta de  Casa Laguna Del Sol, 3 dormitorios,  Samborondon",-2.130760908126831,-79.90673828125,938.75
337,150000,En Venta Casa en Cdla. La Alborada Décima Etapa,-2.134000062942505,-79.90899658203125,445.10385756676556
95,108000,"Venta de Suit amoblada Kennedy Point, planta baja",-2.1989998817443848,-79.90799713134766,1136.842105263158
60,65000,Suite Kennedy Amoblada,-2.172635316848755,-79.90055084228516,1083.3333333333333
132,138000,"Casa en Venta Urb. El Condado Vicolinci, Guayaquil",-2.0480000972747803,-79.90499877929688,1045.4545454545455
170,105000,Venta Departamento Urdesa Norte,-2.165,-79.91,617.6470588235294
142,100000,Vendo Casa Villa Club Etapa Floral,-2.174929618835449,-79.90115356445312,704.2253521126761
84,42000,"Venta de casa en Urb. Portón de la Beata, Vía a Daule, cerca de la Cervecería y la Terminal Terrestre de Pascuales",-2.061000108718872,-79.95500183105469,500.0
158,155000,"Venta / Renta, alquiler Departamento / Edificio San Francisco 300 / Centro de Guayaquil / Zona Bancaria",-2.191999912261963,-79.88099670410156,981.0126582278481
48,55000,Vendo Bonita Villa,-2.1710000038146973,-79.9219970703125,1145.8333333333333
120,76000,Casa de 2 plantas Samanes 1,-2.115000009536743,-79.90299987792969,633.3333333333334
195,115000,VENDO CASA EN LA ALBORADA 10MA ETAPA,-2.134000062942505,-79.90899658203125,589.7435897435897
140,98000,"Propiedad en venta en Metrópolis 2, terminal Pascuales, etapa 2A totalmente ampliada y remodelada.",-2.065000057220459,-79.91400146484375,700.0
168,90000,"Venta Departamento Centro Guayaquil, Los Rios y Hurtado, Cerca de Universidades",-2.188999891281128,-79.89399719238281,535.7142857142857
105,65000,Vende Casa Las Orquídeas,-2.0959999561309814,-79.91100311279297,619.047619047619
95,85000,Venta de Casa de dos Plantas en Mucho Lote 2,-2.065000057220459,-79.89299774169922,894.7368421052631
322,90000,venta de casa Francisco Segura entre la 44 y 45 Suroeste cerca de la estación de la linea 7 Guayaquil,-2.121000051498413,-79.88800048828125,279.5031055900621
110,49500,Venta/departamento/Chiriboga y Boyaca/centro/Guayaquil,-2.121000051498413,-79.88800048828125,450.0
300,250000,Se Vende Casa en Bosques De la Costa 300 m2,-2.181999921798706,-79.97000122070312,833.3333333333334
175,98000,"Venta casa-2plantas,  bifam.""Las Orquideas""",-2.063999891281128,-79.91500091552734,560.0
300,116000,"CIUDADELA COVIEM VENDO BONITA CASA 4 DORMITORIOS, PATIO, GARAJES, BASES 2DO PISO",-2.236999988555908,-79.90299987792969,386.6666666666667
210,115000,"Enventa Casa en Las Orquideas, Guayaquil",-2.1320769786834717,-79.8958740234375,547.6190476190476
750,300000,Casa de venta en Vía a Samborondon - Cdla. La Gloria – código:15258,-2.161486,-79.917257,400.0
135,95000,Venta de Casa Samanes 7 - C. Herrera - A. Maidana,-2.11299991607666,-79.90899658203125,703.7037037037037
250,136000,Se Vende Casa en Urb. Saint Gallen  140 m² · 3 Habitaciones · 1 Estacionamiento,-2.1410000324249268,-79.91000366210938,544.0
211,200000,"Vendo, casa duplex de dos pisos en urbanización en los Ceibos al norte de Guayaquil",-2.1670000553131104,-79.94499969482422,947.8672985781991
300,258000,Vendo casa en urbanizaciòn El Condado de Vicolinci,-2.0480000972747803,-79.90499877929688,860.0
82,89000,"Venta De Casa Sauces 3 Cerca de Puente Vía a Samborondón, Norte De Guayaquil",-2.127000093460083,-79.88999938964844,1085.3658536585365
216,195000,Venta Casa esquinera en Urb. Belo Horizonte (Vía a la Costa,-2.187000036239624,-79.98100280761719,902.7777777777778
15,25000,Vendo Casa,-2.091,-79.955,1666.6666666666667
1371,500000,Casa de venta en CENTRO SUR - LIZARDO GARCÍA – código:16323,-2.161486,-79.917257,364.69730123997084
91,62707,"Venta de Casa en Villa Bonita, Via a Daule km 16, cerca de la Cervecería Nacional.",-2.052999973297119,-79.98699951171875,689.0879120879121
80,90000,En Venta Departamento en Cdla. La Garzota,-2.1459999084472656,-79.89399719238281,1125.0
150,210000,Venta  departamento al rio,-2.1018524169921875,-79.86404418945312,1400.0
200,170000,"Venta de  casa en Porto Vita, Via la Costa",-2.1579999923706055,-79.90799713134766,850.0
72,45000,Vendo Villa en Mucho Lote 1,-2.190999984741211,-79.93399810791016,625.0
300,300000,"Vendo, casa de dos pisos mas terraza en conjunto cerrado en Bellavista",-2.177999973297119,-79.91400146484375,1000.0
72,105000,Amplio y hermoso Departamento Suite Planta de terraza. Kennedy Norte Atras del Mac DonalsSan Marino,-2.177000045776367,-79.89600372314453,1458.3333333333333
48,35000,"Vendo, suite en el centro de Guayaquil cerca a la zona financiera y comercial de la ciudad",-2.1989998817443848,-79.93000030517578,729.1666666666666
200,146500,Oportunidad Santa Maria Casa Grande,-2.138768196105957,-79.59405517578125,732.5
355,79000,Barrio del Seguro vendo edificio rentero 3 plantas con multiples areas para uso comercial y de vivienda,-2.2179999351501465,-79.89600372314453,222.53521126760563
200,75000,"Venta Casa 2 plantas, Guayacanes bifamiliar, medianera",-2.134000062942505,-79.87100219726562,375.0
250,155000,"Casa en Venta en Castilla, Samborondon cerca del Mall Samborondon",-2.244999885559082,-79.8949966430664,620.0
166,81000,Vendo Dpto Ed. San Sebastian Excelente Ubicacion - R. Hurtado - J. Moncada,-2.2160000801086426,-79.88899993896484,487.95180722891564
450,350000,Casa Rentera / Edificio Gomez Rendon y la 14,-2.244999885559082,-79.8949966430664,777.7777777777778
186,120000,"Casa en Venta en Matices, Samborondon, frente al Dorado",-2.2660000324249268,-79.8740005493164,645.1612903225806
207,67000,Casa Esquinera Oportunidad Florida Norte,-2.18935489654541,-79.88920593261719,323.67149758454104
560,200000,Vendo Casa Rentera Sector Comercial,-2.1710000038146973,-79.9219970703125,357.14285714285717
275,229000,Venta de Casa en Garzota Norte de Guayaquil,-2.1459999084472656,-79.89199829101562,832.7272727272727
150,110000,"Departamento de Venta Kennedy Norte Cerca del Parque Lineal, cerca del SRI",-2.1570000648498535,-79.9010009765625,733.3333333333334
80,90000,"Venta de Departamento en la Urb. Puerto Azul, Vía a la Costa, cerca de Laguna Plaza.",-2.191999912261963,-79.96700286865234,1125.0
500,275000,Garzota Casa Rentera Crédito Bancario,-2.1559998989105225,-79.94499969482422,550.0
127,120000,"Departamento de venta, Urbanización La cumbre Alta, Sector Ceibos, Cerca del C.C. Riocentro Ceibos",-2.1549999713897705,-79.94100189208984,944.8818897637796
65,46000,"Vendo casa 2 plantas en Huancavilca Norte, cerca al Parque Samanes, Av Orellana",-2.0959999561309814,-79.90899658203125,707.6923076923077
100,68000,Venta de casa en ciudadela Villa del Rey sector Norte cerca al Centro Comercial El Dorado,-2.1040000915527344,-79.91600036621094,680.0
134,106000,Casa en Venta - Urbanización Cataluña,-2.191999912261963,-79.91699981689453,791.044776119403
206,220000,"Casa de Venta en La Garzota, Norte de Guayaquil, cerca del Centro Comercial Mall del Sol",-2.181999921798706,-79.97000122070312,1067.9611650485438
130,50000,Vende Villa Vergeles,-2.096,-79.911,384.61538461538464
160,10000,vendo casa  de remate a 100 metros de la playa,-2.7260000705718994,-80.29399871826172,62.5
550,615000,"Venta Casa-rentera, Avda. Machala, 3 pisos",-2.132999897003174,-79.87100219726562,1118.1818181818182
210,78000,"Se vende amplia casa y terreno Sur Guayaquil. Oportunidad en ciudadela La Fragata, Guayaquil",-2.24399995803833,-79.90699768066406,371.42857142857144
180,160000,VENTA DE CASA EN VILLAS DEL BOSQUE VIA A LA COSTA,-2.187471628189087,-80.0060806274414,888.8888888888889
130,50000,Vende Casa Vergeles por Autopista,-2.0959999561309814,-79.91100311279297,384.61538461538464
105,50000,Vende Casa Las Orquideas,-2.0959999561309814,-79.91100311279297,476.1904761904762
630,185000,"Casa en venta en el norte de Guayaquil, en URDESA NORTE OPORTUNIDAD",-2.1579999923706055,-79.90499877929688,293.6507936507937
194,140000,"Casa en venta Esquinera, casa rentera, en Alborada 5ta Etapa",-2.13700008392334,-79.89600372314453,721.6494845360825
84,65000,#Se Vende en Barrio Del Seguro 2 Plantas/ CERCA DE CENTENARIO/ 0982712236/ PARQUE FORESTAL/ SUR,-2.2269999980926514,-79.8949966430664,773.8095238095239
2558,1150000,Vendo Casa Via Samborondon,-2.1710000038146973,-79.9219970703125,449.5699765441751
163,130000,VENTA CASA 3 DORMITORIOS EN PUERTO AZUL VÍA A LA COSTA GUAYAQUIL ECUADOR,-2.191999912261963,-79.96700286865234,797.5460122699386
350,380000,Venta de Casa El Álamo Norte de Gye,-2.134,-79.914,1085.7142857142858
98,63000,Vendo Casa Esquinera Sur de Guayaquil,-2.251217842102051,-79.8987808227539,642.8571428571429
300,175000,"Venta Casa, 2 planta en El Centenario",-2.134000062942505,-79.87100219726562,583.3333333333334
650,110000,Venta Condominio Rentero 4 departamentos sauces 6 en peatonal,-2.1187853813171387,-79.9065170288086,169.23076923076923
270,168900,VENTA CASA VIA A LA COSTA CASA CLUB,-2.180000066757202,-79.98699951171875,625.5555555555555
865,600000,"Venta-edificio rentero, Centro de Gquil, G. Moreno y 9 de Octubre",-2.188999891281128,-79.89099884033203,693.6416184971098
1800,1250000,RESIDENCIA DE LUJO  URBANIZACION PLAZA LAGOS SAMBORONDON,-2.1540000438690186,-79.86599731445312,694.4444444444445
780,325000,"Venta Casa p. baja, Km 2 1/2 Vía Samborondon, cerca de la UESS, vendo casa",-2.132999897003174,-79.87200164794922,416.6666666666667
132,105000,Departamento Centro de Guayaquil,-2.167790412902832,-79.91097259521484,795.4545454545455
310,268000,Venta de Casa en Colinas de Los Ceibos con una Suite,-2.244999885559082,-79.8949966430664,864.516129032258
120,60000,CENTRO VENDO DPTO. SECTOR BAHÍA,-2.1659998893737793,-79.89399719238281,500.0
102,105000,"Hermosa casa de venta en La Joya, Etapa Coral, remodelada.",-2.2219998836517334,-79.89700317382812,1029.4117647058824
75,78000,"Vendo suite en La Vista Towers, Sector Norte, cerca a C.C. CITY MALL",-2.134999990463257,-79.91400146484375,1040.0
120,60000,Se vende casa con local comercial frente al hospital Guayaquil,-2.2130000591278076,-79.93099975585938,500.0
313,187000,"Casa en Belo Horizonte Via a la Costa, 313 Mts",-2.187000036239624,-79.97799682617188,597.444089456869
250,146000,"Venta de Casa en Urdesa, norte de Guayaquil, cerca de la Parrillada del Ñato, a una cuadra de la Victor E Estrada",-2.1649999618530273,-79.91400146484375,584.0
300,170000,"DEP. ENTRE RIOS (solo interesados, NO corredores)",-2.1510000228881836,-79.86699676513672,566.6666666666666
66,40000,Venta de Departamento con 2 dormitorios en centro de la ciudad,-2.1410000324249268,-79.90799713134766,606.060606060606
105,118000,"Vendo apartamento en VIZCAYA GARDENS, cerca de C.C. RIOCENTRO CEIBOS, Norte de Guayaquil",-2.1630001068115234,-79.93099975585938,1123.8095238095239
250,125000,Casa de venta en Salinas – código:16252,-2.161486,-79.917257,500.0
108,104000,vendo hermosa suite en la ciudadela la FAE norte de guayaquil,-2.1640000343322754,-79.9020004272461,962.9629629629629
80,43900,Departamento en Venta Alborada Apanor,-2.0536537170410156,-79.89422607421875,548.75
101,34000,Departamento de venta en Salinas - La Floresta – código:16253,-2.161486,-79.917257,336.63366336633663
163,120000,Garzota Venta Departamento Pbaja 4 Dormi,-2.144806385040283,-79.89968872070312,736.1963190184049
160,71800,VILLA LA JOYA ETAPA ONIX,-2.2300000190734863,-79.9010009765625,448.75
693,550000,"VENDO HERMOSA CASA EN SAMBORONDOM, KM. 5.5",-2.2179999351501465,-79.92400360107422,793.6507936507936
200,145000,VIZCAYA GARDENS VENTA DEPARTAMENTO FULL AMOBLADO 2 PARQUEOS Y BODEGA,-2.1589999198913574,-79.947998046875,725.0
498,135000,Se Vende Casa en Guayacanes .DE CONTADO !!!,-2.118000030517578,-79.89299774169922,271.0843373493976
500,250000,casa rentera en Samanes 6,-2.1089999675750732,-79.90299987792969,500.0
160,129000,Casa de venta en Urb. Villa Club - Etapa Jupiter – código:15151,-2.161486,-79.917257,806.25
138,79000,Departamento de venta en Urdesa - Víctor Emilio Estrada – código:14489,-2.161486,-79.917257,572.463768115942
118,115000,Casa de venta en Urb. Gran Vittoria – código:15843,-2.161486,-79.917257,974.5762711864406
65,27000,"Departamento en venta en el Centro de Guayaquil, la Av. Quito",-2.134999990463257,-79.91300201416016,415.38461538461536
600,298000,"Casa en Venta en Condado Vicolinci, Samborondon",-2.0480000972747803,-79.90499877929688,496.6666666666667
300,80000,Casa en La Cdla Iess Sur Huancavilca,-2.168025493621826,-79.8955078125,266.6666666666667
364,285000,Casa de venta esquinera en la Urbanización Terranostra con 4 dormitorios.,-2.187999963760376,-80.0,782.967032967033
250,260000,"Villa de Venta, via la Costa, Urb. Puerto Azul,  frente a Urb Bosques de la costa",-2.191999912261963,-79.96700286865234,1040.0
90,78000,"Se Vende, Mucho Lote 1 con Local Comerci",-2.196000099182129,-79.88500213623047,866.6666666666666
150,200000,"Vendo, departamento en edificio San Francisco en el centro de Guayaquil",-2.180000066757202,-79.9749984741211,1333.3333333333333
150,165000,VENTA LOS OLIVOS DEPARTAMENTO 3 DORMITORIOS,-2.1670000553131104,-79.94400024414062,1100.0
120,105000,VENDO  CASA DE OPORTUIDAD,-2.1670000553131104,-79.93800354003906,875.0
80,115000,Departamento en venta de estreno en kennedy norte,-2.177000045776367,-79.89600372314453,1437.5
160,145000,Vendo Casa Matices,-2.1700000762939453,-79.89800262451172,906.25
83,127000,"Kennedy Norte, Condominio, Venta Departm",-2.144824266433716,-79.89974975585938,1530.120481927711
420,145000,Venta Villa una Planta en Centenario Sur,-2.2219998836517334,-79.88999938964844,345.23809523809524
158,98500,Vendo Casa  de Oportunidad en San Felipe,-2.135927200317383,-79.92464447021484,623.4177215189874
294,143000,"Casa en venta en cdla el condor, vendo casa grande con garaje, zona norte",-2.131999969482422,-79.90699768066406,486.3945578231293
80,54900,"Mucho Lote 1 Etapa 5, Casa en Venta, Norte de Guayaquil",-2.0820000171661377,-79.9209976196289,686.25
125,120000,Casa de venta en Urb. San Felipe – código:15857,-2.161486,-79.917257,960.0
555,450000,Casa de venta en Garzota - Cerca al Mall del Sol – código:13798,-2.161486,-79.917257,810.8108108108108
1000,2500000,Casa de venta en Cerro Santa Ana - Las Peñas – código:15741,-2.161486,-79.917257,2500.0
525,305000,Venta de Villa Esquinera en Puerto Azul,-2.191999912261963,-79.96700286865234,580.952380952381
78,69000,Venta Casa Paraiso Del Rio,-2.0878474712371826,-79.9258804321289,884.6153846153846
92,95000,Vende Casa Sauces 2,-2.1550776958465576,-79.89030456542969,1032.608695652174
154,125000,LOMAS DE URDESA DEPARTAMENTO EN VENTA. ASCENSOR.,-2.1640000343322754,-79.90699768066406,811.6883116883117
473,198000,"Venta de Casa en la Urb. Belo Horizonte, cerca de C.C Costalmar, Vía a la Costa.",-2.187000036239624,-79.98100280761719,418.6046511627907
210,245000,Vendo Casa Urbanización Villa Real,-2.134411096572876,-79.87029266357422,1166.6666666666667
120,125000,Oportunidad Venta Hermoso Dpto. 3 Dormitorio Campori D32,-2.1630001068115234,-79.94200134277344,1041.6666666666667
301,239999,VENTA DE CASA EN PUERTO AZUL,-2.191999912261963,-79.96700286865234,797.3388704318937
270,175000,"Venta de Casa Rentera en la Alborada, frente al C.C City Mall, Norte de Guayaquil",-2.125,-79.90299987792969,648.1481481481482
80,95000,Departamento a estrenar en Kennedy Norte,-2.1570000648498535,-79.9010009765625,1187.5
28,13000,Vendo parqueo amplio norte de Guayaquil Edificio Induauto 9 de Octubre,-2.190999984741211,-79.88500213623047,464.2857142857143
246,90000,"Venta de Departamento en Kennedy Nueva, frente del C.C. Policentro, Norte de Guayaquil.",-2.0989999771118164,-80.10099792480469,365.8536585365854
1,170000,Casa de venta en Río Centro Sur - Las Terrazas – código:15957,-2.161486,-79.917257,170000.0
144,18000,Vendo Casa en La Libertad .,-2.2180752754211426,-79.94269561767578,125.0
175,574700,"Venta de Penthouse en Edificio Santana Lofts, Puerto Santa Ana, cerca del Malecon 2000, Centro de Guayaquil",-2.178999900817871,-79.8759994506836,3284.0
99,50000,"Propiedad en Venta, Cdla. Las Orquídeas. - wasi_1506479",-2.1894128,-79.8890662,505.050505050505
360,370000,VENTA DE CASA DE 4 DORMITORIOS EN SAMBORONDON AL NORTE DE GUAYAQUIL,-2.1530001163482666,-79.86599731445312,1027.7777777777778
130,50000,"Propiedad en venta, Cdla. Los Vergeles. - wasi_1506576",-2.0886801,-79.9006795,384.61538461538464
270,135000,Alborada 4 Propiedades en 1 Av. Principa,-2.049042224884033,-79.8908920288086,500.0
96,63950,"Venta de Casa en urb. Villa Bonita Mi lote, Norte de Guyaquil, cerca del Terminal de Pascuales.",-2.062000036239624,-79.9739990234375,666.1458333333334
170,37000,OPORTUNIDAD CASA UNA PLANTA ENTRADA DE LA 8 CERCA AV. CASUARINA,-2.119999885559082,-79.96800231933594,217.64705882352942
78,69500,VENTA DE PROPIEDAD EN LA URB. PARAÍSO DEL RÍO,-2.059999942779541,-79.88600158691406,891.025641025641
94,69500,"Venta Norte de Guayaquil, Paraíso del Río - wasi_1503020",-2.0603656,-79.8863433,739.3617021276596
115,110000,"Venta de Departamento en Ceibos, cerca del C.C Riocentro Ceibos, Norte de Guayaquil",-2.1670000553131104,-79.94499969482422,956.5217391304348
125,125000,"Departamento de Venta en Kennedy Norte,  cerca del Parque Lineal, Dep por Estrenar",-2.1619999408721924,-79.9020004272461,1000.0
148,115000,"Venta de departamento planta baja, 4 dormitorios en Urdesa Norte.",-2.1579999923706055,-79.90499877929688,777.027027027027
650,2950,Samborondon Rento Casa 5 Habitaciones,-2.1710000038146973,-79.89800262451172,4.538461538461538
60,63000,"Venta-Suite 9 puestos, Estadio Barcelona",-2.132999897003174,-79.87100219726562,1050.0
160,85000,VENTA CASA ALBORADA 10MA ETAPA,-2.13700008392334,-79.90899658203125,531.25
400,260000,"Garzota villa grande en venta, muchas habitaciones por desarrollar.",-2.1480000019073486,-79.89299774169922,650.0
367,110000,VENDO CASA 341.38 m2 TERRENO RESIDENCIAL Y COMERCIAL,-2.1579999923706055,-79.90499877929688,299.7275204359673
330,250000,"Venta de Casa de 2 plantas en Urb. Puerto Azul, 330 mts2, Via a la Costa,",-2.191999912261963,-79.96700286865234,757.5757575757576
120,90000,Venta Departamento Urb. Saint Gallen Norte de Guayaquil,-2.1410000324249268,-79.90899658203125,750.0
149,158131,Via a La Costa Puerto Azul Departamento DE ESTRENO CON ASCENSOR,-2.191999912261963,-79.96700286865234,1061.2818791946308
101,110000,VENTA DEPARTAMENTO VISTA AL RÍO SAMBORONDON AVENIDA LEÓN FEBRES CORDERO,-2.052000045776367,-79.89700317382812,1089.1089108910892
390,285000,Venta casa 2 pisos Alborada 10ma etapa,-2.13700008392334,-79.90799713134766,730.7692307692307
523,370000,Urb. Los Parques Casa en Venta,-2.1730000972747803,-79.94400024414062,707.4569789674953
250,185000,Casa en Venta Ceibos Norte 3 Dormitorios oportunidad,-2.1519999504089355,-79.94300079345703,740.0
800,250000,Venta de Casa Lago de Capeira Guayaquil,-2.006,-79.964,312.5
160,140000,Venta Departamento Centro de La Ciudad,-2.188999891281128,-79.88899993896484,875.0
104,87000,"Departamentos de venta en San Felipe por estrenar, 3 dormitorios.",-2.1389999389648438,-79.9219970703125,836.5384615384615
300,175000,Z VENTA DE HERMOSA CASA EN BARRIO CENTENARIO CON EXCELENTES ACABADOS,-2.2219998836517334,-79.88200378417969,583.3333333333334
115,115000,"Venta de Casa en Urbanizacion La Perla, Autopista Narcisa de Jesus, Norte de Guayaquil.",-2.058000087738037,-79.90799713134766,1000.0
180,100000,La Joya Vendo Casa 4 Habitaciones,-2.18935489654541,-79.88920593261719,555.5555555555555
131,171000,"Venta de Casa en la Urb. Ciudad Celeste, Etapa Arboleda, cerca del C.C Riocentro El Dorado, Samborondon",-2.18935489654541,-79.88920593261719,1305.3435114503816
170,175000,VENDO CASA DE ESTRENO EN URB. EL CONDADO VICOLINCI,-2.0480000972747803,-79.90499877929688,1029.4117647058824
120,103000,Casa de venta en Urb. Milan  – código:15717,-2.161486,-79.917257,858.3333333333334
800,450000,VENTA CASA ESQUINERA EN PUERTO AZUL,-2.191999912261963,-79.96700286865234,562.5
68,69900,Departamento de venta en Kennedy Norte – código:15311,-2.161486,-79.917257,1027.9411764705883
130,125000,Departamento de Venta Lomas de Urdesa  cerca de Urdesa Central,-2.1640000343322754,-79.90699768066406,961.5384615384615
200,159000,"PORTAL AL SOL vendo casa estreno 3 dormitorios, amplio patio",-2.385999917984009,-80.35399627685547,795.0
82,115000,Hermoso Departamento Suite Kennedy Norte Atras del Mac Donals Por el San Marino al Norte de Guayaquil,-2.1700000762939453,-79.89900207519531,1402.439024390244
1187,700000,Vendo Elegante Casa Esquinera en la Urb. Puerto Azul,-2.191999912261963,-79.96700286865234,589.7219882055603
119,62000,"Casa en Venta, Urbanización Colinas del Maestro, Norte de Guayaquil, Fernando Malaver",-2.078000068664551,-79.91500091552734,521.0084033613446
72,34000,"Casa en Venta en Mucho Lote 1 Etapa 7, Norte de Guayaquil",-2.0820000171661377,-79.9229965209961,472.22222222222223
240,150000,SE VENDE CASA RENTERA EN EL CENTRO DE GUAYAQUIL,-2.190000057220459,-79.9010009765625,625.0
75,40000,"Venta de Departamento, Condominio Los Jardines - wasi_1517397",-2.233439,-79.9022867,533.3333333333334
72,52000,"Casa en Venta, Urb. Villa España - Barcelona, Norte de Guayaquil",-2.0820000171661377,-79.91899871826172,722.2222222222222
72,63000,"Casa en Venta, Urb. Ecojardin Etapa II, Vía Pascuales",-2.0840001106262207,-79.96800231933594,875.0
370,295000,"Venta de casa en Colinas de los Ceibos 4 dormitorios, estudio, cuarto de servicio 5 1/2 baños, piscina",-2.1619999408721924,-79.94499969482422,797.2972972972973
230,158000,Casa Remodelada en Ceibos Principal,-2.165,-79.942,686.9565217391304
600,700000,Se vende o se Alquila casa en Los Olivos 5 dormitorios,-2.1670000553131104,-79.94400024414062,1166.6666666666667
255,249000,Casa a la venta en Puerto Azul,-2.1410000324249268,-79.88600158691406,976.4705882352941
400,245000,"Vendo casa al Norte de Guayaquil ,Alborada X Etapa, Urbanización cerrada",-2.132999897003174,-79.91300201416016,612.5
50,110000,Sector Ciudad Colonvendo Suite Amoblada,-2.1519999504089355,-79.90699768066406,2200.0
73,160000,"Departamento en Venta, Puerto Santa Ana, Guayaquil",-2.178999900817871,-79.8759994506836,2191.780821917808
270,255000,Ciudad Celeste Vendo Casa 4 Habitaciones,-2.18935489654541,-79.88920593261719,944.4444444444445
216,199000,"Casa en Venta, Urb. Vía al Sol ubicada Vía a la Costa",-2.190000057220459,-80.00800323486328,921.2962962962963
105,55000,"En Venta Casa en Las Orquídeas, Norte de Guayaquil",-2.1549999713897705,-79.88999938964844,523.8095238095239
226,148000,VENDO CASA RENTERA EN GUAYACANES,-2.118000030517578,-79.89299774169922,654.8672566371681
81,55000,"Venta de Casa, Sauces 3, Norte de Guayaquil",-2.127000093460083,-79.88999938964844,679.0123456790124
100,110000,Departamanto de Venta Via la Costa Urb. Puerto Azul frente a Villa del Bosque,-2.193000078201294,-79.96700286865234,1100.0
120,95000,VENTA DE CASA EN La Joya  de 3 Dormitorios SAMBORONDON AL NORTE DE GUAYAQUIL,-2.183000087738037,-79.875,791.6666666666666
130,175000,Venta de departamento de Estreno en Via a la Costa Urb. Punta Esmeralda,-2.184999942779541,-79.97799682617188,1346.1538461538462
312,139000,"Venta casa Rentera para inversión en Cdla Coviem, Sur de Guayaquil, Paola Riofrio",-2.236999988555908,-79.90299987792969,445.5128205128205
280,115000,"Venta Casa Rentera, Centro de Guayaquil, Calle Huancavilca a una cuadra de la calle Ayacucho",-2.2009999752044678,-79.89600372314453,410.7142857142857
180,149000,"Venta Casa Urbanizacion Terranostra, cerca Portal Al Sol, Belo Horizonte, vía a la costa, Norte Guayaquil.",-2.187999963760376,-80.0,827.7777777777778
168,125000,"Venta de Departamento Lomas Urdesa, cerca Urdesa Central, Norte Guayaquil",-2.1640000343322754,-79.90699768066406,744.047619047619
170,95000,"Casa de Venta en Cdla. La Alborada, Tercera Etapa",-2.1429998874664307,-79.9000015258789,558.8235294117648
240,155000,Casa en Venta Ceibos Urb. Privada,-2.1648752689361572,-79.92205047607422,645.8333333333334
110,100000,En Venta Casa Rentera en Cdla. La Alborada VII Etapa,-2.140000104904175,-79.9020004272461,909.0909090909091
250,160000,"VENDO CASA REMODELADA, EN SAMANES 6",-2.1459999084472656,-79.88300323486328,640.0
205,205000,"venta departamento en Urbanizacion Rio Guayas Club, cerca de samborondon y c.c.policentro",-2.1659998893737793,-79.87999725341797,1000.0
104,50000,Vendo Casa en La Pradera 2,-2.2200000286102295,-79.89199829101562,480.7692307692308
189,179900,"Venta Casa Belo Horizonte cerca de Puerto Azul y de Laguna Club, Vía a La Costa 1er Retorno, Norte de Guayaquil",-2.187999963760376,-79.98100280761719,951.8518518518518
180,120000,"Hermosa Casa en Venta en Urb
san Felipe",-2.134398937225342,-79.92657470703125,666.6666666666666
84,155000,"Venta Departamento Bosques de la Costa, cerca Puerto Azul, Belo Horizonte, Vía a la Costa, Norte Guayaquil, De Estreno",-2.181999921798706,-79.97000122070312,1845.2380952380952
90,63000,"Venta de Departamento en Alamos Norte, cerca del C.C Riocentro Norte, Norte de Guayaquil",-2.1710000038146973,-79.9219970703125,700.0
150,159000,"Venta de Departamento en el Malecón Salinas, Santa Elena",-2.196000099182129,-79.91500091552734,1060.0
148,115000,Departamento Planta Baja Urdesa Norte,-2.164440155029297,-79.89893964851777,777.027027027027
250,250000,VENTA DE DEPARTAMENTO EN CEIBOS URBANIZACIÓN LAS CUMBRES,-2.1670000553131104,-79.94499969482422,1000.0
170,130000,"Venta Casa en Valle Alto Primera etapa, Vía a la Costa, cerca de Urb. Costa Real y Villa del Bosque, Norte de Guayaquil",-2.2039999961853027,-80.05999755859375,764.7058823529412
68,15000,Se Vende Casa Oportunidad Negociable,-2.231,-79.944,220.58823529411765
240,189900,VENTA DE CASA VIA A LA COSTA PORTOVITA,-2.181999921798706,-79.98500061035156,791.25
250,60000,VENDO CASA EN SALINAS DE OPORTUNIDAD!!,-2.188999891281128,-79.88899993896484,240.0
329,180000,Garzota Norte / Crédito Bancario / Biess,-2.1559998989105225,-79.94499969482422,547.112462006079
